subreddit,title,selftext,sector,created_utc
financialindependence,Request for advice,"This might be the wrong sub-reddit, but maybe you guys can point me in the right direction.

I graduated college with a degree in Computer Science. I have been working about 1.5 years as a software engineer. This work is a lot of fun. I had a lot of student loan debt after graduating (~50k). It is now down to about 14K. I have paid off all of the high interest rate loans, and I am going to start to invest whatever money I am able to save instead of paying down these loans (probably in index funds).

My issue is that I _really_ want to continue studying Computer Science. Either through school (getting a masters/phd) or independently at home (no degree). But with all the time that I spend with a full time job, I don't really have time to do this. I could get loans/grants/TA positions to be able to go to grad school, but I owe child support to my x-wife (650/Month), and I have to pay for my son's health insurance expenses (currently this is covered through my work). 

If I stop working and go back to school I would still owe this as though I were earning my current income (depends on a judge, but I most likely I would). Not complaining, just stating facts. I have thought about doing something like saving up ~60K for paying child support and using loans/grants/TA positions to afford to go to school. If I run out of money, I could just start working again. I don't think that serious part-time Software Engineering positions are really available. 

My work offers a program that it could pay for me to go to grad school. Working full-time and going to school I think would be really stressful. I know that another employee was given the option to work 32hr/week while in grad school. Would that be my best possible option? 

I know I have to make sacrifices, but I am not sure what is the best way to do this. I would prefer to be a full-time student and not have anything else eating into my time. Is this just crazy/impossible given my situation?",finance,1385931509
personalfinance,Ally vs Bank of Internet?,"I've been looking at opening up an account with Ally for a while as I'm not too thrilled with my CapOne 360 interest rate, and ATM fee reimbursement would be nice as well. I recently found out about Bank of Internet but I'm not sure how they stack up against Ally. Would anyone like to offer their opinions on the two banks if you're a customer of either? If you're a customer of both which do you like better?",finance,1385930990
Bitcoin,Experiences selling on coinbase?,"I've tried searches on bct and elsewhere and can't seem to find a lot of info about people's experiences selling on coinbase. I've read a lot of horror stories of people buying there and getting flagged high risk. After being fed up with CampBX's sluggishness, I got my account l1 verified on coinbase and sold significant coin in the last couple of days. I see the market is now taking a dump, so am concerned that the sells I did might get high risk cancelled now. Unfortunately from my research there just doesn't seem to be a lot of viable alternatives for US residents, and there are additional IRS concerns with doing a lot of trades on foreign exchanges.

I am hoping everything goes smoothly with coinbase, it would be helpful to hear others' experiences selling there and if they have a tendency to cancel sells.",cryptocurrency,1385926470
Bitcoin,Haters create opportunity,"Evidence:

10. ""A rocket will never be able to leave the Earth’s atmosphere."" — New York Times, 1936. Of course, this prediction was published; there had to have been countless other prominent figures, even in that industry, who must have scoffed at the idea of reaching the moon. After all, it was the 1930s.
9. ""Heavier-than-air flying machines are impossible."" — Lord Kelvin, British mathematician and physicist, president of the British Royal Society, 1895. Flying in the air must have been a dream to some and an impossibility to others back in the late 1800s. This concept has been most recently revisited in the remake movie: Around the World in 80 Days. Lord Kelvin was featured in the film.
8. ""TV will never be a serious competitor for radio because people must sit and keep their eyes glued on a screen; the average American family hasn't time for it."" — New York Times, 1939 There's not a whole lot to say about this. Television is one of the top ten inventions of all-time; probably top three, along with the telephone and automobile.
7. ""This ‘telephone’ has too many shortcomings to be seriously considered as a means of communication. The device is inherently of no value to us."" — A memo at Western Union, 1878 (or 1876). The telephone has, of course, since gone wireless, and we ask ourselves today, ""Where would we be without it?"" Put your cell phone away for an entire week and you'll see how difficult it is to get things done. And, without any phone at all, the modern world as we know it might as well be referred to as the Stone Age. Also, what on earth would we do without catchy songs (i.e. Lady Gaga's Telephone)?
6. ""Everything that can be invented has been invented."" — Charles H. Duell, U.S. patent office official, 1899. Was Mr. Duell wrong? Well, check out this list of inventions and see how many appeared after 1899. That'll give you a rough idea. I bet Duell regrets the remark, especially if he saw the absolute marvels of shopping carts and automatic doors at his local supermarket.
5. ""I am tired of all this sort of thing called science here ... We have spent millions in that sort of thing for the last few years, and it is time it should be stopped."" — Simon Cameron, U.S. Senator, on the Smithsonian Institute, 1901. This 'science' thing has proven to be quite an asset. That one German fellow did quite well with it.
4. ""Who the hell wants to hear actors talk?"" — H. M. Warner, co-founder of Warner Brothers, 1927. Apparently millions upon millions of people who are willing to spend millions upon millions of dollars. Take a look at a list of the highest-grossing films of all-time. Note: James Cameron directed the top two.
3. ""The truth is, no online database will replace your daily newspaper, no CD-ROM can take the place of a competent teacher, and no computer network will change the way government works."" — Clifford Stoll, Newsweek, 1995 The accuracy of his statement must burn him to this very day. Why, according to Mr. Stoll, I would not be able to share this information with you! Stoll may just be the last daily newspaper subscriber in America.
2. ""The horse is here to stay but the automobile is only a novelty – a fad.” — The president of the Michigan Savings Bank advising Henry Ford’s lawyer, Horace Rackham, not to invest in the Ford Motor Co., 1903. If the world, especially America, were to go without cars, a collective gasp, followed by sobs, would be heard throughout the nation. Ride horses everywhere? What are we, cowboys?
1. ""There is no reason anyone would want a computer in their home."" — Ken Olson, president, chairman and founder of Digital Equipment Corp. (DEC), maker of big business mainframe computers, arguing against the PC in 1977. To this, I simply say, does Mr. Olson own a personal computer now? 

h/t http://digitaljournal.com/article/291152",cryptocurrency,1385923582
gaming,WoodysGamertag Tumblr description,"""I have single handedly defended a small African village with nothing but a wooden spoon.
I have surfed a tsunami on a board I crafted myself from what was left of a sinking ship.
I have convinced cannibals not to eat me because of poor taste after showing them my Justin Beiber CD collection.
I invented the internet.
My tears have purified water for societies in India without proper filtering facilities.
I learned to communicate with dolphins through a series of clicks and squeaks.
I survived over 15 seconds with Joe Lauzon in the Octagon.
I play video games.""",technology,1385922684
Bitcoin,"If Bitcoin is a PonziScheme then Fiat Currency is a Ponzi Scheme, a response to ""Bitcoins: The Second Biggest Ponzi Scheme in History""","----&gt;www.garynorth.com/public/11828.cfm

Many of his statements are posed as arguments but lack any in-depth analysis and he cites few examples of his own advice, and almost seems to argue FOR the adoption and viability of Bitcoin: 

""Note: any time you see a proposal of a new form of money, hold on to your old form of money.

""The central benefit of money is its predictable purchasing power. A monetary commodity is not easy to produce. The cost of mining is high. Money is slowly adopted by a large number of participants. These participants use money as a means of exchange. Why? Because it was valuable the day before. They therefore expect it to be valuable the next day. Money has continuity of value. This is not intrinsic value. It is historic value. So, a person can buy money by the sale of goods or services, set this money aside, and re-enter the markets in a different location or in a different time, in the confidence that he will probably be able to buy a similar quantity of goods and services.

""Money is not accumulated for its own sake. It is accumulated to buy future goods and services. It is useful in the facilitation of exchange precisely because its market value varies little over time. It is the predictability of money's market exchange rate that makes it money.""
His is almost an outline for the adoption of a new money.   He leaves out the fact that it has the added benefits of being a decentralized and digital currency, nearly instantaneous in transfer, without a middle-person and the potential for complete anonymity without the need for money laundering. People will launder money anyway to avoid becoming a tax base of governments, organizations which are now under increasing scrutiny and suspicion for creating the very terrorists they claim to be defending us from.  Money laundering, much like the war on drugs, perpetuates the power of organized criminal enterprises.

The Federal Reserve is a private organization, and is it's own ""Federal Reserve Wanna-be"". The control of our monetary system was handed over to private banking interests? Another reason why non-centralized digital currency is the asset transfer of choice for those of us who consider the banking system one of THE most corrupt institutions we are deceived to take for a granted good. BTc may not wind up being THE sole goto currency, but for now it is must gain value until minor fluctuations in it's over-all rational value, a change perhaps ±0.00001% every day decided by the market and not by a group of rich men behind doors deciding on the value of precious metals as a trade commodity. If a few people end up hoarding the majority of Bitcoin then it's value of adoption can be rejected and a new currency will spring in it's place. Isn't this the true value of a pure, object-oriented currency?",cryptocurrency,1385917952
Bitcoin,The mystery of Satoshi Nakamoto continues...,"I wrote about Paco Ahlgren a while back. I read his book a couple of years ago, and some people were talking about him being Satoshi Nakamoto. It was an interesting theory then, but I didn't pay any attention and nobody else did either.

When Bitcoin started taking off earlier in the eyar and then again in the last month I started thinking about his book again (Discipline). The higher the price went, the more it kept coming back to me. Then the government stepped in and called these hearings and the similarities seemed to be too much.

In the book, Ahlgren writes about a global financial collapse. He talks about Fed intervention, and eventually the breakup of the U.S. and the collapse of the dollar. But here's the catch -- when the dollar fails, a new private currency takes its place. It isn't created by one person, but by a group of people.

The first time I read the Discipline, I was into Bitcoin, but I didn't really believe the world was going to take it seriously, at least not this fast. So the book didn't really stand out. It was interesting, but it was just a book. I read some threads suggesting he was Satoshi, but they died.

I read Discipline again last week, and I've had a hard time sleeping ever since. First of all Ahlgren wrote the book in 2001, and published in 2007 .... two years BEFORE Bitcoin existed.

I still don't think he did it by himself though. I don't think Satoshi Nakamoto is a single person. It seems like it would be impossible for jsut one person to do all of this by himself. It seems more likely that it was a team, and I am not convinced Ahlgren was a part of that team.

The second thing that gets me is that he talks about how the government deals with the currency .... politicians, and all that. It's crazy how similar it is to what's going on right now. (NSA?) He also talks about other private currencies appearing. And he talks about how the government tries to track down the creators of the currency.

One of the things that turned me off about the Discipline currency was that it was centralized. There was a group of ""good guys"" who controlled it and helped distibute it around the world. They used gold to back the currency. Once I read that, I didn't think there was any way Ahlgren could be Satoshi.

But the reason I picked up the book again was because I started thinking. If Ahlgren was Satoshi (or part of the Satoshi team), would he really want to put the Bitcoin algorithm in print 2 years before it was complete? And if he was planning on maintaining anonymity, he wouldn't want anyone making the connection. That sort of intentional obfuscation seems exactly like something team Satoshi would do.

Also, what if he was hoping his book would sort of get everybody ready for the idea of Bitcoin? Or maybe he was hoping Bitcoin would help sell his book! But either way he wouldn't want to connect himself too closely with Satoshi and Bitcoin. And doesn't that also just sound like something Satoshi would do? And then the whitepaper came out in 2008, less than a year after the publication of the book. Coincidence?

The more I thought about it, the more I had to read the book again. The reason I read it the first time is that the Amazon reviews were fantastic, and I thought what the hell? I don't think its the best book I ever read (although it's pretty damn good). But because of the Bitcoin connection, it took on a whole new meaning for me. Mostly I hoped I was full of s*it, and reading it again would convince me for good that I was just day dreaming.

But that's not what happened at all. The whole book is like a puzzle. It's a loop, and there were so many details I didn't catch the first time. More than anything, I was hit by the fact that Ahlgren predicted so many events long before they happened. His descriptions of unrest and terrorist acts are right in line with what's going on today in the world, and it all ties into the currency and the Fed.

I'm not a conspiracy theorist, but this is weird. Also, his Wikipedia page used to talk about Bitcoin (and how he denies any involvement) but that section was removed. Why would he remove that? Or why would someone else remove it? Oh, and here's a big shocker. He's an Austrian economist, a financial analyst, and a programmer.

The last thing that got me was that Ahlgren came out a couple of years ago and said Bitcoin was doomed to fail in a blog entry. Then he deleted the post from his blog immediately (like the same day). There was a bunch of discussion about it, and he reposted it. But here's the kicker. As far as I can tell, he hasn't written one thing since -- not any articles, no books, nothing. His Facebook pages are pretty much dead.

So why does an author who writes a book with great reviews and good sales suddenly just disappear? Am I the only person who thinks that's weird?

He lives in Austin as far as I can tell, and he has a Linked in page, but that's about all I could find (other than interviews and articles from way back). I even tried emailing him (from his site), but he hasn't responded. His background is both in finance and programming and apparently he's some kind of a ""security expert."" That at least makes him a candidate.

My curiosity is peaked now. Has anybody else come across any information about Paco Ahlgren, or heard about any possible connections between him and Satoshi Nakamoto?",cryptocurrency,1385915408
politics,"Nearly a year after energy giant BP cut a deal to a resolve a criminal investigation of its role in the nation's worst offshore oil spill, a jury is set to hear the Justice Department's case against a former company employee accused of trying to stymie the federal investigation",,energy,1385915040
Bitcoin,Currencies should not fluctuate in value as wildly as bitcoin does. This is why central banks are important.,"The fact that bitcoin has skyrocketed in value like a tech stock in 1998 means that there is suddenly a much larger demand for bitcoin relative to the number of bitcoins in circulation than even a few months ago, correct? Well if bitcoins is to gain traction as a medium of exchange, what needs to happen is that the number of bitcoins need to be increased in order to meet the demand- the digital equivalent of running the printing presses. In fact, this is why the US dollar loses value over time: as the dollar economy grows (both inside and outside the US), more dollars are needed to facilitate more and more transactions. 

If the Federal Reserve had stopped creating money in 1950, the US economy would have been depressed for like the last 50 years even though a single dollar would be able to buy a lot more food (for example). In this type of situation, we would see a whole lot more hoarding of money and less spending of it. This is where bitcoin is headed; the top 100 individuals with the most bitcoin currently have 20% of the currency, leaving a fairly small amount of ""free floating"" currency that is changing hands. 

I am not necessarily predicting doom for the currency right now, in fact I will probably buy some since I believe the bubble won't burst for at least a few more months or so, but burst it will some day. See links below.
http://rt.com/op-edge/bubble-trouble-looming-for-bitcoin-469/
http://www.economonitor.com/blog/2013/11/bitcoins-dollars-and-renminbi/",cryptocurrency,1385878974
CryptoMarkets,Fed Up With Bitcoin? Here's How To Start Your Own Currency,,cryptocurrency,1385870878
economy,Powerful Combination: The Fed and Market Seasonality,,finance,1385870625
