subreddit,title,selftext,sector,created_utc
gaming,THE FUTURES SO BRIGHT - By Deep Seeded Geek,"Recently, I read a book called “Ready Player One” by Ernest Kline.

The book takes place in the not too distant future where most of the population has retreated to living in a virtual reality called the Oasis. Imagine if World of Warcraft engulfed the internet and everyone could access it for free with the use of V.R. Goggles and Haptic gloves. Within this world lives the protagonist who, like many others, is on a quest to find hidden clues within this world that would grant them ownership of the entire Oasis. This is a book written as a love letter to all of us who grew up geek. 80's pop culture, video games, cartoons, sci-fi, everything gets a tip of the hat throughout the book. And many ideas are presented to the reader that stick with you long after the finale.

Which leads me to the topic for today. In the book, the education system has changed dramatically from what we know today. Because everyone had become so obsessed with the Oasis, the board of education had decided to incorporate it into their way of life. Meaning you didn't have to physically go to school anymore, but your virtual self was required to by law.

How it worked was that anyone under the legal age was required to be logged into between a certain time to attend a virtual school. At any time, there could be students into the thousands all sitting in to listen to the same lecture being given. The beautiful thing about it was that it allowed everyone to get the same standard of education...and it was free!

Now this wasn't just a classroom like we know it today, this was still a virtual world. So say a science teacher was giving a lecture on the planets? Well there is talking about it...and then there's being able to transport every student to one of the asteroids floating within Saturn’s rings and see it first hand. Or reenacting the fall of Rome as a spectator or soldier. Or how about watching a performance of Hamlet in a recreation of The Rose Theatre in the actual time period? Education becomes a much more tangible and desirable thing.

When I finished the book, this was a topic I kept coming back to. For a long time I was left wondering, could that be possible? How close are we to that becoming a reality?

Before I answer that, I want to share a few discoveries I've come across in the last little while.

Many of my clients are educators in grade schools and high schools throughout the city. It's not surprising to hear how the teachers have incorporated the use of tablets and smart-phones into their everyday use, but they've gone so far as to allow their students to use them as well. And in some instances, the school provides them the devices for use in the classroom! I can see where their line of thinking was where they want to get the kids excited and interacting with their lessons...but at the same time, I see this as being a defeatist approach thinking that, “Well we can't get them to stop texting during class, might as well try to bring it into the fold.” I don't see it working out the way they hope it will, but time will tell on that.

To take it a step further, one school that I know of has adopted the use of Smart Board technology into their classrooms. It's essentially an interactive white board with touch capabilities that can also double as a standard PC. That sounds a little closer to the idea of bringing an interactive media to the classrooms, where it would combine the old over-head projectors with a chalk board AND the old film projectors as well. It's like Apple's version of a chalk board. An iBoard!

Quite possibly my favourite example of this idea becoming a reality is finding a plausible reason that a school would ever allow what is essentially a video game to be used during a lecture.

To my surprise, the answer came in the form of Minecraft!

In the documentary for the video game, we are introduced to Minecraft.eu. A program that is bringing Minecraft into schools around the globe. Used by teachers and students. The game has been a huge success in not only getting students excited about school, but has also had staggering success in improving overall education. My favourite instance in the film was where a parent tells the filmmakers that he doesn't have the heart to say to his child, “Time to turn off the video game” when he looks over to see his young son figure out all on his own how to build a working aqueduct to build his crops in the video game.

I DON'T EVEN KNOW HOW TO DO THAT!!!

Now that's the educational side. From the technology side, this year alone in we are going to see the introduction of Smartglass integration with Microsoft and Xbox, V.R.  technology become a reality with devices like the Oculus Rift bringing your field of view into the 3D game world. And if that's not enough, just a few years back someone had the idea to make the ultimate gaming environment incorporating 360 degree view, body scanning motion technology, multi-directional treadmills, and paint balls simulating impact, to create the most realistic first person shooter experience.

The technology is all there. The schools are already in the game. The future could be closer than we all think.

And still...we don't have flying cars!? I mean what the hell???

But enough ranting from me, let's hear from all of you! What is your opinion on future tech and it's implementation on our daily lives?

And as always, if you want to watch the video version of this topic, you can find me over on YouTube as Deep Seeded Geek.

Take care everyone!",technology,1360198294
Bitcoin,Federal Reserve Hacked,,cryptocurrency,1360198277
technology,Anonymous Hits Federal Reserve in Hack,,technology,1360195864
personalfinance,Does this make sense? I need help and critiquing is welcome!,"Just paid off my credit card debt thanks to you guys! You all have really helped me out and encouraged me, thank you so much! Now on to student loans and savings....

I've heard that to tackle loans you always go after the one with the highest interest rate. In my case I have the following loan amounts and interest rates:

Citi Loan:
$4,981- 4.25%
2,899- 2.75%
3,082- 3.5%

Discover:
$6,030- 3.5%

Government loans-
$34,035- all at 6.8% (about five loans make up this amount, all the same interest rate)

I have ~$1,400 per month to put towards these loans but I also want to put half of that to savings. My question is, should I tackle these loans right now or just put all of it towards saving (emergency fund and house downpayment)? If I do put half of that $1,400 towards the loans do I put it towards the ones with the highest interest rate? That's a government loan so it seems like it could be more stable versus the private loans through Citi and Discover. 

So, any guidance would be welcomed. Again, thank you so much for your support, it was great seeing a zero balance on my Visa statement! :)",finance,1360362537
gaming,Giant Stuffed SNES Controller Pillow,,technology,1360361643
politics,"Pass the ACHE (Appalachian Community Health Emergency) Act--""Place a moratorium on new mountaintop removal mining operations while the first comprehensive federal study of the health dangers is conducted.""",,cryptocurrency,1360358899
economy,The relentless punishment of the American saver. Fed policy has encouraged spendthrift attitude and yield seeking behavior from Americans.,,finance,1360358211
personalfinance,Should I pay off my student loans in full?,"I owe $13,300 in federal sub/unsub stafford loans at 6.5% interest. 

I have:
$1,800 in checking account

$1,100 in a taxable investment account

$1,700 in an orange online savings account

$16,000 in my credit union savings account 

I'm also expecting roughly $2,000 back in taxes. (Working on adjusting that for this year, don't yell at me!)

I take home a little over $4,000 monthly

I want to get rid of my loans, but the thought of forking over such a large sum makes me itchy... What would /r/pf do?",finance,1360356992
technology,Google: Self-driving cars in 3-5 years. Feds: Not so fast,,technology,1360352155
personalfinance,Use 0% Balance Transfers to pay off credit cards?,"Hi r/personalfinance,

I have three maxed out credit cards to pay off, Visa ($8,000 balance), MC ($6,000 balance) and Store ($3,000 balance). The interest rate on all of them is the same (19.99%).

I have calculated the math, and based on my budget and income, I should be able to pay all of them off by the end of the year. However, the Visa sends me offers every couple months for 0% transfers. The transfer fee is 1%, and the current offer is 0% interest until November 2013. There are no limits (apart from my credit limit, of course). 

Would you recommend throwing all my payments (twice monthly) at the Visa, then immediately transferring out funds at 0% (plus the fee) to the other cards? If I have it figured out correctly, this would gradually turn my ~20% Visa debt in 0% debt , due to the new laws saying that highest interest debt gets credit applied first, after min payment, while simultaneously paying off the other two. Of course, once the other two are paid, I will pay down the Visa balance.

Thank you for your help!",finance,1360351946
personalfinance,Note from USAA that third party credit card processor compromised? Who is it?,"I have no idea if this is the right subreddit, sorry if it's not.

I just received an email from USAA saying: *We were notified by a payment processor that your USAA Federal Savings Bank (USAA) debit card information, such as your name, debit card number and expiration date may have been compromised. Unauthorized access to non-USAA systems may have occurred through a merchant where you shopped or dined, or by other fraudulent activity. Specific details about the compromise were not reported to USAA.*  I called them to find out which processor it was, but they ""don't have that information"". So I was escalated to another person who ""doesn't have that information"". My third escalation point is supposed to call me back.  Any idea who it was?

I do understand that it is NOT USAA that was compromised. I'm just trying to find out who it is!",finance,1360351042
personalfinance,Student loans with different interest rates under one account: Should I be able to apply payments only to the higher interest rate loans?,"I have 6 US DoE stafford loans that are serviced by GreatLakes that are separated into 3 accounts:

**Account #1**

* Subsidized: $5,031 @ 5.35%
* Unsubsidized: $2,073 @ 6.55%

**Account #2**

* Subsidized: $5,014 @ 4.25%
* Unsubsidized: $1,947 @ 6.55%

**Account #3**

* Subsidized: $3,207 @ 5.75%
* Unsubsidized: $2,206 @ 6.55%

My automatic payments to each account seem to be applying an equally distributed payment to each loan's principal, and if I want to make a one-time payment online it only lets me pay towards the ""account"" rather than an individual loan within it. What I'd like to do is make one-time payments to pay off each of the 6.55% loans and ignore the other ones, but I don't see *any* information on their site about doing this.

Has anyone had experience dealing with a similar situation, through GreatLakes or otherwise? Should I be able to pay towards the individual loans in these accounts? If so, how?",finance,1360347642
personalfinance,"College senior, would like advice on paying off debt.","Here's my situation. I'm 22, set to graduate in May. I don't have a big kid job lined up, but I should be able to keep my current job if I can't find anything. I make ~$1000 per month gross, but after taxes and any time I take off, it's more like $750-800 a month. I just financed a $6500 car because my old one had major issues and it was costing me way too much in repairs, and I needed something reliable to get to work and school. It's a 4 year loan. I still live with my parents and they pay for the necessities like food and shelter.

I have about $500 in my checking account as I write this.

Here are my monthly expenses:  
$160 car payment  
$120 gas  
$70 car insurance  
~$50 health/medical (I don't pay for health insurance, but I pay any copays or prescriptions. It's high right now because I have some health problems I'm trying to get resolved.)  
~$150 food (I can eat the groceries my family buys, but I pay for the snacks I bring to work, any fast food I buy, or any restaurant meals. Between work and school I have like 60 hour weeks, and I often don't have time to stop at home and cook, so I get a lot of fast food.)  
~$100 miscellaneous like clothing/gifts/etc. I'm trying to rein this in, but I've been really stressed lately so I make some impulse purchases to make myself feel better.  
$25 minimum payment on the credit card I carry a balance on

Debts:  
$6300 left on my car loan at 7%  
$1630 on a credit card at 0% until January 2014, 19% after that  
$2200 student loan debt at 6.8%, unsubsidized so it is currently accruing interest  
$300 on a credit card I pay off every month at 19%

I'm trying to figure out which to pay off first. I'm somewhere between the debt avalanche and debt snowball camps...I want to pay off smaller debts first if I can, but if there's a 7% difference in the interest rates, then maybe not. I also need to get the timing belt replaced on my new car in the near future, it's about 30k miles overdue. It will cost about $600.

**Tl;dr: In-debt college senior, trying to figure out what to do with extra income.**

Edit: Forgot to list my minimum payment on my card under expenses.",finance,1360347283
technology,Meet the Detective Who Handcuffed Intel's Packet of Death | Wired Enterprise,,technology,1360338060
technology,Google: Self-driving cars in 3-5 years. Feds: Not so fast,,technology,1360338059
worldnews,Home loan interest rates,,finance,1360337098
Economics,Fed Has Bought More U.S. Gov’t Debt This Year Than Treasury Has Issued,,finance,1360333429
finance,"Monetary policy in Japan: Win some, lose some",,finance,1360333375
personalfinance,Mid career pension freeze,"Here's a story of how life turns out when you have a retail management career, no money to invest early in life when the economy is good, and later, when you can afford to invest, it's impossible over the 2000-2012 decade to make much return on your investments. 

Just got a notice in the mail today, current employer (major retail chain) froze the pension plan at age 54 with only 10 years on the  job.  That will translate to a meager $700 a month at 65 with no possibility of increasing.  

Sure we have $130  in a 401k and $85 in IRA's, but  as everyone knows, mid career conversions in your 50's from defined benefit pension to 401k cuts your monthly income at retirement in half, even with enhanced contributions from you and the employer, and that assumes you have 20 years in the pension fund, not 10.

The problem is our 401 k is not what it should be at 50 had we saved since 30, nor have we already accrued 20 or 30 years of defined pension contributions because every employer went bankrupt a few years into working there.  At every turn in this business, the employees have been shafted.

We're talking 4 major national retail companies that went out of business and stiffed their managerial employees for their pension. With a family to support, there was no money or time for college, which means each time a company went under there was no way to change careers either, just had get another managerial  job at another retail chain that seemed good for the long haul.

The reason there's only 10 years on the job here is because the last employer went out of business at age 44 with 6 years on the job, leaving only $ 20k from their pension plan to roll over into an ira that's now worth $30k.   

Before that, there was the 3 years working for low salary at a company that went out of business and left only $9k from the pension plan that got spent on credit card debt.  During that time we were also paying off the wife's student loans.

Before that was 4 years at another company that didn't offer a retirement plan at all, and before that there was the 3 years at the company that sold out to that one, before being vested in their pension plan.

And before that there was a failed attempt at self employment that left us $25k in debt thanks to the 1985 oil bust.  But by golly we paid it all off and didn't declare bankruptcy!

During those early years there was never any money for saving, we lived paycheck to paycheck raising 2kids, paying a mortgage, paying off the business debt, buying used cars, forgoing luxuries, skimping on necessities.   i'm talking buying kids clothes at thrift stores, getting birth control and free vaccinations at the health dept, clipping coupons, living on donated furniture, etc.

So when the kids went to college although salaries were improved by then we had no college savings, and had to take out PLUS loans for $ 100,000, for the 2 kids, rolled half into the 15 year mortgage and the other into a 5 year 401k loan.  We also paid cash out of pocket for their living expenses which came to $12k a year.

But by golly we never declared bankruptcy and paid every debt, that was important, as was putting the kids through college so they could start out with a better advantage than we did.

So here we are age 54 and only $200k saved for retirement and now we learn the pension will never exceed $700 a month all the while talking heads espouse cutting social security benefits. We still owe 3 years $35k on the 401 k loan, 12 years $171k on a $230k house, and 4 years $ 25k car loan, no credit card debt.  Is it time to leave this employer?  Or is it advisable to stay?

  Theoretically if this company doesn't go under we might could get it all paid off, but how to add to the 401k?  And with the track record of retail, what confidence can there be this company will still exist in 5 years.

Playing catch up on the 401 k is difficult since we had to lower the contribution by 10% to be able to afford the $900 a month PLUS loan payments.   Might could have squeezed another 2% into the 401k  contribution but then wham came the payroll tax increase.  So now its down to 2% until the loan is paid off in 3.5 years, at which time we can accelerate mortgage payments or max out 401k or some combo of the two. 

Part of this problem is the youngest son just graduated and is still on our insurance so we are paying a lot more than we should be. We have been on him to find a job with health benefits but he can't possibly afford his meds on his hourly $11 an hour job if we kicked him off the plan before then.  That problem will resolve itself next year when he turns 26 one way or another. 

So if any of you has any ideas how to parlay $ 200k  401k into a $4000 monthly  fixed income in 15 years, I am all ears.   Btw we already keep $5-10k in liquid savings for emergencies, already  have a Christmas savings fund, and plan to stay in this house until it is paid off at age 65.  The 401k money is half bonds/fixed and half s&amp;p index funds.

Medical bills are normal, kids are moved out, and we don't supplement them.  We live fairly frugally, already cut the cable cord and pay only $ 25 a month for netflix/hulu, and try notbto waste electricity, water, or gasoline.  on nice days we even ride bikes to the supermarket.  in the past we spent $1000 every Christmas on family outings but we have decided to stop that after this year.  We also recently decided to cut back on gifting, and have no plans for vacations or major spending.  We were going to do some house redecorating before the pension news, but those plans are off now.  

At this point we are considering taking boarders or foster kids for added income. Any advice on that?",finance,1360314030
Economics,It's getting close to that time of year again... re-introducing Fed Valentines!,,finance,1360311534
finance,SBI Gold Loan,Borrow money for any purposes. Gold Loan can help in fulfilling your wishes at cheapest interest rate. Compare and find the lowest rate from SBI Gold Loan. Apply Online / Call 600 11 600.,finance,1360307574
personalfinance,I'm planning to buy a home within the next few months. Should I hold off on applying for another credit card?,"I'm in good financial shape right now. Just turned 30, make a decent amount, no debt, currently renting, and have a 700+ credit score. My new job requires that I travel often, mostly out of country. I usually spend about $500 USD overseas a month. 

I have 5 credit cards, but actively only use 2 (AMEX, Chase), both of which are about 2 years old. The other three are older ones that I just keep around (8-10 years old). I always pay off the full amount every month. All of these cards charge a 3% foreign transaction fee.

I was looking at applying for the CapitalOne Cash Rewards card, because of their no foreign transaction fee. However, I'm worried that this will negatively impact my credit score enough to affect potential interest rates for a home purchase. I'm still in the market for the right house, so it could be anywhere from next week to a year.

Should I just wait until after I purchase a new home? Or is the effect of my credit score being negatively impacted be minimal?",finance,1360305566
personalfinance,Enlisted in the Navy have no real financial plan as of yet,"Honestly I'm not even sure where to start, but as for now I have no debts, no income, no dependents, and no bills to pay, but as for what to do financially I'm currently pretty lost. 

That probably isn't enough information to fully explain my situation but if there's anything else you guys want to know just ask.

Also enlisted as an E2, which I believe will put me at around $1700 a month. 

Edit- I somehow forgot to mention I ship off to boot camp in May.

Edit- Also wondering what I should do as far as banking options are concerned, Navy Federal Credit Union? USAA? Apparently I can get a military account at Chase too, any other options I should consider here?

Edit-As for future plans I was planning on making use of Tuition Assistance as much as I could during my 5 years active and then school after I get out with my GI Bill. 

Where purchases are concerned I do need a car when I get back for various reasons but my plan was just buy something cheap and relatively reliable and that I can do most of the work on myself as I'm fairly mechanically competent and getting further training due to my job (Machinst's Mate) in the Navy. 

I also have no plans to buy a house or anything big in the near future really aside from that but as for any other expenses I might have I'm not entirely sure.  

I'm not entirely sure what I should be doing so just a general idea or some tips regarding my situation or any ideas for a budget plan would be appreciated.",finance,1360300084
