subreddit,title,selftext,sector,created_utc
investing,"Uranium Spot Prices Dip, but Outlook Strong","By Melissa Pistilli - Exclusive to Uranium Investing News

The uranium spot price fell 50 cents, to $43 per pound U3O8, this week; however, according to TradeTech, deals involving delivery later in the year concluded higher than those involving immediate delivery, which means that the market should see higher prices later down the road.

A number of major producers have reported increased production levels for 2012. Total uranium output from AREVA’s (EPA:AREVA) operations reached a record high of 9,760 tonnes in 2012, a company press release notes. Rio Tinto (NYSE:RIO,ASX:RIO,LSE:RIO) also posted positive production results for the year, according to TradeTech. Total uranium production from its operations in 2012 increased 38 percent over 2011, reaching nearly 9.8 million pounds U3O8. Paladin Energy (TSX:PDN,ASX:PDN) reported H2 2012 output of 4.12 million pounds U3O8 — an increase of 34 percent compared to the same period in 2011, stated Energy Business Review.

The US Department of Energy (DOE) is set to release a draft environmental impact statement this March concerning 31 uranium mining leases covering 25,000 acres between Naturita and Moab, Utah, reported the Telluride Daily Planet. The federal agency is hoping to overturn an October 2011 federal court ruling dictating that it cease mining-related activities through its leasing program due to a number of environmental concerns. Energy Fuels (TSX:EFR), which operates the Piñon Ridge mill, owns some of the 31 DOE leases, which could supply ore for the mill.

In May, International Atomic Energy Agency (IAEA) officials will be visiting Tanzania to assess preparations for uranium exploration at the Mkuju River uranium project, reported local Tanzanian publication The Citizen. The Tanzanian government is expected to sign a Mining Development Agreement with the project’s developer prior to issuing mining licenses. The project would make the East African nation one of the top 10 uranium mining countries on the African continent.

Hongyanhe, China’s first nuclear plant post-Fukushima came online this week, reported United Press International. One generating unit is now operational and construction of the entire plant, which will consist of four power-generating units, is expected to be completed by the end of 2015. Two additional power-generating units will follow in 2016. Once completed, Hongyanhe will generate 45 billion kilowatts of electricity per year. China has a goal of 70 gigawatts of installed capacity by 2020 and is expected to reach 42 gigawatts by 2015.

Russian and Jordanian leaders are meeting this week to discuss Russian aid in uranium mining as well as in building the Middle Eastern nation’s first nuclear power plant and the necessary infrastructural development, according to the Azeri-Press Agency. Russia’s Rosatom is a contender for a potential contract to build the plant.

The Japan Atomic Power Company and Marubeni Utility Services signed a memorandum of understanding with the National Nuclear Center of the Republic of Kazakhstan for cooperation in building the first nuclear power plant in the Central Asian nation. “Areas covered by the latest MOU include cooperation on project development, human resources development, feasibility studies, and the construction and operation of a nuclear power plant,” a World Nuclear News report states. The agreement follows earlier deals, signed in 2007 and 2010, which arranged for cooperative studies to determine the feasibility of constructing nuclear power plants in Kazakhstan.

South African government officials announced this week that the country, which currently obtains about 90 percent of its energy from coal, intends to construct additional power plants. South Africa is home to the continent of Africa’s only nuclear power station. Speaking at the Africa Energy Indaba conference in Johannesburg, Energy Minister Dipuo Peters said his country cannot underestimate “the role that natural gas and nuclear power can play in the realization of that 2030 low carbon energy vision,” the Global Times reported.

Company news

Uranium Resources (NASDAQ:URRE) restructured its financial surety bonding for reclamation activities at its South Texas projects. Under the new arrangement, the company has secured $9 million in new surety bonds that require only $4.5 million in cash collateral compared to the existing $9 million in fully collateralized bonds. That will allow the company to return $4.5 million to its treasury.

“The restructuring of the bonding on our South Texas properties is a meaningful step forward as we continue to work on recapitalizing the Company, while simultaneously lowering our cost structure,” stated Terence J. Cryan, interim president and CEO of Uranium Resources, in a press release. “The additional capital provides added flexibility to advance our near-term priorities, which are focused on developing our significant New Mexico uranium assets, as well as maintaining our restoration activities in Texas so as to be positioned to restart uranium production in South Texas in the future.”

Alpha Minerals (TSXV:AMW) and its joint venture partner Fission Energy (TSXV:FIS) released additional results from the drill program on the Patterson Lake uranium project in Saskatchewan. “The highest point reading of the high grade was 76,233 cps. The high grade section within the Upper Zone includes: 20 meters from 87-107 meters down hole greater than 10,000 cps [including] 9 meters from 96-105 meters down hole greater than 45,000 cps,” states the press release. Further results will be released when data compiling is completed.

Macusani Yellowcake (TSXV:YEL) announced the first drill results from its campaign on the Tupuramani property in Peru. “The results to date are similar to the drilling intersections obtained within Colibri 2 &amp; 3 with multiple wide intersections of up to 60m thick, from surface, with uranium grades ranging from 0.3 to 0.6 lbs/ton within the first 100-110m from surface,” states the news release. The company is currently operating two drills on the property.

“These new uranium assays from drilling at Tupuramani demonstrate the real economic potential of the Colibri 2 &amp; 3 sector of the Macusani plateau,” commented Dr. Laurence Stefan, president and CEO of Macusani. “If positively confirmed by drilling this mineralization style has the potential to become a significant open pit mining resource,” he added.

 [Resource Investing News](http://resourceinvestingnews.com)

Securities Disclosure: I, Melissa Pistilli, hold no direct investment interest in any company mentioned in this article.",finance,1361463218
politics,"Jesse Jackson Jr. used campaign funds to buy $7,000 elk head, $4,200 fedora and $5,000 of fur capes",,finance,1361462964
technology,Crowdfunding The Push For A Federal Anti-SLAPP Law To Protect Free Speech,,technology,1361461248
gaming,"Watch Dogs or, as I’m calling it, Desmond Miles’ Second Chance","Yesterday we saw some more Watch Dogs gameplay footage as the game was announced for PS4 by Ubisoft. In case you don’t know, Ubisoft is responsible for Assassin’s Creed and I must confess to you that I’ve always been a fan of the series. Also, I’ve always been very interested in everything that is related to history and Ezio, Altair and Connor always fed me the need to materialize and revisit places that only through digital historic recreation would be possible to visit. However, I’ve always felt like the Desmond parts, that sort of connected the whole thing, were kind of rubbish or at least not in line with the quality of the rest of the medieval and modern stuff. In Assassin’s Creed III there was a small level that approached my idea of a modern-day assassin, when Desmond climbed its way up a skyscraper but it wasn’t enough.

Then I saw Watch Dogs gameplay yesterday and I thought: “wait a minute, this is it! Desmond parts should have been like this.” Why did Ubisoft hold this off? Well, probably because they thought they could make another game with it. Watch Dogs has Assassin’s Creed written all over it. You don’t believe me? Watch it carefully and notice the parkour moves in the open world, the image glitches, the UI.

In Watch Dogs you are Aiden Pearce who’s a hacker in Chicago. The gameplay lets you use extensively the open world and interact with it through your hacking gadgets. The quest system appears to be very similar to Guild Wars 2 based on dynamic events happening around you. You invade the privacy of people around you while trying to avoid the cameras that watch your movements around the city. It’s one of those games that makes you think about the world that surrounds you nowadays.

I do believe this could have become the Assassin’s Creed IV. What will become of the Creed after Watch Dogs? in http://overhypedgames.wordpress.com/2013/02/21/watch-dogs-or-as-im-calling-it-desmond-miles-second-chance/",technology,1361460986
politics,The marital bonds between government and big business prevail not only on a federal level but local as well,,finance,1361460251
personalfinance,What does /pf think about SECU(NC)'s varying interest rate credit card?,"I currently have three credit cards with interest rates of 20%, 19%, and 15%.  Having recently joined SECU in September I have been looking at their 7.75% interest rate credit cards.

The only catch I see is that the 7.75% says that it can vary every 6 months based on the Treasury Bill rate.  I'm not 100% sure what exactly the Treasury Bill rate is, other than it determines interest rates, but I still don't like seeing ""variable"" credit cards.

This is taken directly from their credit card agreement:
""The APR will equal 7.5
percentage points plus the Index Rate. The Index Rate is the 26 week Treasury Bill rate set at the first Auction held in January, 
April, July and October and adjusted up to the nearest 1/4%. Increases in the APR will result in a higher finance charge which 
may result in additional payments over a longer period in order to repay the purchases balance or your cash advance balance. 
The increased APR will apply to any balance outstanding on the effective date of the change as well as to future purchases and 
advances. There is no minimum APR.  The APR will not exceed 18% per year or the maximum permitted by applicable law, 
whichever is lower. The APR and the Monthly Periodic Rate used to compute your finance charge appears on your monthly 
statement.""

Anyone have thoughts?  While the maximum interest rate will be 18%, has it ever (in your personal experience) reached that high?  

Edit:  Perhaps I should have clarified my goals of this credit card.  I use to use my credit cards for every purchase and pay them in full each month.  However, getting married, moving twice, etc etc etc I ended up with balances remaining on them over the years.  I'm now in a position to start paying them down.

Eventually I want to use them for all of my purchases again as I personally don't like using my debit card all the time.  In the mean time, I'm looking to reduce the interest rates so that I can pay them off quicker.  This will probably take 8-12 months.  I'm also not exactly interested in a 0% APR as the interest rate will sky rocket after 12 months and I don't want to keep dinging my credit score bouncing around credit cards.  Additionally SECU offers a 0% transfer fee whereas I see at least 3% with most other cards.

So looking into the future, should I EVER have to carry a balance again, I'd rather it be on a 7.75% interest card rather than a 20% interest card.  I guess I'm looking for a card to hold for a long time that will have a low interest rate incase I have an emergency while building my emergency fund.",finance,1361455380
energy,Oil fell below $94 a barrel Thursday as disagreement among U.S. Federal Reserve officials about its super easy monetary policy weighed on prices ahead of the release of a report on U.S. crude inventories.,,energy,1361454197
economy,Oil fell below $94 a barrel Thursday as disagreement among U.S. Federal Reserve officials about its super easy monetary policy weighed on prices ahead of the release of a report on U.S. crude inventories.,,finance,1361454157
Forex,21 lutego 2013: FED autorem strachu,,finance,1361454053
politics,Florida governor Rick Scott says state will expand Medicaid coverage: Fierce critic of 'Obamacare' – up for re-election next year –reverses course and agrees to accept federal funds for coverage,,finance,1361452471
technology,Installing Lighttpd With PHP5 (PHP-FPM) And MySQL Support On Fedora 18,,technology,1361450316
worldnews,Libor trading 'still not clean' despite scandal: 'The way that the key Libor interest rate is set in the UK is still not clean and free of fraud',,finance,1361447103
Economics,"Federal Court Affirms Sweeping ""Bully Pulpit"" Government Right to Lie: Treasury Can\'t Be Sued",,finance,1361446494
politics,"""The Supreme Court on Tuesday agreed to hear a challenge to federal campaign contribution limits, setting the stage for what may turn out to be the most important federal campaign finance case since the court’s 2010 decision in Citizens United""",,finance,1361443606
Forex,21 February 2013: FED minutes scare markets,,finance,1361441514
finance,Axis Bank Personal Loan,Personal Loans are often needed to get the thinks which we can not have due to deficit of money. Person can get this loan from lenders without describing any purpose of getting loan to the lender. There are many banks such as Axis Bank that provides personal loans at reasonable interest rate. Apply Online / Call 600 11 600.,finance,1361439601
Bitcoin,YouTube Title: Bitcoin and the Federal Reserve - Las Vegas Rotary Club Length: 21:43,,cryptocurrency,1361437625
business,Muthoot Finance Palamau,Searching for best deals on gold loan? Muthoot Finance provide the gold loan with lowest interest rates in Palamau. Check Online / Call 9878981166.,finance,1361432440
Economics,Fed Signals Possible Slowing of QE Amid Debate Over Risks,,finance,1361428562
Economics,"Gold sinks below $1,600 amid ‘death cross’ talk,
Prices fall more after Comex close as Fed to consider QE change",,finance,1361418637
gaming,Bring Back Old Runescape 2007 Servers!,"DIRECT LINK TO THE POLL 

http://services.runescape.com/m=poll/rs2007-server You can also get to the poll by going directly to the runescape home page

Dear Redditors,

I come to you today with a noble cause.

Many of you, in your earlier years, probably played the MMORPG Runescape. Yes, Runescape - that game with the stick figure esque graphics, strikingly unique community, and oddly addictive game play. Well, in recent months and years, Jagex (the company owning Runescape) has done a serious number on all of the aforementioned. Graphical updates have been prioritized over beneficial updates, the means of getting XP/training has been heavily idiot-proofed, the player-verse-player community within the game has completely gone to shit, and is on the cusp of non-existence.

On top of all of this, the unique combat system within the game (clicking to fight), has been removed. It was replaced with a laggy action bar with incredibly basic and unoriginal abilities, and complete and utter lagginess/massive time delays. Only 12 abilities may be bound on the action bar at a time, and ""shifting"" through them to get access to your other abilities is met with extreme delays and many wasted game ticks, rendering anything but clicking them directly out of your spell-book wholly inefficient.

Now, Jagex, within the last few years, has been incredibly terrible at taking suggestions from their players. For months before the release of the xp schemes, graphical updates, and finally the massive combat overhaul, players within the community have shown their desperation to stop these updates by any means necessary. Through the heavily censored and formerly tyrannical YouTube/Facebook/Forum pages, the community had managed to get their voice out that the direction of the game is not at /all/ what they wanted.

So they came to people like me. Players with moderate to high subscriber bases within the Runescape YouTube community. We realized people were quitting off, not enjoying our content, and we realized we weren't enjoying ourselves too.

I started a player-petition. It read: Jagex Games Studios: Add Pre-EoC Game Servers Back into Runescape

http://www.change.org/petitions/jagex-games-studios-add-pre-eoc-game-servers-back-into-runescape

Within a manner of two weeks we pulled in 45,000 signers, which was extremely good considering the modern ACTIVE Runescape community base (excluding bots) is comprised of only double or triple that number, and many of them never use YouTube to know that this petition was started.

Then, through constant requests, I managed to get into contact with the CEO - Mark Gerhard - to have a conversation about player interests. After an incredibly receptive conversation on Skype, he decided to release a poll to garner support for the idea the player initiative petition I started was backed by. The poll (which is now on the Runescape homepage) is to add 2007 servers back into the game. After searching through their archives, this is the only version of the game they could find.

It isn't ideal for many, but most people within the community are putting aside their differences and voting up the poll regardless of their preferred ""era"" of the game, because ANYTHING (in their eyes) is better than the Evolution of Combat (the live game).

Now, we have ALREADY achieved over 50,000 votes (the first threshold of support to surpass), which means we will be getting the 2007 version of Runescape back indefinitely. The higher thresholds are there to determine if we get any kind of development team, anti-bot technology, and, most importantly, to be able to reduce the ADDED monthly membership fees that supporters of 2007 Runescape would be forced to pay.

If we don't get at least 250,000 votes, we will be forced to pay around $20 per month. If we get at least 250,000 votes, that number gets reduced to $10. But if we get 500,000 votes- that number is reduced to JUST the price of regular membership.

I ask anyone whose played this game in the past- please do us a massive favor and go vote. If you've played in the past, watched the game go to shit and then wished it could be returned to its older state- Please go vote. If you are a member of a different gaming community, but ever liked a previous version of the game more than its live version (WoW players- this would be like if blizzard opened up a poll to add separate, Burning Crusade servers) - PLEASE GO VOTE. You need to be a member to vote. Using a widely popular method I display in this video, you can get membership for less than two dollars:

http://www.youtube.com/watch?v=s7DTxpAr3JU&amp;list=UU7cARsAqE8dHhCIRkKJADvA&amp;index=1

For those of you who are concerned about the new players who enjoy the live game more than they would these legacy servers - fret not - the live version of the game is NOT being removed under any circumstances.

These other servers are simply an ADDED bonus to the game which hurts absolutely no one, for if we get to the desired 250,000 votes, a brand new development team will be issued to these servers as to not take away from the new updates to the live game.
I thank you for having read, and I thank you for your understanding in me posting this DIRECT LINK to the poll here- for I found there to be no better way to reach the veterans of this game who have moved on to other games long ago.
Thank you for reading,
Matt (So Wreck3d)
TLDR: A player poll has been opened to restore 2007 servers back into Runescape. Please go vote if you are a veteran of this game or believe in justice for the largely abused and ignored Runescape community. Read above if you don't understand (I promise its worth your time). If you would like any more information about this movement; Please see the following links-

http://www.youtube.com/watch?v=rqYjIjDAdM8 http://www.youtube.com/watch?v=E96qqwjcFE4 http://www.youtube.com/watch?v=U5T0Xv0ants http://www.youtube.com/watch?v=3hcwHq-SiHU&amp;list=UU7cARsAqE8dHhCIRkKJADvA&amp;index=3",technology,1361414971
personalfinance,Paid off 1 of 2 credit cards. Next action?,"Today I finished paying off my first of two credit cards, called Card A.

Card A had the smaller balance but higher interest rate. I received it from an electronics store to buy a laptop not long ago. I have no plans to use their business again. 

Card B is from my bank. I've had it opened for a much longer time. It has a lower interest rate and greater credit cap. At this point I am planning to keep it open indefinitely. 

However I would like to close out Card A. But this is uncharted territory for me. Do I just call them up and ask to close the account? Is this the best thing to do? Any advice would be appreciated. Thanks!",finance,1361413066
personalfinance,Financing law school: Federal and private loans or HELOC or refinance?,"I will be starting law school (in US) later this year and I have been looking at the federal stafford loans, private loans, and mortgage rates  in order to finance it. 

From my research I learned that federal loans and private government backed loans accrue interest at a whopping 6.8% and 7.6%, respectively. I find this to be an offensive interest rate for students given that banks loan money from the government for zero or negative interest. My mother was quoted for a refi or HELOC rate of around 2.5%.

My mother proposed the idea of ""loaning"" the money from her, which is really just future me (I am an only child). She has plenty of equity in her home and the additional monthly payment would not be problematic. Is this a no brainier? I've never loaned money for school before so I'd like any advice on this subject from people who have been through this. What are the pros and cons of federal loans vs. using a mortgage?",finance,1361411620
personalfinance,$700 tax return from $11k wages. Is this right? I'm such a noob.,"1. Single
2. No deductions
3. Worked half a year last year, made 11k. (school first half of the year).
4. Claimed as dependent
5. (on my W-2 form, I put ""1"" on one box and left everything blank)


My taxes are pretty simple. I just thought I'd get much more.(for federal)",finance,1361411120
investing,"My new strategy, dividends + Call options. Let me know what you think.","Hi everyone. I have been doing some trading for the last few months, I have been pretty succesful, but quite stressed, I've made a little over 10% on the funds I borrowed to invest (promotional 1.9% for 6 month loan which I've been paying down aggresively with my regular paycheque).

I'm getting ready to cash out a portion of my holdings to pay off the rest of the loan as I'm approaching the 5 month mark, and I have put in an application for a Margin account (4% CAD and 4.5% USD, I'm canadian).

So I don't want to sit there watching day in and day out anymore, it's too much effort and I am tired of losing sleep watching the gold market, and such so here's my new plan, tell me what you think.

So my plan as of right now is to find consistently high paying dividend stocks (higher or equal to my margin interest rate). Buy them, 50% my money 50% their money and then write call options for a 2 month, optomistic position.
Let me give you an example

I bought [Gamestop](https://www.google.ca/finance?q=NYSE%3AGME&amp;hl=en&amp;ei=t_0nUdimL4SoqQGNIQ) @ 25.95, it's fallen to 24.85, when it hits 24.44 the dividend will = the interest. 

I would then buy an equal # of shares at 24.44 (if it hits that price or lower), and then write call options with a strike price of 28 $ [which are selling](http://ca.finance.yahoo.com/q/op?s=GME&amp;m=2013-04) for $.52 each.

So when I'm said and done I'll have 500 shares of GME, = 12,220 USD
+590 (every 4 months or 1770 annually) for the options and an annual dividend of 275

Without including compounding from paying down the borrowed money with dividends and writing options on it I should have an annual return of 2,045 or 31.5% annually on my original 6,487.5

Or! it goes up to 28 $ and I make 2.05 $ per share I had and 3.56$ per share I borrowed on or $1402.5 + 590 (at least 1 call writing) = 1992.5 or 30.71%.

Obviously if the stock falls or they cancel their dividend I'm at a serious risk, but I thought I'd run this by you guys and see what you thought of this plan. Any feedback? Or even better; consistent stock dividend suggestions!? Thanks :)

If you want to learn more about Call and put options I suggest you check out Khan Academy.

https://www.khanacademy.org/science/core-finance/derivative-securities/put-call-options/v/american-call-options 

Edit: One thing I realized is that if I go with a 4 month covered call I would actually increase my return quite a bit, adjusted the #s.",finance,1361576944
science,Obama Administration backs open access to all federal research,,technology,1361573418
science,"In a long-awaited leap forward for open access, the White House said today that publications from taxpayer-funded research should be made free to read. Federal agencies have been told to prepare plans to make their research results free to read within 12 months after publication.",,technology,1361570713
Economics,"""We're going to pay interest on reserves to large banks in the U.S., and to foreign banks, to the tune of tens of billions of dollars, at a time when we're not going to pay anything back to the U.S. Treasury,"" said Fed President James Bullard. ""That sounds like a recipe for political problems.""",,finance,1361570275
technology,White House orders federal agencies to require more open access to scientific research and Data,,technology,1361568766
