subreddit,title,selftext,sector,created_utc
personalfinance,So Many Directions!! What to Do?!,"OK, I am looking for some advice on how to approach my student loans, car loan, and retirement. I have somewhat of a budget figured out.  I am 24/M with full time job ($74k/YR). I have $1300 in savings. Here is my current situation:


**- Monthly Take Home Pay:**   $3850  


**- Monthly Bills:**

---- *RENT:*  $750

---- *UTILITIES:* $150

---- *INTERNET/TV:* $145

---- *CELL:* $68

---- *INSURANCE:* $192



**- Monthly Budgeted Expenses:**

---- *GAS:* $350

---- *FOOD:* $400

---- *MISC:* $200



**- Debts:**

---- *CAR LOAN:* $13,146 @ 2.24% = $328/mo

---- *SALLIE MAE:* $3184.02 @ 10.12% = $72/mo

---- *FED LOAN A:* $1336.36 @ 4.5%

---- *FED LOAN B:* $3406.65 @ 4.5%

---- *FED LOAN C:* $2137.80 @ 3.4%

---- *FED LOAN D:* $823.27 @ 6.8%  = total A+B+C+D = $80/mo





**Summary:**

Income = $3850

Expenses = $2750

Remain = $1100




**PRIMARY QUESTIONS:**

1) My employer matches up to 5% 401k, however is it matched at 1:1 for the first 3% then 1:2 for the next 2%. This means I need to contribute 7% to get a 5% match. I currently contribute 3% and the employer matches 3%. *How much should I be contributing to my 401k?*


2) Car loan is an interesting situation - I owe $13k+ at only 2.24% **BUT** I fear my car will not last the term of the loan, which is 40 more months at minimum payments  (it is currently at 135k miles and I drive 35k miles a year... three more years would require it to get to 240k miles...). *Should I be paying off my low-rate car loan?*


3) For my student loans, the Sallie Mae one is the worst interest rate. Not sure how to approach this.  *Should I be paying more than minimum on any of my student loans?*


4) I am getting married in April 2014 to someone with $40k+ of debt and currently no income. *Any advice for how to prepare for marrying $40k of student loan debt?*





Sorry for the long post, just trying to be thorough. Any help is appreciated! THANKS

**TL;DR**

I feel like I'm being pulled in all sorts of directions... saving vs retirement vs car loans vs student loans, etc. Just looking for some guidance.",finance,1386516183
technology,Slowly They Modernize: A Federal Agency That Still Uses Floppy Disks,,technology,1386511408
Bitcoin,Bitcoin Considered Harmful,"(Caveats: I am speaking for myself, not my employer.  I am not an economist, but I have studied the subject.)

BITCOIN CONSIDERED HARMFUL

I suspect that if a sizable fraction of the population of a currency region comes to consider Bitcoin a better store of value than the currency region's fiat currency, then there will be negative outcomes.  Since the number of Bitcoins are strictly bounded and gross world product is not, Bitcoin is an inherently deflationary currency.  This is not true of fiat currencies: most central banks aim for low but positive levels of inflation to promote investment.

Anyone who thinks that Bitcoins will probably continue to be used as a medium of exchange in the future should also believe that Bitcoin's value should at least increase with gross world product.  By Gresham's law, such people will tend to hold onto Bitcoins rather than the local fiat currency.

If the returns on Bitcoin investments exceed returns in the stock market or the returns on starting a new business, there will a large disincentive to start new businesses, investment in the future will sag, and recessions will be that much harder to exit.

This should be true for gold as well.  We are lucky in that gold is hard to use for a medium of exchange (there's not enough of it), which reduces its value as a store of value.

I love the idea of a digital currency.   I love the idea easy digital transactions.  I love the idea of sidestepping credit cards and banks.  I love the idea of making it harder for the financial sector to skim billions of dollars off the economy without taking any risk or doing any work[*].  But I don't want to take monetary policy out of the hands of central banks.  I don't want to return to the gold standard.  We can do better.

[*] When banks do do work and make risky loans to businesses and individuals, then they deserve to make a profit from interest.  But taking 2% of every credit card transaction or wire transfer doesn't add value to the economy — it is what an economist would call a rent.",cryptocurrency,1386510919
Banking,Credit Card Interest Rates Around the World,,finance,1386507177
personalfinance,I think I've been Yoyoed! Please help!,"So I went and got this car Nov 24th. We signed papers for a lease deal. Last week, we slid on ice coming down a mountain and hit a guard rail, but we survived with a cracked bumper. No big deal since I intended to buy the car out after the lease was up. Now I was a bit worried since my payment papers haven't come in this past week. Yesterday (Saturday), I got a call from the dealership saying that my lease deal didn't go through so they have to change it to a loan.

But Oh don't worry about that, you got an extra 2-3K in leases. Also, your payment goes down $15! And your interest rate is just 7%!

But I am not ok with that! 7% on a 30K car is a lot~! I prefer 1.8% lease I had, since I was buying out anyways.

What can I do? They want me to come in tomorrow, on a Sunday, to fill out more paperwork and sign new papers. I don't want 7 years of making payments either. What can I do? I traded in a car I had negative equity on. They changed how much they were going to give me for the car from 10K to 8K. (I owed 11.8K on the car.) Then they said they were ""loaning"" me 5K on top of the 8K owed on the car to make up the difference.

So what can I do? Do I ask for my traded in car back if I don't agree to the terms? What about the damage to the bumper?

What happens from here? I don't want to go in stupidly. I like my new car, but not enough to get screwed over on it. It's a 2014 Kia Sorento. I feel dumb, but I thought it was a done deal!

Edit1: I forgot to mention I was in the finance room, and had already been at the dealership for 4 hours that morning. I was there 4 the previous day. So I wanted to read the whole damn contract thing, and he was like ""Ok, well we will just call you in later, so you can read it in the meantime while we get to the next customer. Or I can just tell you what the contract says."" Dammit, I don't know how I let that slide.

Thank you all for responding! You are helping me a great deal over here! 
 Edit2: I just talked to them. They made a mistake in my paperwork regarding my monthly income. Sucks for them. They said I make 4K a month when Its really around 3.5K. So they took 5k off the price of the car to make the deal go through. I still haven't gone in to sign anything.",finance,1386497637
news,'A U.S. federal judge has refused to allow investors to proceed as a group in a lawsuit accusing BP Plc of fraud by misleading them - before and after the 2010 Gulf of Mexico oil spill - about the company's ability to respond to an accident.',,energy,1386492677
personalfinance,22 years old and out on my own. Can you give a young man some advice?,"I recently graduated from university with a B.S. degree in Petroleum Geology and a minor in mathematics. I moved back to the DFW area to work for a small O&amp;G exploration firm as a junior geologist. I have the ability to live with my parents, but I want to live by myself or perhaps with a good friend from university. 

My current salary is 65,000/year with a solid benefits package. At the end of the year, depending on my performance I can earn a bonus of ~10-15k. So at the low end if my take home pay is 70k after taxes and social security/medicare that leaves me with roughly 4400/month to cover my expenses. 

I have 7,000$ in my savings account and 27,000$ in federal student loans. I own a 2006 Nissan 350z with 130k miles outright and my possessions currently fit into a small storage unit . I don't have a very flashy lifestyle nor require much material things, but I also want to enjoy my life.

What advice can you give a young man starting out his life on financial matters? Given my situation, what are some things I should be doing now? Any suggestions for a budget with 4400/mo take home pay? Should I buy a 2br condo and get a roommate to pay most of the mortgage or just rent? 

If I get my masters degree and have 10-15 years experience, I will be making ~200k as a petroleum geologist so my career has good potential for growth. I would like to work for a few years and enjoy my twenties before going back to school. 

Thanks",finance,1386491852
Bitcoin,Cold Storage complication. Question:,"Hey all,
     So I've been going through setting up cold storage using the following tutorial:

http://www.anonymousbitcoinbook.com/2013/11/17/become-your-own-banker-bitcoin-cold-storage-tutorial-part-1/

But I've run into a small problem.  When I get to the second part of the tutorial: http://www.anonymousbitcoinbook.com/2013/11/18/become-your-own-banker-bitcoin-cold-storage-tutorial-part-2/

I come into a problem downloading the blockchain.  I've been attempting to do this for DAYS now with no real luck.  Eventually either my laptop will run out of juice and crash, thus having to restart the whole download of the blockchain, or it will timeout and go back to the login screen thus stopping the download.  I've managed to keep it going at work for 9 hours at a time and still managed to get less than 25% downloaded.

Is there some work around for this that you guys know of because I'm getting kinda fed up trying to go about it this way.

Thanks in advance.",cryptocurrency,1386488971
personalfinance,Stupid question about debt securities and borrowing money,"I've recently taken an interest in finance/investing.  I've noticed that many debt securities are paying interest that is below inflation (not to mention banks' ""high interest"" savings accounts that pay below inflation).

Aren't these bond-issuers and banks borrowing money and effectively paying back less (after inflation).   How come when I borrow money I'm paying ridiculous interest rates, yet these institutions are making money off of me? 

The bottom line:  Can't I start my own debt security where I make money (ie. borrow money and pay less interest than inflation?)",finance,1386483786
personalfinance,Is there a more feasible car option?,"The short story: 

My girlfriend's mother purchased a new 2010 sedan about a year and a half ago, which she could not afford. She really went all out...extra options, extended warranty, the whole shabang... Because her folks were juggling some other financial issues, my girlfriend decided to take over the loan and swap cars with her mother (the old car needed to go, but this new replacement wasn't necessary). 

Now...

At the moment, she is paying ~$450 in monthly car payments, which is a pain when lumped together with student loan repayments, rent, and other costs of living. We're by no means struggling, but an extra ~$450 in savings each month would certainly help a young couple that's planning for the future. 

We've discussed some possible alternatives, but I don't know enough about automobile financing to recognize all the options. As far as I understand, there's a bit less than two years left of payments, though the interest rate is pretty great. The caveat is that the car is still in her mother's name. From what I understand, changing the name on the title will lose her the low interest rate, though this will ultimately be necessary before a change can be made. 

Any advice on how to reasonably manage the situation and reduce the financial strain would be greatly appreciated! An exchange for a used car is an option, but affordability and reliability need to be considered. 

Thanks in advance.",finance,1386478157
technology,Federal Agency Still Uses Floppy Disks,,technology,1386473370
financialindependence,"Safest place to keep ""nest egg"" savings, not concerned about interest?","Can anyone offer advice on the safest place to keep my ""safety net"" savings? I'm not particularly concerned about interest rates etc. for this money (obviously if there are equally safe options that also provide a hedge against inflation that is preferable).

I'm wondering if there are other options considered safer than a standard bank savings account?

To clarify: I need this money available to me at any time for emergencies, rainy days, etc., so account types that would make it impossible to withdraw aren't ideal.

Thanks in advance for any advice and apologies if this is a foolish question.",finance,1386472127
investing,The price of gold during 2014: Gilded or gelded?,"Hello r/investing, this is Brendan Conway, the ETF columnist at Barron's. I'm a longtime Reddit lurker making my first post. It's good to be here!

I thought I'd share my most recent column on investing in gold, a subject that sparks plenty of disagreement among my colleagues. I put heads together with a few sharp observers on the subject and the argument is this: Even investors who've stuck it out during this year's 26% slump should think about other options. That's because it sure looks like a classic bandwagoner's asset has lost its bandwagoners. I argue gold bulls who insist on sticking it out might end up better served by an even more loathed investment: gold miners. For the rest of us, there's a different rationale presented below: Ditch gold for an asset with a better chance of weathering rising interest rates. Read on to learn what it is.

I'd be most interested in hearing your thoughts.

best regards, Brendan Conway


Gold: Gilded or Gelded?

By BRENDAN CONWAY  

Near the height of gold's 12-year bull market two years ago, Warren Buffett observed something remarkable: The value of all the world's gold could be used to buy all 400 million acres of U.S. cropland, along with the world's most profitable company, ExxonMobil, 16 times over. It was his way of saying gold's value is in the eye of the beholder. After all, gold pays no dividend, has no earnings, and pretty much sits in a vault (or a jewelry box). So you have to look to a brew of investor whims and macroeconomic forces for a price forecast.

Now, gold's value has plummeted, down 26% this year due to fears that the Federal Reserve might slow its bond-buying efforts, and exchange-traded funds have reflected that glum opinion. Investors have pulled $36.4 billion from gold ETFs around the world during 2013 -- that's more than what's currently held in Treasury-bond ETFs. The biggest ETF, the $33 billion SPDR Gold Trust (ticker: GLD), has seen investor outflows every month, leaving its assets under management at less than half of what it had a year ago.

""There are a lot of deer in the headlights right now, trying to figure out what to do,"" says Bob Smith, head of Sage Advisory, an ETF portfolio manager. ""There's probably another wave of panic selling ahead."" Earlier this year, Sage eliminated an 8% gold weighting in one of its key ETF strategies. It replaced the allocation with stocks, and Smith is in no hurry to go back. ""In the absence of calamity, there's not much to go on,"" he says.

Gold investors looking for a substitute should realize the past 12 years were an aberration, says Morningstar analyst Samuel Lee. Theories of currency debasement or nefarious central bankers aside, slow economic growth, easy monetary policy, and a financial crisis all led to big investor demand for gold, while the growing wealth in emerging markets such as China and India led to greater consumer demand. True believers can buy assets linked to gold that are currently offering deeper value -- like the much-loathed mining stocks that burned hedge-fund manager John Paulson. ""Three years ago was not the time to own miners, but now might be the time,"" says Lee. Gold-mining companies, on the whole, overexpanded and failed to hedge gold prices, leading to some steep selloffs that have left many of them with deeply depressed stock valuations. But investing in miners is a bet that those CEOs learned the right lessons and, of course, a bet that gold prices won't drop again. If that's you, Lee recommends the $6.4 billion Market Vectors Gold Miners ETF (GDX), which is sitting on a three-year annualized loss of 31%.

HERE'S A BETTER IDEA: Admit that your worst-case scenarios about global crises and abject currency debasement never panned out, and shift tactics. Lee argues that investors should move to a different niche altogether -- nonagency mortgage-backed securities. This pummeled asset class is illiquid, and it lacks gold's disaster-insurance allure, creating a recipe for an effective active manager. Its properties are quite different from gold, but it's a way of adapting to rising interest rates, rather than fighting them. The pick here is a closed-end fund, Pimco Dynamic Income (PDI). ""It's an implicit bet on housing prices, and I think housing prices have a lot left in them,"" Lee says.",finance,1386467986
politics,"A cursory look into The Third Way. Who they are, what they do.","Facts so far, on [The Third Way](http://www.dailykos.com/story/2013/12/03/1259899/-Why-the-Third-Way-hates-Sen-Elizabeth-nbsp-Warren?detail=facebook#) 

22 of the 29 members are investment bankers

3 of the 29 members are CEOs

The rest (4 of 29) of the team is comprised of the following people:


**Georgette Bennett** Author, broadcast journalist, criminologist and business consultant

President and founder of Tanenbaum, whose mission can be found [here](https://www.tanenbaum.org/about)


Brought about funding for the [Jewish Funders Network] (http://www.jfunders.org/resources/news/miles-documents-now-online) enabling them to digitize the archives of the American Jewish Joint Distribution Committee.


**Jonathan Cowan** PRESIDENT and CO FOUNDER of The Third Way


15 years of experience in politics and 
&gt;""During the second Clinton administration, Cowan served as Chief of Staff of the United States Department of Housing and Urban Development, helping to manage a federal agency of 9,000 employees with a $27 billion annual budget. During that presidency, Cowan also served as Senior Advisor to Secretary Andrew M. Cuomo, and as Acting Assistant Secretary for Public Affairs under Secretary Henry Cisneros.
In 2000, Cowan became president of the new organization Americans for Gun Safety, a non-profit organization that advocated for the rights of all Americans to own firearms for personal uses such as sport and protection.[7] The organization was initially funded by Andrew McKelvey.[8]
Americans for Gun Safety eventually combined with the AGS Foundation to become Third Way, a think tank, which Cowan co-founded along with Matt Bennett, Jim Kessler, and Nancy Hale



**Ted Trimpa** 

Democratic strategist, CEO of [Trimpa Group, LLC](http://www.linkedin.com/company/trimpa-group-llc)

&gt;""consulting, philanthropic and political investment advising, and government relations firm specializing in public policy advocacy and political strategy at the state and federal levels.""


 
**Sue McCue**

&gt;Susan McCue is a political strategist and President of Message Global LLC, a strategic public affairs firm she founded in January 2008 to advance progressive campaigns, global non-profit advocacy, grassroots activism and corporate social responsibility.  
McCue served as the Chief of Staff for U.S. Senate Majority Leader Harry Reid (D-NV) from 1999 – 2006 where she managed his leadership, policy and political operations.  She also oversaw Reid’s leadership and Nevada races.  When he was elected Democratic Leader in 2004, she created a cutting-edge communications operation for congressional Democrats and was a key strategist in the 2006 mid-term elections.",finance,1386462755
technology,Slowly They Modernize: A Federal Agency That Still Uses Floppy Disks,,technology,1386462334
Bitcoin,U.S.A. Quantitative Easing Program - BITCOIN,"Quantitative easing (QE) is an unconventional monetary policy used by central banks to stimulate the economy when standard monetary policy has become ineffective. A central bank implements quantitative easing by buying specified amounts of long term financial assets from commercial banks and other private institutions, thus increasing the monetary base and lowering the yield on those financial assets. This is distinguished from the more usual policy of buying or selling government bonds in order to keep interbank interest rates at a specified target value.

Quantitative easing was first used by the Bank of Japan (BOJ) to fight domestic deflation in the early 2000s. According to the Bank of Japan, the central bank adopted quantitative easing (量的金融緩和, ryōteki kin'yū kanwa) on 19 March 2001.
The Bank of Japan had for many years, and as late as February 2001, claimed that ""quantitative easing … is not effective"" and rejected its use for monetary policy. The BOJ had maintained short-term interest rates at close to zero since 1999. With quantitative easing, it flooded commercial banks with excess liquidity to promote private lending (sound familiar?), leaving them with large stocks of excess reserves and therefore little risk of a liquidity shortage. The BOJ accomplished this by buying more government bonds than would be required to set the interest rate to zero. It later also bought asset-backed securities and equities and extended the terms of its commercial paper purchasing operation.
The BOJ increased the commercial bank current account balance from ¥5 trillion to ¥35 trillion (approximately US$300 billion) over a four-year period starting in March 2001. The BOJ also tripled the quantity of long-term Japan government bonds it could purchase on a monthly basis.

The U.S. Federal Reserve expanded its balance sheet soon after the global financial crash of 2008. It has since embarked on two more quantitative easing programs and is currently pumping an open-ended $85 billion-a-month into the U.S. economy. Meanwhile, the Bank of Japan and the Bank of England have both followed the Fed with asset purchases and low interest rates have been prevalent across the globe in an effort to combat deflation.

Is it too far off to believe that the USA has implemented bitcoin as a new type of quantitative easing program? The mysterious inventor of Bitcoin, Satoshi Nakamoto, whose name just happens to be Japanese originally wrote his papers with an American dialect. Almost as an afterthought, perhaps realizing his disguise was not perfect, this enigmatic figure then became an anglophile, using spelling such as ""colour"" instead of ""color"".

Satoshi Nakamoto holds a vast amount of bitcoins. If the true intent of the bitcoin is quantitative easing, what better way to reduce the US deficit than by Satoshi cashing in on those coins after the entire planet has been won over and bitcoin prices rise beyond what anyone could imagine?

Thoughts?",cryptocurrency,1386461486
personalfinance,2014 Federal Withholding Payroll Calculator,"This is the first 2014 federal withholding calculator I have seen available: [http://download.cnet.com/Vinny-Federal-Payroll-Tax-Calculator-2014/3000-2047_4-75363000.html](http://download.cnet.com/Vinny-Federal-Payroll-Tax-Calculator-2014/3000-2047_4-75363000.html)

I've been looking for this for a while and thought I would share with you all (in case you have OCD like I do and are trying to figure out their net take home pay for next month).  I absolutely love the ADP calculator but they have not updated their tool to calculate for 2014 yet.

I have no way of knowing if this is 100% accurate or not but it's the only one I've found so far.",finance,1386461098
Bitcoin,10 Ways Bitcoin Is Better Than The Federal Reserve,,cryptocurrency,1386630046
stocks,ETFs and Bonds for QE ending?,"My current portfolio mostly consist of small cap and index tracking ETFs. Russle 2000, S&amp;P500 - a few large cap ETFs.

I want to diversify a bit more and put my next big investment into bonds. Something like [BND](https://www.google.com/finance?q=BND&amp;ei=czimUtivLMf0qQHouwE)

1st question: When/IF QE eventually does tapper/end, is BND the type of ETF that should see a rise in value?

2nd question: What type of ETFs will rise when QE does end?

To my understand, because bond rates are so low, many people have put their money into stocks. When QE eventually does end (which would be a precursor to raising fed rates), many stocks will take a hit, as people move their money back into more stable fixed rate income bonds. And bond prices will rise.

I know there is a lot of speculation on when/(if ever) QE will end. I'm very interested in that conversation. I'm more interested in, what will happen when it is eventually is tapered and ended.",finance,1386625716
Economics,"Without fiscal policy that incentivizes rather than discourages capital expenditure, this accommodative monetary policy aimed at reducing unemployment or improving the quality of jobs is rendered flaccid - Comments on Monetary Policy by Richard W. Fisher, a voter on the FOMC next year",,finance,1386624997
