subreddit,title,selftext,sector,created_utc
personalfinance,"I recently left federal service after three years and am looking to roll over my 25k (half traditional TSP and half ROTH TSP) into something else. I have no clue what to do, please help!","As stated I left federal service and have 25k in my TSP, half traditional and half IRA.  I am a teacher now and only have the 403(b) option through various companies.  What do you suggest I do?  I would like to take some risk with this with a reputable company.  I have no idea where to begin.  I'm 27.",finance,1375399560
Banking,Current Mortgage Interest Rates Climbing Higher Today August 1 at Bank of America,,finance,1375399418
Banking,Mortgage Interest Rate Comparison Between Quicken Loans and Commerce Bank,,finance,1375399206
personalfinance,Selling Home - Should I Finance The Buyer?,"I live in South Carolina and currently own a single-wide mobile home in a nice mobile home park. I've had it on the market since late January and it is currently listed at $26,400. My realtor sent me an email today asking if I'd be interested in financing; if so, he knows someone who can put $5000 down and pay $1000 per month plus HOA fees. The interest rate is negotiable.

Looking at the math, with a 5% annual interest rate, accrued monthly, the deed would be the buyer's after 25 months, netting me about $29k.

On top of this $1000 per month + HOA fees, I make a pretty good living in a marketing career (hence why I want to get out of the mobile home and get a nicer house). So I'm thinking I can put a little bit down on another house, pay the mortgage and PMI with the $1000/mo for the first two years, refinance after the mobile home deed is released to the new buyer, and get rid of the PMI, provided I am above the 20% appraisal value of the new house.

One of my concerns is the simple risk involved here. I don't know the buyer's credit, but how could they possibly afford $5k down and $1k/mo plus HOA (and I'm assuming insurance, taxes, electricity, water, etc.) yet not be able to get a mortgage for a different house? Then again, even if we go through 12 months, and they flop I will earn $16,000 on the house. This would allow me to reduce the price on selling the house again, subsidizing any losses with the $16,000 already earned.

Obviously, I'd have to look at the legal side of everything here to protect me from liability and so forth, but strictly from a financial and risk side, what do you guys think? Any advice would be incredibly helpful.",finance,1375397954
economy,How America’s Working Stiffs Got Stiffed,,finance,1375392817
politics,Feds give laid-off Boeing workers a big helping hand | Business &amp; Technology,,technology,1375391178
technology,Story about Google pressure cooker/backpack visit from Feds? Here's an update (Read: Local Police),,technology,1375387393
science,"Centro de Cirugía, Implantologia y Estética Dentofacial Dr. Jorge Luis Parra García - Implantes Dentales en Toluca 168, Col. Olivar de los Padres, Álvaro Obregón, Ciudad de México, Distrito Federal - Sección Amarilla",,technology,1375385815
Economics,The Fed Matters Much Less Than You Think,,finance,1375376006
news,"""Oakland accepts federal funds for a vast surveillance center, manned 24-7 by police, linking dozens of traffic and surveillance cameras with police and fire dispatch systems, Twitter feeds, crime maps, gunshot-detecting microphones, alarm programs and pretty much anything moving""",,finance,1375375547
politics,"""Oakland accepts federal funds for a vast surveillance center, manned 24-7 by police, linking dozens of traffic and surveillance cameras with police and fire dispatch systems, Twitter feeds, crime maps, gunshot-detecting microphones, alarm programs and pretty much anything moving""",,finance,1375375508
technology,The Federal Government is actively sending agents to search people's homes based on their Google searches.,,technology,1375374927
gaming,"Xbox One disc drive like having a ""dead body handcuffed to you,"" says Codemasters founder",,technology,1375373881
technology,"Google Pressure Cookers and Backpacks, Get a Visit from the Feds",,technology,1375372322
personalfinance,Advice on Home Buying and Interest Rates,"Hello PF!

I'm looking to buy a home between now and April of next year.  We spoke with the mortgage adviser yesterday and were told we qualify for the loan we want at 4.125% interest (my credit score is dragging us down at around ~620).  The lender gave me the advice to pay some outstanding things on my credit report off (total of like $600 of things accumulated over the past 8 years or so) and give it 2 to 3 months which would bring my allow me to lock in a lower interest rate of 3.75%

I have spoken with Realtors who have given me the advice to buy sooner rather than later due to the housing market here being prime for buyers and interest rates being low which is why I have accelerated my buying timeline.

The mortgage will be 30 year term and I plan to round my payment up ~$100 and then pay half of that every 2 weeks and pay a $2,000/yr lump sum with tax returns every year.  All of this means I would pay for roughly 23 years instead of 30 according to the lenders spreadsheet.  Down payment/closing costs are taken care of and are a non-issue.

My question is this:

My credit has to reach 661 or higher in order to drop the interest rate to 3.75% will paying off these debts and waiting that small amount of time bring my score up 40 points?  And what are the chances that interest rates could inflate slightly within the next 3 months and offset my efforts and just simply delay my purchase date?

As additional information - in an effort to improve my credit in general I'm paying off these debts anyway as they are a drop in the bucket and were the results of youthful ignorance.  As annoying as it is dealing with creditors for old, old, old accounts this is the best thing for me to do so I'm doing it regardless of whether I'm buying next month or 3 months from now.

Any advice is appreciated and please ask if I need to provide additional information!

EDIT:  The loan is a 30 year fixed USDA loan at 4.125%  - We are pre-qualified and are trying to determine if we should seek pre-approval now or wait until a later date.",finance,1375370084
finance,The Fed is Risking Our Future Bond Purchases Continue,,finance,1375367561
Economics,"Fed Sees Risk of Disinflation, Maintains Bond Buying Pace",,finance,1375366200
personalfinance,Are my student loan payoff calculations right?,"EDIT: Thanks to /u/lilfunky1, I found an [awesome site](http://www.whatsthecost.com/snowball.aspx) that not only lets me save these calculations, but also recalculates my payoff schedule as I make additional payments! This is pretty neat for the odd times when I stumble upon extra money.

Thanks a lot for the awesome posts!

-------------

Hi, everyone!

Earlier today, I created [this](http://www.reddit.com/r/personalfinance/comments/1jf8hi/im_trying_to_build_an_emergency_fund_and_pay/) post regarding the reallocation of my 401K into my student loans. Today, I created a spreadsheet that illustrated what my payoff schedules and amounts would look like. 

For some reason, I can't get this post submitted with a link to the spreadsheet, but this is what I've calculated:

* **Loan 1**: ~$20,200 @ 13.25% (nominal interest rate of 1.1%) interest will be paid off by **4/30/2014** if I pay it down by $2500/mo.

* **Loan 2**: ~$18165 @ 11% (nominal: 0.9%) will be paid off by **12/31/2014** if I pay it down by $2605.52/month after paying off Loan 1.

* **Loan 3**: ~$18164.45 @ 9.75% (nominal: 0.8%) will be paid of by **8/31/2015** if I pay it down by $2700.26/month after paying off Loan 2. 

* **Loan 4**: ~$18164.45 @ 9.75% (nominal: 0.8%) will be paid of by **4/30/2016** if I pay it down by $2795/month after paying off Loan 3. 

* **Loan 5**: ~$53949.53 @ 6.7% (nominal: 0.6%) will be paid of by **11/30/2017** if I pay it down by $3330.78/month after paying off Loan 4. 

* **Loan 6**: ~$29082.09 @ 6.45% (nominal: 0.5%) will be paid of by **5/3/2018** if I pay it down by $3792.16/month after paying off Loan 5. 

These calculations do not account for bonuses, tax returns or any other additional payments (which I will make when the opportunities come in).

Thanks in advance!",finance,1375365684
technology,DEFCON this year has already advised feds not to attend and has made hotels hosting it to brace themselves against hacks,,technology,1375364698
personalfinance,5k to invest. How would you do it?,"Hey, I'm looking to get some more interest on my investments. My priority is capital preservation. Horizon is 3-5 years. I'm not looking for insane returns, just something a little north of inflation. I've heard bonds are the way to go, but looking at their recent performance and the likelihood that interest rates will rise, this doesn't seem a good time to buy. Where would you all invest?",finance,1375363687
technology,Installing Nginx With PHP5 (And PHP-FPM) And MySQL Support On Fedora 19,,technology,1375361912
Economics,ECB Keeps Interest Rates on Hold Amid Improving Economy,,finance,1375359704
politics,"Congress approves student loan plan ""The millions of college students and parents who will borrow money from the federal government for the coming school year can plan on much lower interest rates than originally offered""",,finance,1375358852
business,Lowest interest rates mortgage refinance,,finance,1375355908
finance,"Labor market accelerates the USD, but the Fed slows him again",,finance,1375342666
business,"Labor market accelerates the USD, but the Fed slows him again.",,finance,1375341259
economy,"Labor market accelerates the USD, but the Fed slows him again",,finance,1375340947
personalfinance,Need advice on paying student loans off and improving credit,"Hi everyone,
I had about $20k in student loans over the years, I believe. Most of it has been taken care of. I have just under $2,500 left to pay off. I am paying 6.8% interest (not sure what all of the ruckus is about with raising the interest rate to 6.8%. I've never known anyone who had a 3.4% student loan...but I digress). 

They are two loans.One has close to $2k and the other has under $600. Would it help out my credit to drag out the payments? I've been paying far ahead of schedule because I've been able to. But I'd like to improve my credit and am wondering if these loans can help me any.

Instead of just paying off the small one, I've been balancing them to make payments on both. If I am making payments more often than necessary, will they be calculated to add to my timely payments portion of my credit? Or are timely payments determined only from the payments that they demand? 

**Edit to clarify my question: My question is what would the benefit be, and how does the frequency of payment affect the ""timely payments made"" calculation of my credit? If you had a minimum payment due every 3 months, and instead, you made a payment every day for the 3 months that nothing was due, would you have 90 timely payments calculated? or would it just be one (because they were only demanding one payment in those 3 months)?**",finance,1375338140
Bitcoin,Bitcoin is going to fork eventually.,"To be clear, I don't think a fork in Bitcoin would necessarily be a bad thing. In fact, I think it might actually be a net positive.

The writing is on the walls. Just about every post in this subreddit is fervently divided amongst the statists and the anarchists. There simply CANNOT be this much opposition and continue to be one coin for everybody.

It's only a matter of time before something happens. Maybe there is a government ultimatum to turn Bitcoin into Fedcoin. Or maybe simply the devs reach a point where they disagree on a key feature. 

It seems to me eventually the Bitcoin community will have a choice: Tow the line to be in compliance with the Feds, or stay true to the goal of anonymity and disruption.

There will be vehement arguments for both sides. The Fedcoin people will claim that Bitcoin will never reach anywhere near ubiquity without compliance. The anarchists will say they'd rather have a pure and possibly obscure coin than a Fed compliant coin. And then there will be a fork in the road.

It's going to happen. I can see it. And I'm not sure it's anything to be afraid of. I know what side I'll be on. In fact, it might be the only way to really ""settle"" the dispute. If one of the forks ends up taking a nose dive then that action will speak much louder than all the words being argued in debate now. Of course, they could both co-exist quite well together, too, which would be interesting in itself.

Thoughts?",cryptocurrency,1375337880
personalfinance,22 and Starting my Career in 2 Weeks,"Age 22. 63,000 gross per year plus 5000 signing this first year. Starting employment August 11th. 15,500 in student loans at 3.4% (federal subsidized) and no other outstanding debt. My expenses will be $900 per month rent + ~$100 utilities.


The main question I have is health insurance. I have heard that I can decline my company's plan and remain on my parents'. This is the most beneficial option to our family, as they both work at a community college (same employer) and do not contribute to their health insurance no matter the plan (single, married, family). Is this the case under the Health Care Reform act, or will I be removed from their plan because my employer offers health insurance (which I would have to contribute ~$1000 per year towards)? Also, none of my company's materials mention a benefit for declining their insurance option. Is it common for companies to pay a yearly amount to employees who decline health insurance? It seems to me that by declining their plan, I would be saving the company a few thousand dollars per year, plus I know that my parents (one of them) receives money for declining their coverage. Any advice or input would be greatly appreciated!",finance,1375334010
investing,Tell me your favorite specialized ETF. I'll start.,"MORT - ETF that only buys mortgage REITs.  Very high dividend yields, but also a lot of interest rate exposure.

MOAT - Equally holds the 20 ""best value"" stocks that have a ""wide moat"" rating from Morningstar.",finance,1375332877
technology,DOWNLOAD THIS BEFORE THE FEDS DECLARE THIS AS A TERRORIST TOOL,,technology,1375331046
finance,"Forex Trading Platform | A mixed day after improved US data, FOMC statement. ECB, BOE, PMI’s today.",,finance,1375330428
Economics,One Blogger's Take On the Fed Chief Debate,,finance,1375328796
personalfinance,Should I Get a Private Student Loan?,"So I just estimated my expenses for the next school year (Fall, Spring, and Summer Session I) and I will be short about $2000-3000 after my federal student loans. I'm considering getting a private student loan to cover the remaining amount. Is it worth it? If not, what are better alternatives?

More info about me:

* Graduating next year in July after I'm done with Summer Session I
* Studying Electrical Engineering
* Currently doing my third internship/co-op
* Have established credit history with good credit

I got a letter from Wells Fargo today advertising a 2.5% APR for their student loans if you have a checking account with them, which I do. This is the lowest rate that I have seen so far.",finance,1375326108
news,Big Oil Under the Gun on the Gulf Coast!,"Thursday, August 1st, 2013
New Orleans, Louisiana

WILL BIG OIL FINALLY PAY THE PIPER ?

A lawsuit against Big Oil for environmental damage?  Are you kidding me?  Who could possibly have thunk it?  Why it’s almost blasphemous to challenge the oil industry in a state where oil revenue has been the mother’s milk for both campaign contributions and government spending for longer than anyone cares to remember.  Oh, sure, oil companies big and small have rarely received as much as a slap on the wrist for the extensive environmental damage that has been a significant factor down in Louisiana losing almost 2000 square miles of coastal land since the 1930s.  But now, it may be time to pay the piper for all those years of neglect.

Certainly, one cannot blame the massive land loss and environmental damage solely on the oil industry.  But over the past 70 years, by cutting through thousands of miles of Louisiana wetlands to reach valuable oil drilling locations, and then by digging pipeline canals, vast wetlands destruction took place.  In Louisiana, officials in charge of protecting these invaluable coastal wetlands have, in most cases, let the private sector off the hook and turned to government funding, both state and federal, in a weak attempt to reverse the damage. The state’s slogan cold well be, “quick to complain, but reluctant to aim at those who are responsible.”

But that attitude changed a bit in the past few days.  Under Louisiana law, the governor appoints a number of levee boards that are charged with the responsibility of protecting landowners from flooding up and down the Mississippi River, as well as throughout the wetlands.  And being appointed by the governor, they generally adhere to his biding.   A south Louisiana levee board, which is charged with protecting areas surrounding greater New Orleans, took the bold step of filing a multi-$billion lawsuit against 97 oil companies, operating throughout the state including BP, Mobile, and Exxon.

The lawsuit, filed by the Southeast Louisiana Flood Protection Authority-East, alleges, that “the oil network functions as a mercilessly efficient, continuously expanding system of ecological destruction -- killing vegetation, eroding soil and allowing salt water into fresh water areas.”  The filing further charged:  “What remains of these coastal lands is so seriously diseased that if nothing else is done, it will slip into the Gulf of Mexico by the end of this century, if not sooner.”

So how is Louisiana Gov. Bobby Jindal, who appointed the various board members and who has received strong financial support from the oil industry, reacting?  “Livid” and “how dare they” would be cautious words.  He accused trial lawyers of “high jacking” the levee board, influencing them to file suit, called such legal action outrageous, and demanded the law suit be dismissed and the lawyers fired.  But levee board members say that this is a question of being responsible, and that they don’t plan to back down.  As board member and noted author (“Rising Tide”) John Berry says: “Like Pottery Barn, we just want them to fix what they broke.”
Oil has been the backbone of the south Louisiana economy for many years.   Louisiana was seduced by an outside industry full of vast economic promises. The money came in easily and there can be no dispute that many new jobs were created.  But there is a cost to the spoils of oil production, and this new lawsuit claims that this untold cost has not been nearly repaid. 

Public officials have been too often lured by the financial temptations. A number of Louisiana politicians, including Gov. Huey Long in the 1930s and Plaquemines Parish dictator Leander Perez in the 1950s, made off like bandits by creating family controlled corporations, and awarding themselves public oil leases that made them hundreds of millions of dollars.  Oil company campaign cash has flowed into state and local political campaigns for decades.

Perez was particularly aloof from the public interest when he used his political clout to blackmail then Governor Earl Long back in the late 1940s to reject a federal-state split of off shore oil.  President Truman forged a compromise on the federal –state land dispute by offering Louisiana two thirds of all off shore oil out to a three mile boundary, then one third of all production from that point on out into the Gulf. Perez opposed the deal as his “vested interest” made him greedy, and Louisiana ended up receiving not one penny after a protracted battle all the way up to the U.S. Supreme Court. The failure to take this settlement has cost Louisiana, by several studies, more than $500 billion (that’s billon with a “B”) in lost revenue.

Remember the 1953 movie Thunder Bay?   Jimmy Stewart plays an oil wildcatter who discovers oil in the Gulf.  When the locals rise up in arms, Stewart makes no bones about what they face.  “There’s oil under this Gulf.  We need it.  Everybody needs it.  Without oil, this country of ours would stop and start to die.  And you would die.  You die,” he tells the crowd.  “You can’t stop progress.  Nobody can.”
Stewart might have been right, but history tells us time and again that with resources and power there is responsibility.  Did Louisiana accept the riches of the land, but fail to demand that those who set the rules, those who govern, be good stewards of these bountiful resources?  Or did the state just stand by, pocket the money, and demand little in protection and environmental accountability?
Will the lawsuit prevail?  Probably not.  It will be hard to overcome the objections of Jindal who is so vehemently opposed to any legal effort that would hold the oil industry accountable.  In years past, the Bayou State made a deal with the Devil.  It would seem to be a good faith effort by the levee board to see that there is payback time.  But their task is daunting.
The fault really belongs at the feet of public officials, who for years failed to enforce the state’s environmental laws.  “O! I have ta’en too little care of this,” said Shakespeare’s King Lear. These words can easily be the epitaph of those in charge -- those politicians who made a bad environmental bet on the Bayou. 
Peace and Justice
Jim Brown
Jim Brown’s syndicated column appears each week in numerous newspapers throughout the nation and on websites worldwide.  You can read all his past columns and see continuing updates at http://www.jimbrownusa.com.  You can also hear Jim’s nationally syndicated radio show each Sunday morning from 9 am till 11:00 am, central time, on the Genesis Radio Network, with a live stream at http://www.jimbrownusa.com.",finance,1375325286
politics,"House Votes To Cut Student Loan Rate, Sends Bill To Obama | 'But the compromise, which ties student loan interest rates to the cost of borrowing by the government, raises the possibility of higher rates as the economy picks up'",,finance,1375321914
news,"House Votes To Cut Student Loan Rate, Sends Bill To Obama | 'But the compromise, which ties student loan interest rates to the cost of borrowing by the government, raises the possibility of higher rates as the economy picks up'",,finance,1375321859
politics,Congress finally votes to cut student loan interest rates,,finance,1375321613
news,Congress finally votes to cut student loan interest rates,,finance,1375320206
politics,Fed to keep interest rates at zero amid debate over future leadership,,finance,1375319916
economy,"U.S. District Judge Richard Leon in Washington ruled today that the Fed considered data it wasn’t allowed to use under the Dodd-Frank law in setting the cap on debit-card transaction fees at 21 cents, and neglected to bolster competition in card networks. [x-post /r/LegalNews]",,finance,1375318501
personalfinance,Post 2008 has been awful for savers so what are your tips and tricks to getting the most out of the current low interest rate environment?,"We all know interest rates are at historic lows. So I was wondering what some of you have been doing in order to maximize your return while minimizing your risk to an acceptable level?

For me, I'm 23 and opened a Roth IRA in January with Vanguard. I also have a decent chunk of money in a local bank's checking account and a checking/savings account earning some interest. My checking account is earning 0.4% interest while my savings is earning 0.84%.

I am moving out of state within the next two weeks so I plan on using some of that money, but once I get settled I'll probably keep a little spending money, put some other money into an emergency fund and put the rest into a CD at the highest rate I can find short term so I can wait it out until interest rates begin to climb higher. I'm risk-averse so I like to play it very safe and that's about what I'm comfortable doing for now until interest rates go up.",finance,1375316909
personalfinance,Curiosity Question,"Howdy Personal Finance, 

You guys seem like pretty smart people,  I am currently 26 with my only debt being my truck which, because I am a moron, I had to have.  After wrecking my car twice in the snow last winter I bought it.  I owe 31 thousand on it and kind of want to get rid of it without taking a gnarly hit on it.  Is it possible? Or should I man up and deal with my ignorance?  Its 430 a month on a monthly income of 1850 ish after taxes.   Debt stresses me the fuck out, I dunno what I was thinking other than a low interest rate 2.8%  and 100000 bumper to bumper warranty with free oil changes and what not till 2018.  My monthly bills, not including food are about 1100.  

I just want to live simply, I have come to the realization that shit doesn't equal happiness.  Sharing experiences with those you love does.   

Thanks for reading : )",finance,1375486789
