subreddit,title,selftext,sector,created_utc
Bitcoin,One Million Years In The Future: Can Bitcoin Hack It?,"Here is one for those who just got their shipments from Silk Road: 

It is one million years in the future, and human society is intergalactic. We've reached the far stretches of the ""universe"" and maybe even interacted with some other civilizations. Trade is nothing what it once was, and money can't be pieces of paper.Instead, a futuristic version of Bitcoin - perhaps based on the original protocol itself - infuses intergalactic human trade and a human society that human beings of today would not recognize.

Not only are decentralized digital currencies booming with the new multi-planet society, but people store their bitcoins in their brains...

I thought that for today's blog, it would be interesting to revisit Carl Sagan's question: ""What does it mean for a civilization to be a million years old? We have had radio telescopes and spaceships for a few decades; our technical civilization is a few hundred years old ... an advanced civilization millions of years old is as much beyond us as we are beyond a bushbaby or a macaque.""

Today, in 2013, we have had the Internet, truly had the Internet, for a little over a decade. Since then it has become not merely a tool of mass media, but it has indeed become mass media its' very self. Not only is it still revolutionizing virtually every entertainment industry, it has also resulted in most of our economy running on software, something that baby boomers and the World War II generation could scantily imagine until the last thirty years.

Michio Kaku is a professor of theoretical physics at City University of New York and he believes that Sagan's question is no longer speculation, writing that ""one day, many of us could gaze at encyclopedia that contains the coordinates of perhaps hundreds of Earth-like planets in our sector of the galaxy. Then we will ponder with wonder, as Sagan did, what an intelligent civilization a million years' ahead of ours will look like."" Perhaps some of us will ask: ""Do they accept Bitcoin?""

Who knows, goes the logic, perhaps humanity will soon discover Earth-sized twins of our planet orbiting nearby solar systems. As the existential shock wears off, will we look to them with wonder and wanderlust? A new understanding of ourselves in the context of the universe will reinvent the holographic sky in our minds.  Is someone looking to us with similar wonder and wanderlust? Will one day we have to send money home to our families on good ole' planet Earth via Bitcoin?

The Russian astrophysicist Kardeshev defined three levels of advanced civilizations based on how they harness energy to fuel their societies.  All three stages or categories of civilizations, including the most advanced Type III, would still be bound by the laws of physics which enable us to predict the behavior of the universe from the subatomic world to the large-scale structures of the universe.

Type I civilizations would have technological levels like ours today. This metric is generally arrived at by figuring total energy consumption. Carl Sagan estimated that Earth qualifies as a .07 civilization while he lived. Type II civilizations would be capable of harnessing the energy of their own sun. Type III civilizations would be able to utilize energy on the scale of their own galaxies.

If human society had harnessed all of the power of the sun and later its own galaxy, would Bitcoin still be relevant? More pressing, could amendments to the protocol itself make it relevant? Assuming the mining of all 21 million bitcoins had been completed before human society even began harnessing the energy of the sun, then what difference does human advancement make for BTC?



Kardeshev calculated that the energy consumption of these types of civilizations would be separated by a factor of about 10 billion. In 1963, he searched for trades of the more advanced type II and III civilizations' at the 920 MHZ wavelength creating an uproar of excitement thinking he had discovered signals from a Type II civilization when in fact he had not.  He had found a quasar with a red shift.

Similar transpired in 1967 when regular signals were detected by radio telescopes at Cambridge, England. These turned out to be the first discovery of a neutron star.

Kaku believes, along with with Princeton physicist Freeman Dyson, that even though human civilization has only recently begun to master planetary engines - fossil fuel, passive solar, win, geothermal and nuclear fission - humanity will, within two centuries, attain Type I status.

Human society would need to grow modestly. A mere 1 percent growth, according to Kardeschev's numbers, means that it would take 3,200 years to reach Type II status, and 5,800 years to reach Type III status.

Theoretically, it would take centuries or even millennia for a Type I civilization to terraform nearby planets. Then, we would arrive at a Type II civilization, and that stage in which human trade is put under extraterrestrial scrutiny. Clearly, the Federal Reserve system would be unsustainable in this environment.

As for decentralized currencies like Bitcoin, since it is totally understandable that humanity would make it a priority to bring 4G across its galactic realm, they have more than a chance. In fact, they could be the only way to trade should humanity find itself a home away from home.

The Type III civilization is ""truly immortal. It has exhausted the power of a single star, and has reached out to other star systems. No natural catastrophe known to science has the capacity to destroy a Type III civilization.""

Some theoretical problems of forming a Type III civilization begin with Einstein's theory of relativity. Nothing travels faster than light. Including block chain confirmations. This speed limit holds back a civilization's capacity to expand intergalactic. There will have to be developments in human understanding of the universe in order to Bitcoin devs to figure out how to make Bitcoin faster than the speed of light.

This could delay the transition from a Type II to a Type III civilization by perhaps a million years or so, one human physicist estimates.

Granted, all of these conjectures assume human beings get more advanced in a linear fashion. It also assumes that biological creatures in the universe are similar to us and evolve similarly.

Here we today, however, with less than a century of binary artificial intelligence. Many scientists talk seriously about parity and beyond Artificial Intelligence.  This ""beyond"" will be exponential, and many believe it will arrive this century.  They say, the big philosophical question is not what human society will look like in a million years, but, rather: if ""we"" survive a million years, what is ""we?"" Do we identify with dinosaurs and fish in this society, or the AI we have become.

If Bitcoin is a part of that equation, then you can be sure ""we"" will be using brainwallets.

-GoldSilverBitcoin",cryptocurrency,1374739073
science,Whitehouse.gov Petition: Increase funding of NASA (National Aeronautics and Space Administration) to 1% of the U.S federal budget,,technology,1374734420
politics,"Senate ties student loan interest rates to markets lowering rates today (3.86% for undergrads, 5.41% grads), but rates projected be higher than current rates by 2017( up to 8.25% for undergrads and 9.5% for grads). Warren's amendment to cap rates at today's rates fail.",,finance,1374731386
Economics,Federal R&amp;D costs to affect GDP,,finance,1374730038
personalfinance,Asking CC Companies to Lower Interest Rates on Cards I Haven't Used in a While,"Hi guys! Basically, I just paid off all the balances on my credit cards ($5000, $2000 and $1500) very recently. But I haven't really been using any of them for at least a year and a half, other than an occasional purchase here or there, because my interest rates are insane! 



When the economy tanked, my interest rates skyrocketed (I got a letter from one bank saying they supposedly raised rates across the board and the other bank said it was because my balance was too high at 70% utilization). All three went from ~14% to 29.99%. 



Now that I paid off all the balances, I want to start using these cards again. I'm not too keen on closing them since I've had them for such a long time, at around 5-9 years. My credit score is 728 so its pretty good-ish. Would it raise flags if I called the companies and asked them to lower my interest rates so that I could start charging/raising my credit? I've heard of CC companies closing accounts because they were going unused and I don't want that, but cmon-- 29.99% is RIDICULOUS AND I REFUSE. Help, please!? Much appreciated!",finance,1374729442
personalfinance,Shopping my refi loan,"I'm looking to refinance my home and have two offers and was hoping PF could guide me a bit.

Facts:

We currently rent the home and break even on our mortgage. If we refi we'll be making a approx 200 a month.
Home is valued at approx 200,000
Current Principal is 166,000
Current interest rate is 5.75
Our credit ratings are 710+
This is a VA streamlined refi

First offer is a 30 year fixed with an interest rate of 4.75 and closing costs of 1763.00
Second offer is a 30 year fixed rate with an interest rate of 4.25 and closing costs of 3487.13 

We're planning on paying off the home early (~10 years, no early payment penalty).

I'm currently leaning towards the lower rate higher closing costs but would appreciate some outside opinions.",finance,1374728519
personalfinance,College loan question.,"So a lot of info here. I'm leaving the military and I want to use my Montgomery GI Bill to complete a college certificate program. The program should cost about $4500. Now my original plan was to take out a loan with my financial institution, being that payment is deferred until graduation, and a low interest rate. Unfortunately Wells Fargo (Institution uses them) is not ""partners"" with APUS, and they can't give me a loan for that institution.

So I have enough money in a CD to pay for the program, I could pay it straight out. I could take a loan against the CD and pay it back with the GIB funds. Or I could enroll in the 9/11 GIB, which would pay the tuition, but would take significant time to be processed, and being that the program is online, I would receive a much lower amount.

Thoughts? What am I missing or should be considering?",finance,1374724550
personalfinance,Completely pay off student loans or invest?,"I graduated with the average amount of debt that american graduates incur these days, $20,000 give or take. I have been slowly paying it off for the past two years, but only the minimum. I have savings built up from a car accident and teaching abroad over the past year, so I could completely pay off the loan if I wanted to. My question is, would it be smart to pay it all off, and have no money, or would it be better to invest it, and up my payments a bit when I get back home? I have subsidized loans, so my interest rate hovers around 4%. 
Another question is, what could I safely invest in that is going to earn me more than 4%?",finance,1374719485
personalfinance,Need advice on how to cover my last year of undergrad tuition.,"Hello personalfinance!

Here’s a brief rundown of my current loan debt.  I made a table that breaks down the Sallie Mae loans further, which I can provide if it would be helpful.

Sallie Mae Smart Option Loans: $26,800 total (5 total: 7.25%, 8% x2, 10.38% x2)

Federal Direct Unsub Loan: $17500

Federal Stafford Loan: $13500

Total: $57,800

*Federal loans include this upcoming semester.

**Tuition amount that still needs covered for Fall 2013: $5,700**
(Spring 2014 should be the same situation)


SM: Payments of $25 each per month (“Smart Option”).  Extra payments towards loan balance when I have extra income. I have a cosigner on each loan.  I have taken out a Sallie Mae loan each semester I’ve been at school except for Fall 2012 when I was awarded a generous third party scholarship that allowed me to pay my tuition bill out of pocket.

Fed Loans:  Based on my annual FAFSA application.  I am paying for tuition myself.  My mom helps me out with my rent (off-campus apartment).

I realize I should’ve educated myself on personal finance a lot sooner, and that having this much debt to Sallie Mae wasn’t the best option.  However, I’m trying to make the best of it before I go to grad school or start a full-time job as an engineer.

Income/Savings:  I have about $3000 saved up from working this summer.  At school, I have a part-time job that provides $50-80 a week, and with my current schedule and place on the staff that will not increase this year.  I will need at least half of that $3000 for living expenses, so I’m not comfortable spending it all on my tuition bill.

My tuition bill is due at the end of August, and I can extend it a few weeks if necessary.  I expect the Spring 2014 tuition bill to be identical. I will graduate in May 2014, and will either enter graduate school or a full-time job.  I plan to only attend graduate school on fellowship (paid tuition+ living expenses and maintain a part-time job on the side) or seek a full-time position with a starting salary of $55k+ (very typical of my field in the region that I plan to work in).  If I go on to get a Master’s, I’m hoping for a starting salary of $65k+.  Either way, once I start a full-time job I plan to spend the first year or two aggressively paying off my student loans while (hopefully) living at home with my mom.  I should not need to buy a car in that time period.

**Should I continue with Sallie Mae for this year to cover my tuition?  Is there a better option as far as loans go?** 

Thank you in advance for your advice.",finance,1374712245
news,Student loan deal that ensures lower interest rates passes through Senate,,finance,1374711460
news,Senate approves plan to lower interest rates on student loans,,finance,1374711016
personalfinance,Can I afford a Chevy Volt?,"The largest car payment that I'm comfortable making is about $400 a month.  The Volt costs $40,000, but it has a $7,500 federal tax credit along with a $5,000 state credit.

I was thinking about putting down about $4,000 - $6,000 on the car with my trade.  This would bring the financing amount down to around $32,000.  

By the end of the year, I'll have paid more than $7,500 in Federal taxes and more than $5,000 in state taxes.  I'm not entirely sure how Tax Credits work, but I'm under the impression that I'll get that money back as a refund after I file next year.

My plan was to purchase the car in December 2013 and then file my taxes early in 2014.

By my calculations, based on what I'm putting down, my monthly car payment would be $600+/month.  If I were to get $12,500 back as a tax refund and place it in a separate account, over 60 months it works out to be about $208 dollars a month I could use to supplement my car payment.

$600 - $208 = $392/month over 60 months, which is comfortable for me.

So my question is, is this a good plan?  Do tax credits work the way I've described above?  Would it be better to buy the car and refinance it after receiving the tax refund?  Should I adjust my withholdings for the rest of the year so I have more money to put down on it?

Sorry for the long post.

**TL;DR - Will the $12,500 Tax Credit incentive provide me with a reasonable car payment, or am I missing something?",finance,1374879626
technology,Are the Feds Asking Tech Companies for User Passwords?,,technology,1374873748
technology,"If The Feds Say Collecting Data Is Not A Search Until It Looks At Them, Is It Not Piracy Until You View The File?",,technology,1374873429
personalfinance,Last student loan payment of my life. 1st day debt free as an adult.,"Zero never felt so good. My peak was 75k - fed to private was 50/50.



http://imgur.com/R8Ktmc0

Edit: there's no magic bullet. I paid it off with savings. I had been paying 1k monthly. I could have paid it off in full earlier but I had been mulling purchasing a condo. 20% down in a major northeast city is obviously a large sum. I decided to find a cheap rental and pay the loans off. I feel I can recoup the loan payment amount in full by next year. 

Tl;dr - didn't buy a condo. Put cash to loans. 0 balance.",finance,1374869910
personalfinance,Need Help Deciding Whether to Go Back to College,"Last semester, I finished my sophomore year at the Georgia Institute of Technology, and I find myself hit with a wall when deciding to go back.I am a chemical engineering student, that has a 2.75 GPA.

For Georgia Tech graduates, a Bachelor's in Chemical and Biomolecular Engineering has a median starting salary of 67k/year, with a 15 year salary at ~120k/year median. 

As an out-of-state student, Georgia Tech costs $14,997 in tuition a semester. Since I pay my own room and board, that would be a 30k/year cost.

Currently, I have borrowed the following:

Freshman Year
$3,484 Federal Subsidized at 3.4%
$1,990 Federal Unsubsidized at 6.8%

Sophomore Year
$4,456 Federal Subsidized at 3.4%
$1,980 Federal Unsubsidized at 6.8%

My parents have borrowed the rest of my college costs using the Parent PLUS loans, which they have said they will help me with, but I can reasonably expect to be responsible for paying half of those loans back to them at low interest, as they will be paying back the loans in full &lt;4 years. The amount I could expect to pay back is approximately $25,000-$30,000.

For this year, my parents have had a delay on their tax filings, which has resulted in me having no access to Federal loans. Additionally, as per agreement with my parents, I now bear responsibility for the remaining loans (with them acting as co-signers.)

This places my total graduating debt at $102,000.


For this semester, I applied to Wells Fargo for a private student loan of $14,977. If this rate is continued for the rest of my degree, I can expect to borrow $60,000 more dollars. My Wells Fargo loan has returned with interest rates of %10.99 fixed or %7.99 variable. These both seem high to me, and as such I am at a loss of what to do.

Here are my options, as I see it:

1. Continue applying for loans to find more competitive interest rates.

2. Take a semester off of school to allow parents to complete tax filings, so that I may complete my FASFA and regain access to federal loans.

3. Transfer to an in-state school and hope to pay less/nothing. However, none of the in-state schools (Montana) are particularly prestigious; as such, starting salaries for Chemical Engineering are $10-20k lower. I have not been able to find data for salary increases, but Montanan salaries are generally much lower than the national average. 

4. Pursue a 2-year military ROTC scholarship.

Is taking on more debt a bad idea? How do the interest rates I listed for Wells Fargo sound? Do you think I will be able to obtain more competitive rates? *Will it be possible to repay my loans in a reasonable amount of time, or will my debts crush me?*

Additional Information:
I have had a part time job through my whole college career that can become a full-time job at a pay of ~$13/hour.
My parents' income is 120,000 but their credit may not be the best due to a bankruptcy 12+ years ago. I do not know their credit score, but could that be raising the private interest rates I'm getting?",finance,1374865945
politics,"Privacy Be Damned, Commissioner of Social Security Administration warns that the federal health exchange is a privacy black hole.",,cryptocurrency,1374862481
ada,AVR-Ada 1.2.2 RPMs for Fedora 19,,cryptocurrency,1374861984
technology,Federal officials have announced the biggest bust of a hacking ring in U.S. history. Five men are charged with stealing more than 160 million credit and debit card numbers,,technology,1374861913
Bitcoin,Let's help Internet Archive Federal Credit Union cover their costs of helping Bitfloor users recover their USD funds.,"**Update 2:31 PM PDT 26-July-2013: $1,750-worth of USD and BTC donations to the Internet Archive reported to me so far**

Many of you have suggested that I post a BTC address where you can send me thank-you tips after you receive your Bitfloor refunds. For those of you who were thinking of doing this, I would really appreciate it if you showed your gratitude by tipping IAFCU. Please read on for details of how to do this.

(If you already tipped me on reddit or elsewhere — thanks! I'll be forwarding your tip on to IAFCU.)

When I spoke to Jordan Modell recently, I learned that IAFCU incurred a lot of expenses (legal, software, and personnel) beyond what they were expecting as they worked to set up Bitfloor users' new accounts and process refunds. They will continue to incur expenses as Bitfloor users start transferring their money to other financial institutions.

I asked Jordan if he could provide me a rough breakdown of the expenses they've incurred so far. He checked his records and emailed me the following:

* New software to handle Office of Foreign Assets Control checks for those without accounts: $3,500
* Call center: $1,000 and climbing
* New hires: $1,500
* Manpower: $4,000 - $5,000 (Their whole team worked double shifts on weekends, and no one took a day off in 16 days and counting.)

Because IAFCU is a small non-profit, these expenses are significant for them. I'd really love to see them at least break even for all the help they've given us (and hopefully even better than break even).

I am hoping we can raise $15,000 for IAFCU from within the Bitcoin community as a show of goodwill. I spoke to Jordan about whether they can receive donations, and he said that they can. The best way to do it is by making a contribution to the Internet Archive.

Here's what I'm proposing we do to make the fundraiser a bit public:

* If you'd like to participate, visit http://archive.org/donate/index.php and select your donation method of choice (they welcome BTC, but other USD payment options are there, too)
* (This is important) send an email to donations@archive.org. In it, include the amount you donated and request that your donation be used to cover IAFCU expenses. Brewster Kahle's assistant will be on the lookout for these messages to make sure the funds get where you want them to go.
* If you'd like me to count your contribution in a public tally showing how much we've raised for IAFCU, BCC me on your email to donations@archive.org so I know how much you gave. You can PM me for my email address if you don't have it already.

And thanks!

— AudenX",cryptocurrency,1374861464
investing,Obama is replacing Bernanke. How will the new Federal Reserve chairman affect the stock market?,"http://www.cnbc.com/id/100916885  
.  
It is coming down to Janet L. Yellen, the Fed's vice chairwoman, and  Lawrence H. Summers, a member of a close-knit group of men, protégés of the former Treasury Secretary Robert E. Rubin.  
.  
By just the act of replacing bernanke have an effect, and will one of the candidates effect a more positive or negative change?  
.  
I am currently uneducated about these candidates and their stances, which I am reading about now",finance,1374855622
Economics,"In Tug of War Over New Fed Leader, Some Gender Undertones",,finance,1374852143
personalfinance,Question regarding my auto loan. Do I have too much car?,"Hello all,

I have an auto loan that's almost a year old. It has a 13.% interest rate, 72 months to be paid off in 9/2018. I pay 277 a month.

I am thinking about getting something that is less car. Whether that be a trade in and get a lease or buy something cheaper. 

With KBB it seems to be worth exactly what is left on my current loan - 12,800. So i'd break even or have a little more of a payment left.

Should I try to get out of this or stick it out? The monthly payment doesn't kill me but lower is always better. What will this do to my credit? Which is about a 650.",finance,1374849992
Bitcoin,BitEnsure - Interest Bearing Wallets - Bitcoin Savings Accounts,"Many of us are waiting for the next big jump in the value of bitcoins and are saving our bitcoins for that glorious day when the price of a bitcoin passes $500. Until then, instead of leaving your bitcoins in a wallet gathering dust, why not make a profit on your stockpile of bitcoins without lifting a finger?

We refer to them as savings accounts but our service is similar to Certificate of Deposits (CDs). CDs are similar to savings accounts in that they are insured and thus virtually risk-free they are ""money in the bank"". They are different from savings accounts in that the CD has a specific, fixed term (often monthly, three months, six months, or one to five years), and, usually, a fixed interest rate.

We guarantee your deposited balance at all times. If our secure wallets are ever compromised we keep a backup of all deposits to replenish your account in case of a rare catastrophe. This is part of our effort to provide a high level of reliability and trust to our clients.",cryptocurrency,1374849494
personalfinance,"Can anyone help me figure out my ""effective"" interest rate of my mortgage due to mortgage insurance?","I put 5% down on a house (US) few months ago. Fixed 3.75% interest rate on a conventional loan of $249,850. I have a monthly $195 mortgage insurace fee. Does anyone know how to calculate my ""effective"" interest rate until the point that the insurance fee falls off?

I suspect it extremely high, and should put all extra money toward my mortgage until I get to that point, but I wanted to confirm.",finance,1374849221
politics,"Ari Melber: Federal Financial Aid Needed For Detroit, America’s ‘Most Libertarian City’",,finance,1374847337
