subreddit,title,selftext,sector,created_utc
personalfinance,(Almost) Everything You Need To Know About Your 401k Plan,"You learn something new everyday.  Today I learned about after-tax contributions to my 401k, and how they are totally awesome.  I thought I'd explain a little about what I learned, and also ask you guys for additional tips you might have.  Also, if you happen to know what's similar/different between 401k plans and 403b, TSP, or whatever 401k-like stuff is out there, please share in the comments.

I'm a lazy index-investor who hopes to retire very early on a pretty frugal lifestyle of ~$50k.  I married, single income, with 3 kids.  I think a lot of this info applies to a lot of people, but if you're not exactly in my situation, you might have to adjust/adapt a bit.

**tl;dr - Sorry I'm so long-winded.  I've put all the important stuff in bold.**

**EDIT** - I have been corrected on a substantial point (that doesn't happen to affect me much, but completely alters some of what I originally stated below).  I haven't confirmed the correction, but it makes total sense, so I'm pretty sure I was indeed wrong about after-tax earnings being tax-free during a rollover.  Sorry about that.

What Makes a Good 401k?
-------------------------
There are two kinds of 401k's.  The first kind, which was by far the most common kind until recently, offers 10 or 20 mutual fund choices, none of which are index funds, and all of which have expense ratios in the .8% to 2.5% range.  The second kind, which is becoming more common every day, offers all those same lousy options, plus 4 or 5 index funds with expense ratios that are as good as you can get at Vanguard, and sometimes even better (because they are institutional shares).  **Low-cost index funds are a sign of a good 401k plan.**

The second factor to look at is your employer match.  It is not uncommon for employers to match 50% of contributions up to 7% of pay, or 100% of contributions up to 5% of pay, or some other arrangement like that.  **The employer match is free money, which is a sign of a good 401k plan.**  Even if your plan has lousy mutual funds with high expense ratios, the employer match might make it a better deal than investing in an IRA or a taxable brokerage account.  And remember, since you can roll the 401k funds into an IRA with low-cost index funds as soon as you leave the company (if not sooner), you won't be stuck with those high ERs forever.

Third, look at what kinds of contributions you can make to the 401k.  Every 401k plan offers ""Traditional"" contributions, which are tax deductible now, but are treated (along with their earnings) as ordinary income in retirement, just like a Traditional IRA.  Many 401k plans now allow Roth-style contributions, which are not tax-deductible, but are completely tax-free in retirement.  The question of whether **Roth or Traditional** is better depends on your particular situation, and is treated in the [FAQ](http://www.reddit.com/r/personalfinance/wiki/faq#wiki_roth_or_traditional.3F).  Many online sites make blanket recommendations that young people should do Roth, but it's not such a simple decision.  RedRedditRabbit explained many of the advantages of Traditional in [this thread](http://www.reddit.com/r/personalfinance/comments/18zgci/us_lets_talk_retirement_taxes_fees_and_penalties/) a while back.

In addition to Traditional and Roth contributions, some plans also allow ""after-tax"" contributions.  While these are similar to Roth in the sense that they are not tax-deductible, they have different tax treatment.  The biggest difference between Roth and after-tax contributions is that while the total of your Traditional and Roth contributions cannot exceed $17,500 in 2013, after-tax contributions have a different limit.  Specifically, the total of all 401k contributions (Traditional, Roth, after-tax, *and* employer match) can be as high as $51,000 in 2013.  After-tax contributions can be rolled into a Roth IRA with no penalty or tax owed, and it is generally easier to withdraw after-tax contributions and their earnings before retirement.  **Plans that offer all three kinds of contributions offer flexibility that can help you optimize your taxes.**

Finally, look at whether your employer allows in-service withdrawals.  I have no sense of how common this is.  My employer offers it for certain kinds of contributions, but they don't make it obvious and I've never met another employee here who knew about it.  In-service withdrawals let you roll some of the money from your 401k plan into an IRA while you're still employed.  For example, I can't withdraw my Traditional or Roth contributions or their earnings, but I can withdraw my employer's contributions and earnings (on which I would owe tax unless I roll it into a Traditional IRA) and my after-tax contributions (on which I would owe no tax since I already paid tax) and their earnings (on which I would owe tax, unless I roll them into a Roth IRA).  **In-service withdrawals are especially nice if your plan has high ERs.**

Getting the Most from Your 401k Plan
------------------------------------
The first step to getting the most from your plan is to read your benefits information or call someone in HR and find out about your plan, and in particular the four areas described above.  Once you know the ERs, employer match, contribution options, and withdrawal options, you'll need to pick investment options.  Here are a few things to keep in mind:

* **Contribute at least enough to get the full employer match.** I've run numbers for 5 or 6 people who thought they had *really* bad options (ERs as high as 3.5%) but all of them came out better getting the match than investing in an IRA.  You might be the exception, but you probably aren't.
* **Low expense ratios are the single best predictor of fund performance.**  Resist the urge to compare funds based on past performance, especially if your plan offers many similar funds.  In any group of 10 random equity funds, one will have performed best over the last 5 or 10 years, but that doesn't mean the same one will perform best over the next 5 or 10 years.  Look for funds with low expense ratios.  Less than .2% is good, less than .1% is great.
* **Index funds are usually better than managed funds.**  Even if the ERs are the same (which is unlikely--index funds are usually much cheaper), index funds usually offer better diversification and a more disciplined strategy than actively managed funds.  You won't see as much growth during a bubble, but you also won't see as much of a loss when it bursts.
* **Apply your asset allocation to your whole portfolio, not each account individually.** What this really means is, if your 401k offers a US large-cap equity index fund with a good expense ratio, but all of its bond funds have high ERs, then you should hold all of your bonds in your IRAs and only large-cap US equities in your 401k.  If you are just starting out and don't have enough money in each account to do this perfectly, at least keep in mind that it's OK to be all-bonds in one account with a good bond fund and all-equity in another account with good equity funds.

Some Tricks for Early Retirement Planning
-----------------------------------------
This section might not be as generally applicable, but I thought I'd share my thoughts anyway.  Maybe you can tell me what I'm doing wrong, or maybe you'll realize early retirement isn't as hard as it sometimes seems.  

The main concern I have with early retirement is ensuring I have enough accessible money to last me from when I stop working for money until age 60 when I can get at my IRAs.  If you are retiring ""just a little early"" at age 55 or so, it's not too hard to keep enough money in taxable accounts to cover your expenses for a few years, and that's really the best option.  If you want to retire in your 30s or 40s though, you might consider giving up some employer match because that money would be ""locked up"" and you'll need as much as you can get in taxable accounts.  Fortunately, current tax law is full of ""loopholes"" that can make early retirement an option without giving up tax-advantages of IRAs and 401k.

The fundamental concept I plan on taking advantage of is that Roth *contributions* can be withdrawn penalty-free and tax-free at any time.  Only their earnings are locked up until age 60.  With a little planning, this can even be exploited by people for whom Traditional-style retirement accounts offer a greater tax advantage (which includes most frugal early retirees).

**Roth Conversions**

I live in upstate NY, so in addition to federal income taxes, I pay over 5% in state income taxes.  Once I stop working, I may move to a state with lower income tax.  Since I'll spend the first 20 or 25 years of ""retirement"" with no pension or Social Security income, the federal tax rate on $50k of Traditional distributions would be much less than my current marginal rate of 15%, since so much of it will be tax free (at least $10k of deductions and $19k of exemptions) and most of the rest will be taxed at 10% (currently around $17k).  But if I save in Traditional-style accounts, either 401k or Traditional IRAs, I can't get the money until age 60 (55 from the 401k if I don't roll it over).  The trick I plan on using is to convert about $50k of my Traditional savings to Roth each year, starting the year I retire.  I'll owe tax on that $50k, but the whole $50k will count as a Roth contribution, meaning I can pull it out of the Roth IRA before age 60.  Now, in the case of conversion, I have to wait 5 years after the conversion in order to pull out the contribution, so **I need enough accessible savings to last me 5 years.**  Until today, I thought this would be mostly taxable savings, but also some Roth IRA contributions.  It turns out, I have an even better option available to me.

**After-tax 401k Contributions**

**EDIT**- After-tax *contributions* can be rolled into a Roth tax-free, but not their earnings.  Since I have in-service withdrawals available to me, I can just rollover the contributions each month/year before there are any significant earnings.  However, this means only the actual contributions can be withdrawn before age 60, so I might go back to plan A with the traditional conversion to Roth.

This is the thing that I just found out about today, so forgive my enthusiasm and relative ignorance [surprise: I was wrong, see above].  But it's great, because it is a huge increase to the contribution limits for Roth-style retirement accounts.  Basically, you take all the money you would have saved in a taxable account, and instead you make after-tax contributions to the 401k plan.  When you retire, you rollover all of those contributions ~~and their earnings~~ into your Roth IRA.  There is no tax or penalty at this point, and the entire amount counts as a contribution to the Roth.  ~~So if you contribute $30k after-tax to the 401k, it grows to $50k, and you rollover the $50k, you can get the whole $50k immediately.  This is better than taxable investing because you don't owe tax on any interest or capital gains like you would in a taxable account.~~  [corrected: If you are in a low tax bracket in early retirement, rolling the earnings on after-tax contributions into a Roth IRA may cheaper than paying the eventual capital gains, but under current tax law, if you are in a low tax bracket, capital gains aren't taxed, so this section is not nearly as excited as I thought.]*

**tl;dr - Just read the stuff in bold**",finance,1375995291
technology,Email Company Reportedly Used By Edward Snowden Shuts Down Rather Than Hand Data Over To Feds,,technology,1375993690
technology,Feds Compel Edward Snowden's Email Provider to Shut Down,,technology,1375992783
personalfinance,"First time in debt, want to make sure I go about this correctly.","Hey all, I'm a 22 year old recent college grad. I start my job in a few days at $72k pre tax salary. I'm very fortunate to have had my dad pay for a lot of my college tuition. Going to a state school and working during college also helped me avoid debt during college. However, I've recently incurred $8000 in debt to my dad. It is interest free until January 2014, after which he and I will discuss the interest rate. Here is my financial situation/plan: Am I doing the right thing???

Assets:

~$24,000 in mutual funds in a TD Ameritrade account

~$2500 in a Roth IRA

Can I use these as an emergency fund?

Estimated after-tax monthly income:

$4150

Estimated monthly Savings:

401k: $127 to get company match. I will max this out after I pay my dad back the $8000.

Estimated monthly expenses:

Rent+Utilities+internet+parking: $1360

Food+Fun: $400

Cellphone: $60(I pay for my dad too, completely fair since he paid for my tuition)

Health+Auto+Renters Insurance: $265

Gas+Car Maintenance fund: $80

Total expenses: $2165

After expenses and 401k, I have roughly $1850 leftover. I am planning on putting all of this towards the $8000 I owe my dad. My first paycheck will have an extra $2k signing bonus on it, so that will go to my dad too. This will have me pay back my dad by the end of the year. After that, I can put that money towards maxing my 401k and Roth IRA.  Am I taking the right course of action? Should I be maxing out my 401k and Roth IRA first until I have to start paying interest to my dad?",finance,1375992301
computers,Shipping a Gaming PC UK &gt; Canada,"So I'm going to be moving from the UK to Canada next month and I'm looking at getting my gaming computer shipped through FedEx. Never done anything like this before so I'm just hoping to get advice from anyone else that's done anything similar with their computers or people that know about shipping internationally in general!

I'm planning to take the GPU out and put it in its original box, then package that up with the PC into bigger packaging that it originally shipped to me in. So much bubblewrap will be involved. I'll also be pulling out the HDD and put that in my personal carry-on when I fly over. Does anyone recommend that I also do this with the SSD or other parts? I'll be buying a new monitor when I get to Canada. Does anyone know whether I'll have to pay any customs duty on this? The PC cost £1400 so I know that I'll have to get extra insurance on it.

Thanks anyone who has any ideas for me.",technology,1375991120
personalfinance,Responsible withdrawing from a newly accessible trust,"A little bit of background first:

30 years old, condo owner in a big city. Got an amazing deal in an attractive neighborhood when I bought and managed to pay it off quick thanks to a then very lucrative job. I figured better to pay it off quickly and sacrifice some financial flexibility in the short term. Since then my career has basically nosedived (go figure). The company I work for folded, and I returned to an old, low paying job for a firm I previously worked for, and which I loathe. I'm currently on the job market but having trouble like many people out there.

Now the financial issue

I recently was told that as of my 30th birthday I have access to two trust funds. I'm not exceedingly thrifty, but I've also never been a big spender. Upon hearing this news, my thought process has not been ""now I can buy x, y, or z,"" rather it has been: 

""How to go about responsibly accessing funds from said trusts to ensure financial stability in the future.""

I think at the heart of it is due to my current employment situation, I will soon need some form of monthly withdrawal to ensure I can pay my bills and maintain a not particularly extravagant lifestyle until I can find a new, better paying job.

I want to ensure that if I go down that path, I am not overdoing things.  I've never been great when it comes to numbers, but perhaps there is some form of formula I can plug #s into that take into account multiple factors (starting total, rate of withdrawal, market factors, interest rates, etc) and shows how long funds will last at different withdrawal rates?

Any help would be appreciated, and I apologize if this is a bit rambling, this is all quite new to me!",finance,1375987433
investing,Are high yield stocks/etfs a dangerous play?,Obviously stocks with high yield such as utilties are interest rate sensitive so they are likely to go down significantly if interest rates shoot up in the near future. What is the community opinion on those investments? Are the interest rate hikes already baked into their prices or is it better to steer clear of income producing equities?,finance,1375984763
economy,The Federal Reserve Relies on a Flawed Economic Model,,finance,1375984724
Economics,The Federal Reserve Relies on a Flawed Economic Model,,finance,1375984690
personalfinance,"26yo grad student with $65k debts and $168k assets, need advice on asset allocation (EU)","Hi everyone. I'm a quite risk-tolerant (single) grad student in Europe, graduating with a Masters degree in Engineering next year. I have no income at the moment, but expect to earn at least $76k/year once I graduate. I want to to save a lot of money and invest my net worth so as to allow a high probability of early retirement.

I have a monthly budget of $1850, which is slightly below the average for my age and marriage status. This isn't my main focus, since I'm pretty sure I have my expenses in check. I drive a 1996 Honda Civic which I bought cash for $3400, if that is relevant. The car is not necessary for my daily routine, and I only use it when public transport is impractical. My country is expensive. I walk to university every day. I don't bike, since 8 months of the year it would be through snow and hail.

**Debts:**

* $65k publicly subsidized student loans, with no interest accumulation until I graduate. Thereafter 2.6% annual (variable) interest. Nominal payoff time is 25 years.

**Assets:**

* $11k in a savings account, at 3.4% annual interest. This will supplement my student loans to pay my living expenses until I graduate. Doubles as an emergency fund.
* $21k in a tax-advantaged home savings account, at 5.1% annual interest. This money is untouchable. Annual deposits are limited to $3k/year.

* $46k in two actively managed, global stock market funds with a 2.5% annual performance fee, in addition to 20% of all gains above the index. They have been tracking the world index very closely for the last 5 years, after fees. Half of this money is capital gains, which would be taxed at 30% if I sold them.
* $8k in low-fee stock market index funds, tracking my country's benchmark index
* $2k 3D printer stocks, a remnant of a larger amount which I sold some months ago
* $80k in Tesla Motors stock. This started out as $16k which I speculatively purchased in Oct-March, all of which I could afford to lose. The intention was to hold it for 10 years and see if this company would grow into a large global automaker. It's appreciated a bit since then.

**The future:**

When I start working, my plan is to put 100% of my savings into a low-fee global index fund. Optionally, depending on the interest rate climate, I would put 10-20% in a savings account instead. I would also leave the option of putting smaller amounts (~$15k) into individual stocks if I found a particular company that seems especially promising. I am not buying bonds in today's interest rate climate, but this could be an option if the outlook changes. I hope to save more than 50% of my net income. I have no plans to purchase a home. Rent is $730/month, about half the average for my age.

**Other notes:**

Current inflation is at 1.2%. All profits from capital gains are taxed at 30%.

Any input or advice?",finance,1375982370
investing,Digital currency Bitcoin (BTC) ruled legitimate currency by federal judge,"Bitcoin (BTC) Ponzi scheme busted by Texas courts dealing in ~$4.5 million of scammed BTC. Judge ruled BTC legitimate currency and allowing the court to proceed trail after a ""not real currency"" defense was made. Should this give an investor of digital currencies confidence and/or give the currency itself a higher value due to a US judge ruling it a real currency?

[Short article about it](http://sterlingbeason.com/2013/8/8/bitcoin-ruled-legitimate-currency-by--federal-judge/39/)
http://sterlingbeason.com/2013/8/8/bitcoin-ruled-legitimate-currency-by--federal-judge/39/",finance,1375981999
Bitcoin,"US Federal Judge Says Bitcoin is a Currency, Should Be Regulated Like USD or Gold",,cryptocurrency,1375981799
Economics,Why Obama should not pick Summers for the Fed,,finance,1375979072
Economics,The accelerating race to a student debt implosion: Federal student loans rose by $266 billion since 2011. 85 percent of consumer debt growth since 2011 because of student debt.,,finance,1375978396
personalfinance,"What is best?: Prioritizing Debt, House, or Retirement?","I've been getting into a discussion with my brother about my financial gameplan.  Right now, here are the highlights:

* Student loans: about 25k, half 6.8%, half 3.6%. 350/month
* Car: 12k, 350/month, 1.9% over 36 months
* Rent: 650/month
* Other Bills: ~$250/month (notwithstanding fuel or groceries)
* We put ~150/month in a ROTH, plus we both have a small employer match 401.  
* We have ~$2,000 in emergency savings (which is growin...my wife's new and better paying job only started    two weeks ago)
* no kids, plan is to begin that in 4-5 years.
* Income: double income, ~4500/month on the low end (no overtime)

My plan was to prioritize buying a house (to get rid of rent).  My rationale: interest rates in OK are rising, and .5% increase over 30 years can be about 20k (~150k house).  Moreover, that's money going towards something, not rent.  Then, the money I was using to save for the house can roll into paying off the care, then the student loans, then house/retirement. We would open up a second ROTH and slowly increase the amount we put in, based on income raises/money being freed up.

He looks at the house as more of a liability than an asset.  Instead of paying ~1,000/month for a mortgage, continue to pay the measly 650/month for rent and prioritize the car.  Then do house/loans/retirement (not necessarily in that order).  His rationale: houses can be expensive and having that debt on top of a mortgage is scary to him.  It is to me, but this plan seems slightly less beneficial.

Does anyone have any advice?  Which gameplan do you think is better?

edit: more details",finance,1375977047
technology,"After Snowden leaks, feds lose their hacker cred at Def Con",,technology,1375976880
personalfinance,I have some questions about Short Sales,"So I just have some questions about Short Sales

Some back story:
I bought a condo 3.5 years ago. It was a foreclosure and a great deal. 100K, 1600+ Sq Ft. 2Bdr, 1Bth... exposed brick everywhere, pretty much completely renovated, hardwood floors, etc.

It was purchased in a downtown area of my smallish city, with the intention of reselling it a few years down the road. I figured at that price and with the city talking about renovating the downtown area, the only direction the value could go was up.

Well here I am 3.5 years later and my house has been on the market for over a year. I have the house listed at an extremely reasonable price(under 120K) and I have yet to receive even one offer. Im selling because I just hate living down here. I dont have a balcony(zero outdoor space), I pay a ridiculous amount(3k/year) in condo fees with zero amenities, I have a dog(outdoor space comes into play again), I hate dealing with the bullshit that comes with my HOA and a 100+ year old building. With it being in a historical district, I have to ask the city about anything that I want to do with the place. They wont even let us put a dumpster out back of the building and then get mad when we put the trash in the trash cans out on the street. 

Also, initially when I bought the place, due to a local grant system for first time home buyers, I had to purchase the house using a local bank. This gave me a very high(7.5% APR) interest rate AND they dont even report on your credit. Why the fuck would I acquire a mortgage, but not want my payment history recorded to the credit bureau? Not to mention, at settlement I was quoted a payment of lets say 800$/month. I had a settlement attorney, everything. So I am paying this 800$/month mortgage for about a year. July 1 comes the following year and my mortgage goes up to 897$/month. I was like wtf? Its a fixed rate mortgage and my property taxes did NOT go up. A few more months goes by and my payment goes up again to ~$940.  At this point I am furious, I go to the bank and find an explanation. It turns out, at settlement, the bank forgot to include ANY TAXES INTO MY ESCROW ACCOUNT. I dont know if this part can be dealt with through legal action, but I dont have the money for an attorney. Unfortunately, 19 year old me didnt really pay attention to any of this at the time.

Since all of this, I have been in contact with the bank to try and refinance but they are saying this is the best rate they can do(which is such bullshit, I know it is). 

Im down to my final straw... I fucking hate the thought of walking away from a home and ruining my credit/just having that on my conscience. Its not so much the credit aspect, because I dont even own a credit card and the only 2 things Ive financed are my car and my house. 

So my question is, how bad do Short Sales hurt your credit? How is it different from foreclosure/bankruptcy? 

Also - sorry, forgot this part - since my current bank does not report on my credit, I could go to another bank right now and purchase another house if I wanted to. If I were to find another house and purchase it before I finalize the possible short sale, would that in anyway effect the short sale process? 

Thanks, sorry no TLDR dont really have one.",finance,1375976825
