subreddit,title,selftext,sector,created_utc
business,How-to guide: 16 måder at trives i dagens verden,"newport international group, How-to guide: 16 måder at trives i dagens verden

Åh baby det er en vild verden... og for at hjælpe dig med at få ved på mere end blot et smil, har vi samlet en handy how-to guide med tips om, hvordan du kan vælge din vej gennem nogle af verdens mest presserende problemer:


1.)Hvordan til at pakke som en udenlandske korrespondent

(Se billede ovenfor. Hvis du ikke kan se grafikken, prøv dette link.) Der er ofte en halv-pakket taske ved foden af sengen, breder ledninger og batterier som indvoldene af en renset beast. Undertiden et dyr ligger inden for — 12-årige feline ven Bernstein, Bernie for korte, vil krølle op i posen med bedrøvede øjne, der siger, ""Tag mig med dig næste gang."" Selvom hun er opkaldt efter en journalist, hun tydeligvis ikke kan lide min rejse.

Hver tur kræver artful pakning og tøj, der passer til vejret eller den kultur, som normalt indeholder et udvalg af tørklæder, men klikke på det ovenstående interaktiv grafisk at finde ud af grundlæggende og min ikke længere hemmelige våben.
--Michelle Shephard

2) Hvordan kan få hjælp i udlandet

Grunde til ikke at kalde en canadisk konsulat, når du er på en udenlandsk tur:
""Jeg har brug for en refill til min medicin.""

""Kan du få mig nogle ahornsirup for min pandekager?""

""Jeg vil ud af byen, kan du gå min hund?""

Disse kan lyde over toppen, men de er blandt de 215,000 konsulære anmodninger at canadiske embedsmænd får hvert år i vores diplomatiske stillinger i udlandet.

""For at hjælpe med at forberede canadiere, før de rejser, vi opfordrer dem til at overholde de tre Rs,"" siger udenrigsanliggender hjemmeside. ""Læse, registrere og nå os.""

Konsulater varierer fra land til land. Nogle er bemandet med hjælpsomme, sympatiske tjenestemænd, andre med dem, der arbejder til reglen. Men i sager om liv og død, alvorlige forbrydelser eller tabt dokumenter (men ikke kreditkort), et opkald til den nærmeste canadiske kontor er din første resort.

3) Hvordan til at få en date med mørkt stof

Du har brugt de sidste to år bøje dit sind omkring oplysninger om partikelfysik for at forstå det mest knudrede af nyhedshistorier, opdagelsen af Higgs boson. Du brugte din bosonic glans for at smelte datoer i putty-nørdet, nørdede kit.

Jeg har dårlige nyheder, Don Juan. Higgs er gjort. Higgs er slut. Higgs er ligesom partikel-fysik-pick-up-linje svarer til Hootie og Blowfish billetter.

Du har brug for en opgradering. Du har brug for billetter til Jay-Z, eller i hvert fald Coldplay.
Du har brug for mørkt stof.

Første, som baggrund: fysikere erklæret i marts at partiklen registreret otte måneder tidligere i Large Hadron Collider (LHC) er i virkeligheden Higgs boson. Mens der er stadig masser af vigtige videnskab at gøre, vil cocktail-party-oplivende samtale om Higgs sandsynligvis være mangelfuld for et stykke tid. For én, er LHC gået offline indtil 2015. Indtil da skal du sætte din Higgs koteletter på is.

I mellemtiden har jagten på mørkt stof taget top fakturering på listen over cool fysik projekter.

4) Hvordan man klæde sig som en diktator kone
Chanel suit pressede og klar til at bære? Check.

Christian Louboutin sko encrusted med krystaller og en overdimensioneret designer taske med krokodille? Check. Check.

Naturligvis til at finansiere garderoben, du har brug for en bankkonto, fedet op med kontanter stjålet fra din landets naturressourcer eller offentlige midler.

Olierigdom er at foretrække, men støtten penge fra velmenende vestlige lande afsat til børnenes uddannelse kan også gå en lang vej.

Dressing som en diktator kone tager ikke kun dedikation til de dyreste designere-som ganske vist ikke svært – men en uvilje mod at acceptere nogle brutale realiteter. Filippinerne Imelda Marcos akkumuleret sin berømte 1,220-par sko samling som sin mand, formand Ferdinand Marcos, erklæret undtagelsestilstand i 1972 og henrettet sine modstandere uden en retssag.

Mere nylig, Syriens smukt klædt førstedame Asma Assad (hun foretrækker Chanel) var drømmende på hvad Louboutin sko at købe online som sin mands snigskytter skød demokratiaktivister, der marcherede i Damaskus til at kræve politiske reformer.

Garderobeskabe diktatorer koner har altid afspejles overgreb af deres ægtemænd regimer. Michele Bennett, gift med tidligere haitianske despot Jean-Claude Duvalier, brugt $168,780 på tøj på Givenchy og $270,200 på kugler fra Boucheron mens hun var i eksil i Frankrig, ifølge Wall Street Journal.

Men den smart diktator kone ved, der er en anden lukrative tilbehør, der ikke kan købes på Paris Avenue Montaigne eller Bond St. i London: vedhæfte dig selv til en værdig sag, helst omkring kvinder og børns rettigheder, til at få positive tryk opmærksomhed i Vesten og aflede fra din mands forfærdelige menneskerettighedssituation. Egyptens tidligere førstedame Suzanne Mubarak kæmpede for slutter genital lemlæstelse af kvinder og vandt dynger af internationale priser.
Alt det gode PR vil forhåbentlig give flere udenlandsk bistand til at rapse Louis Vuitton bagage. — Hamida Ghafour

5) Hvordan tale om Eurocrisis (som hvis du ved hvad du taler om)

Vil du imponere dine venner på cocktailparties med din tilsyneladende medfødte forståelse af den europæiske finansielle krise?

Følgende er en nybegynders guide til at forklare manglende europæiske ""gruppe kærlighed"" skattepolitik. Udspy ud disse visdomsord ved søen eller på terrassen over drinks og du vil blive en imponerende hit.

Først skal du forstå en simpel, overordnet sandhed: Europa virkelig har ingen idé om hvad det gør når det kommer til indeholdende den krise, der har ødelagt økonomien i en række lande.

Bemærk, hvordan uorganiseret EU ser i sin håndtering af opløsning økonomierne i Grækenland, Cypern, Spanien, Portugal, Italien og Frankrig? Se, hvordan britiske tiggede tidligere Bank of Canada guvernør Mark Carney at komme og redde dem?

""Den blinde leder blindt"" kommer til at tænke. Den Europæiske Union — en økonomisk og politisk organ af 28 nationer — lurches fra ene krise til næste og understøtter politikker, som nogle økonomer har kaldt ""umenneskelig.""

Fortsæt læsning... http://www.thestar.com/news/world/2013/07/15/howto_guide_16_ways_to_thrive_in_todays_world.html

Flere artikler her.
http://aizzenmaurer.blogrr.net/post/newport-group-international-show-barcelona-spain
http://www.4shared.com/video/UOzl2_Gg/newport_international_group_ba.html
http://www.rankopedia.com/Newport-International-Group-barcelona---Rihanna-'warned-about-behaviour'/PostPage/160881/.htm?refresh=7242436",finance,1373952471
Economics,Fed Puzzle: The Massive Collapse in Money Velocity,,finance,1373949413
business,The Haney Group: China Growth Slows to 7.5% as 2013 Target under Threat,"China’s [economy](http://www.smashwords.com/books/view/332957) slowed for a second quarter as growth in factory output and fixed-asset investment weakened, adding to risks that the government will miss its expansion target as Premier Li Keqiang reins in a credit boom.

Gross [domestic](http://lockerz.com/u/jayson.krooger2525/decalz/26094798/the_haney_group_thehaneygroup_com_artic) product rose 7.5 percent in April-to-June from a year earlier, the National Bureau of Statistics said in Beijing, equaling the median forecast in a Bloomberg News survey and down from 7.7 percent in the first quarter. June production growth matched the weakest pace since the 2009 global recession.

The slowdown may increase speculation that policy makers will act to safeguard their growth goal of 7.5 percent for the year even as Li signals reluctance to boost stimulus and tries to reduce financial risks. With the International Monetary Fund last week cutting its outlook for global expansion, Li’s administration faces limits on turning to exports for support.

“The new government under Mr. Li should be seriously worried about the prospect as to whether they can meet the growth target,” said Liu Li-Gang, head of Greater China economics at Australia &amp; New Zealand Banking Group Ltd. in Hong Kong, who formerly worked at the World Bank.

Expansion (GDPNTTLY) should stabilize this quarter and may rebound in the following period “if monetary policy can quickly adjust to reflect the rapidly changing domestic and external environment and fiscal policy can be more active by targeting effective investment projects and technology upgrading,” Liu said. “Otherwise, the growth trajectory is heading to less than 7 percent.”
[READ FULL ARTICLE AT BLOOMBERG.COM](http://www.bloomberg.com/news/2013-07-15/china-s-economy-grew-7-5-in-second-quarter-matching-estimates.html)",finance,1373948481
Economics,"Treasury: Debt Has Been Exactly $16,699,396,000,000.00 for 56 Days - That means that for 56 straight days the federal debt has remained approximately $25 million below the legal limit.",,finance,1373948245
business,"BP Holdings: Shell , Statoil face FTC control in U.S.","http://www.bloomberg.com/news/2013-07-12/bp-shell-statoil-face-ftc-scrutiny-in-u-s-oil-probe.html

BP Plc, Royal Dutch Shell Plc (RDSA) und Statoil ASA (STL) sind unter Kontrolle durch die US Federal Trade Commission die Agentur Sonden, ob sie Öl Benchmarks veröffentlicht von Platts manipuliert, nach einer Person, die mit der Materie vertraute.

Die FTC Frühstadium Untersuchung Ölpreise spiegelt eine Überprüfung durch die Europäische Union, die die Büros der drei Unternehmen und Platts im Mai, überfielen zwei Menschen mit der Sonde hat im vergangenen Monat. Platts, die Energie-Nachrichten und Daten-Anbieter, die im Besitz von McGraw Hill Financial Inc. (MHFI), veröffentlicht vom Brent-Benchmark, der dazu beiträgt zur Einstellung der Ölpreis mehr als die Hälfte der Welt.

Die Auswirkungen mögliche Manipulationen der Benchmark betrachtet hätte auf physikalische auch Derivative Öl Märkte in den USA, sagen die Person, der nicht namentlich genannt werden weil die Angelegenheit vertraulich ist die FTC. Die Agentur ist die Befragung Dritter um zu verdeutlichen, wie Platts herstellt seine Benchmark-Preise. Nicht klar ist, ob Platts ist ein Thema der Untersuchung, sagte die Person.

Die Eröffnung der Ölpreis Sonde in den USA ist die neueste in einer wachsenden Zahl von gleichzeitigen EU-U.S. Anfragen in Bereichen wie die London Interbank Offered Rate, standard wesentliche Patente und Internet Suche Manipulation sowie Fusion Bewertungen in Musik-und Fluggesellschaft. Das Ausmaß an dem Regulierungsbehörden in jeder Jurisdiktion miteinander zusammenarbeiten können, hängt davon ab, ob die Unternehmen im Berichtsjahr melden Sie Freistellungen ermöglicht Daten über diese freigegeben werden.

FTC Überwachung
Die FTC routinemäßig überwacht Großhandel und Einzelhandel Benzinpreise in den USA zu wettbewerbswidrigen Verhalten suchen. Die Agentur veröffentlicht auch eine Anleitung auf ihrer Website zur Einhaltung Petroleum Marktordnungen Manipulation.
Die Agentur wird wahrscheinlich ausstellen zivile investigative Forderungen, die Vorladungen, Tooil Unternehmen, Firmen, die ähnlich sind und Preise Service Verlauf der Untersuchung, zwei Personen, die mit der Materie vertraute hat im vergangenen Monat.

Related Articles and Video:
http://www.slideboom.com/presentations/636851/BP-HOLDINGS
http://www.bp.com/sectiongenericarticle.do?categoryId=9005181&amp;contentId=7050626
http://bp-holdings.bravesites.com/",finance,1373948228
technology,"Brands beats Lorenzi, will meet Federer in Hamburg",,technology,1373946316
gaming,"Brands beats Lorenzi, will meet Federer in Hamburg",,technology,1373936726
Bitcoin,Is there a certain genius to the Winklevosses business plan? (To send the value of BtC and Fed notes into a growth loop that only BtC can survive thus eliminating the Fed),"If BtC grows in value exponentially (that assumption is a side debate), could the value of shares in their fund also grow so much that it collapses the federal reserve note through the necessity of inflation driven by BtC value? Thus giving even more value to BtC and into a theoretical exponential growth loop?

try imagining it before replying with stock answers. If BtC is gonna succeed we need to think a lil more creatively.",cryptocurrency,1373936608
politics,"Antidrug Campaign, Lacking Federal Funds, Turns to Social Media",,finance,1373936435
Bitcoin,(Debate) Must BtC be a threat to nation state Governments? Or only to banks and other parasitic currency issuers?,"A government could make a work around to collect taxes in a BtC economy, for example registering vendors and basic accounting would provide enough info for such purposes. The network is transparent and would actually be very useful to a progressive government. 

Whereas the federal reserve could theoretically be replaced completely by the BtC infrastructure. Debate?",cryptocurrency,1373935782
economy,"Debt, subject to limit; or why the federal debt hasn't increased for 56 days.",,finance,1373934614
personalfinance,Smartest way to pay off my student loans?,"I have 25K in Federal Loans at 6.55%.  I also have a private loan of $11K at 7.3% and a private loan of 9K at 4%.  Each month I pay $320 to my federal loans, $180 to my 11K loan, and $65 to my 9K loan.  I also fully invest 4.5% of my salary into my 401K, b/c my company matches 100%.  I save money when I can, but not as much as I should.  I'd rather enjoy things while they come, while systematically paying off my loans, than to live super frugally, paying off my loans quicker.  Am I doing it right?  My salary allows me to do all these things and save around $300-600/month.  Any advice would be helpful!  Thanks!",finance,1374105035
personalfinance,Anybody have suggestions for which private student loans to look into?,"**I'm not looking for ""don't get private loans"" as an answer.  If you think you know of an alternative, read the post first and I'll be happy to consider what you have to say.**

Here's my situation... it's probably not relevant, but whatever: 

* I'm being disowned because I'm transgender.  So I don't have a cosigner.

* My parents make a lot of money, and I don't qualify for federal loans.

* I'm disabled to the point that I can't work at a job where I have to stand, but I don't qualify for disability.  I'm currently unemployed and job hunting, but it's hard to find a job as a transgender student who can't stand up for more than 10 minutes.

* I only have to finish 2 semesters of undergrad, then 3 semesters of grad school.  State university, ~$5000 per semester including books and whatnot.  So, ~$25k for school, plus 2.5 years of some living expenses.  Once I have my bachelor's, I'll have more job opportunities, so I shouldn't have to use loans for most living expenses after 1 year.

* I'm studying social work to get into clinical therapy for trans/queer folk.  Depending on location, this can be profitable... my former therapist charges $100+ an hour, is always booked solid 2-4 months out, and works 5 days a week.  She has the same degree and qualifications that I'll have after grad school.  Although I don't expect to be that successful right out of school, I'm not worried. I'm against kids and marriage, and I prefer living frugally.  So I'm cool with being in debt for a while. :P


So, I'm just not sure where to begin looking.  Which places should I avoid like the plague?  Which places tend to have low rates and might be able to help me with the process?  Any tips are welcome, cause I dunno wtf.  I'm going through a difficult time with the whole getting disowned thing, and trying to learn about finances and look through different companies is stressing me out really badly.",finance,1374104824
news,Senate deal reached on restoring lower interest rates on student loans,,finance,1374104274
news,Deal reached in Senate to restore lower interest rates on student loans.,,finance,1374103751
personalfinance,I'm being taxed 30.4% on my 65k income in California. I'm single. Is this right?,"I'm single, no children, with 1 allowance, no exemptions or property. Very straightforward W-4. I earn 65k/year gross in California. In all, I'm being taxed 30.4% and that just seems absurd. Is that right? What can I do to adjust what's being taken out?

Here's the breakdown (semi-monthly payment):

Gross: $2708.33

Federal withholding: -$444.00

Social security -$167.92

Medicare -$39.27

CA - Withholding -$146.07

CA - Disability -$27.08

Total -$824.34

Net: $1883.99",finance,1374103111
Economics,Ben Bernanke: If the Fed were to tighten policy the economy would tank,,finance,1374102976
personalfinance,Advice please for a family member facing financial ruin,"Hi all, I would love some advice on where to start with helping a close family member who is completely screwed financially. I apologize in advance for not having specifics, but the big ""intervention"" is not until this weekend.

Due to her own stupidity, ignorance, and unfortunately mental health issues, she is behind on everything possibly imaginable. For starters, she switched jobs last year and never realized that any taxes were not being taken out. So she owes federal, state, and possibly county taxes. She's behind on her mortgage, car (3 months from my understanding), credit cards, student loans, general bills, etc. If I would have guess at the total value of her debt it would be between 100K to 200K. She's getting multiple notices in the mail everyday and debt collectors are starting to call other family members in regards to her. To get a complete picture, she is in her late twenties and has had a steady, decent paying job for 5 years. I would guess she makes at least 50K a year in the medical field and probably has a little bit of 401K.

That being said, here are my questions:

1) Is it worth hiring someone for her to help her sort through this mess?

2) Consequences and benefits of bankruptcy?

3) If she is still salvageable, what would your plan for her look like?

Thanks in advance, this is a really crappy situation for all parties involved.",finance,1374102039
politics,"Deal to lower interest rates on student loans is imminent - compromise would peg interest rates to the financial markets. Reports senators agreed to an 8.25% cap on undergrads; Grad rates capped at 9.5%, and parents who help children rates no higher than 10.5%",,finance,1374098702
personalfinance,should i open another line of credit?,"bankruptcy is just over a year out. within my first year i was forced to find someone that would work with me on a loan for a car and was lucky to find one. I was also approved for credit cards within the first year (outrageous interest rates and annual fees of course), got another one that's exclusively for healthcare and was just approved for another. The newest one was offered to me when i refinanced my auto loan (to a somewhat better rate) and it is the only one without an annual fee and has the lowest interest rate on it so i transferred my balances from the high interest rate cards to this card and put those ones away so that i wouldn't use them. Now i only have 2 cards with balances that i am making the monthly payments on and i have cards with a zero balance. From the research that i have done and what people have told me I am under the impression that if you have a lot of open credit it will hurt your credit score but if you have a lot of credit in general and keep an even balance so that you're only using 30-40% of available credit that it helps your credit score. is there any truth to this? if there is should i open another credit card with a lower interest rate and keep a small balance on it as well?

Any advice is appreciated.",finance,1374098657
politics,Student loans ill never have 0.75% interest rates. This is why.,,finance,1374097693
economy,"United States Senator, David Vitter Discusses The Safety of America From an Economic Standpoint","On this episode of Legal Lines, Locke Meredith discusses some of the threats to the United States economy with Senator David Vitter.  Vitter is the junior U.S. Senator from Louisiana.  He is a Republican, who prior to being elected to the United States Senate, served in the U.S. House of Representatives, representing Louisiana’s first congressional district.

In this episode of Legal Lines, Vitter speaks of the “state of affairs” in Washington.  Vitter believes that America is tired of government by fiscal crisis and that Congress may experience a time of governing by avoiding crisis-like situations.  It is arguable that the U.S. is becoming economically weak, and that we are subject to troubling economic problems.  Vitter talks about the reality of these issues.

Vitter and Meredith discuss the issues that come with the continued influx on money into the U.S. economy through the Federal Reserve.  Vitter is concerned about this trend because a continued influx of money could quite possibly devalue the dollar and lead to inflationary pressure.  Vitter believes that the solution does not lie with increasing taxes, but rather by reduced spending.  Vitter goes on to speak about banks that are “too big to fail” and the problems, and possible solutions, regarding them.  He goes on to discuss Social Security programs in today’s economy and his efforts on the Environment and Public Works Committee.  

Vitter discusses a number of other topics with Locke Meredith in this informative episode of Legal Lines.  The episode can be viewed in its entirety on Locke Meredith’s YouTube channel. 
http://youtu.be/9CZm2LpOjmM
http://www.lockemeredithlaw.com/",finance,1374097393
personalfinance,To consolidate or not to consolidate student loans?,"Here are my loan info:


Loan 1: 


Subsidized: Principal $5,526.22 @ 6.0%

Unsubsidized: Principal $8,217.46 @ 6.8%

Loan 2:

Subsidized: Principal $2,759.84 @ 4.5%

Subsidized: Principal $7,596.65 @ 5.6%

Unsubsidized: Principal $14,466.43 @ 6.8%


Loan 3:

Federal Stafford Loan: $3,419.77 @ 1.75% variable


Loan #1 and #2 are serviced under the same service provider, while loan #3 is under a different provider. The rate in which I'm quoted if I consolidate is 6.0%.


Should I consolidate my loans?",finance,1374096044
software,New to VMs...quick question (xpost from /r/virtualization),"My apologies if inappropriate sub, etc...

I have messed around with VirtualBox on Fedora 19 using a Win7 .iso on a DVD in the past. I got it to work, but never did anything serious with it. Here's a stupid question: If I have a known good HDD with WinXP from another (otherwise useless) desktop, can I run XP in VB straight from the HDD with a SATA/USB adapter (or something)? I feel like the answer is yes, but 1) I have limited experience with VMs, and 2) I am on my phone away from my laptop and in need of a quick basic yes/no.

Thanks in advance.",technology,1374095594
Bitcoin,Are ASICs an invitation to centralization of Bitcoin or not?,"It seems to me ASICS will effectively make AsicMiner, BFL, Avalon into a federal reserve cartel of Bitcoin.  The fabs for making these devices are far and few between which makes the concept of one CPU one vote less practical.",cryptocurrency,1374095158
personalfinance,"$1000 Short of Next Credit Card Payments with Big Paycheque Coming 10 Days After, Suggestions Please?","Hi, I have a problem and I would very much appreciate any suggestions/ideas you may have. 

My family has two credit cards. A series of bad timing events hit us this month. We ended up making a lot of big purchases that would otherwise be very spread out. 

I did the maths and I am $1000 short of paying both credit cards' full balance. I have enough to pay either one ($2500 vs $1500). In addition, one of my fixed-term deposit (with more than enough) would come into maturity ten days after the credit card payment deadline. 

Can you provide the best way to handle this problem? My dad thinks, worse comes to worst, he will take out a small loan for a month and pay the interest. Is there any other suggestions?

extra info: I have a bit of freedom with timing. Both bills come around the same time. So I pay one bill (card A) completely. Then withdraw enough from A to pay B. Finally, pay back the transfer on A when my investment comes in. Would this work? 

edit: Just to specify, my family comes from Asia. Not paying off the credit card bill completely is something we lose our sleep over. And why did we make more purchase than we can afford? 1. Bad timing 2. My dad puts every spare penny into fixed-term investment. 

edit 2: Thank you so much for your suggestions and pointers. For some unexplainable stupidity, I kept assuming that the interest rate would roll me over after one month of late payment. I will give them a call and see if there is some sort of grace period.",finance,1374093376
