subreddit,title,selftext,sector,created_utc
personalfinance,Should I pay off our house or student debt?,"Hello everyone, I was wondering if I could get advice on this issue my husband and I are debating on. We bought a house about two years ago that was purposely under our budget because we knew that with one income of around $25k a year we would be OK (I wanted to stay at home with our son while I finished school). We have about $55k on the house left. I recently graduated and have been offered a job that will pretty much double our income. After taxes, childcare, health insurance (Yay!), and saving up for a second car, we figured we could pay off our house in three to four years. However, I also have $60k in student debt which averages about 6% interest. A lot of places say to pay off debt first home later. However, my husband wants to pay off the home first since after 5 years of working I would qualify for loan forgiveness (I am a teacher) and whatever is left we could get a home line of credit. Since he works for the bank we would qualify for a discount. 

Should we do what most experts say and pay off the student debt first and the house second? Or should we pay off our home, wait for the loan forgiveness and get an equity line with a lower interest rate for what is left? Thanks for reading!",finance,1359763076
personalfinance,Advice on buying a home,"Hey guys! I realize this question has literally books written on it but I couldn't think of an easier way to sum the question up. Here goes!

My fiancee and I are looking to buy a home within the next year. I recently paid off all my student loans and am 100% debt free (yay) so I'm able to set aside a good portion of my monthly income to save for the down payment. 

Here's where it gets tricky though. I have never had a credit card, stubbornly refuse to if it can be prevented and was told by a mortgage refinancing specialist at my bank that all the years I was keeping up to date with my student loans count for nothing as they can only impact my credit negatively if I stopped paying. As a result, it seems like I have really no credit since I've never otherwise had a car payment or any other debt. She's self-employed and her income isn't really substantial at this point. She also has some credit card debt and for a number of different reasons, her credit isn't the greatest. Our current plan is to not include her on the loan as it would just serve to hurt our debt:income ratio. 

So I guess my questions are thus: 
1) Is it true that student loans don't impact credit? Honestly, whenever bankers at my bank (Chase) talk, I just assume it's a sales pitch and that anything they tell me is just bullshit to hurt me and help them. 
2) Is it actually worth opening up 2-3 lines of credit via credit cards and keeping them active for 2-3 years (cards that I have absolutely no use otherwise) just to save a few points on my interest rates? I realize that over 15 years, little points add up to hundreds, if not thousands but I really hate the concept of credit and would like to avoid it.
3) Am I overreacting in my hatred of credit cards? I really strongly feel that they're just ways to kept people in debt and the fact that I feel forced to use them to prove I am good with credit in order to acquire more credit is asinine when the only credit I need in the first place is for a home loan. Maybe I'm wrong though?

I realize this is a lot but as someone who is trying really hard to be financially responsible, any sound advice will be taken to heart. Thanks for your help!

edit: Apparently I was mistaken slightly. The fiancee has informed me that her credit isn't necessarily bad, she just has debt.",finance,1359757759
personalfinance,"Co-signed on a Signature Student loan years ago, any way out of it?","I did a dumb thing 5 or 6 years ago, I co-signed on a Signature Student loan (private loan) for my girlfriend, the relationship fell appart shortly thereafter.  The loan is at a variable interest rate (6.25%) and is up around $32K at this point (she's still in school).  

I'd like be removed from this thing- I thought that a consolidation would do it, but Signature loans can't be consolidated with federal loans (only other private loans?).  Anyone have any other, non-consolidation ideas?  

Thanks",finance,1359754704
Banking,Forecasting Bank Deposits,"I am interested in forecasting bank deposits using a Genetic Algorithm similar to what is described in the following link:

http://www.wiphala.net/research/proposal/papers/genetic_algorithms_in_forecasting_commercial_banks_deposit.pdf

I have a simple math background and have some experience with basic regression forecasting.  There are many reasons that normal regression is insufficient in forecasting bank deposits but the most important is that the variables (ie LIBOR, Fed Funds, US Domestic GDP, Unemployment, etc.) are all very corellated to each other thus cancelling each other out.  Can anyone recommend good software (preferably a free excel add in) that can help?  Also, the article above is relatively technical and I could use some help breaking down the process into pieces that can be explained simply.  Thanks.",finance,1359745157
personalfinance,Is it worth contributing to my 401k (employer matched) before paying off my student and car loan?,"I have an employer match of 25% of what I put in up to 6% of my pay. Right now I put in that 6% pay. 

I have a student loan that I don't *have* to start making payments on until 2015 although I wouldn't mind knocking it out before then ($5,249 at 3% interest). The interest doesn't start until 2015. 

I have a car loan through my credit union at 4.75% of $8,732.49 on a 60 month plan (payments - $167/mo).

I don't make a significant amount of money, $17.50/hour full time with partial benefits. My father is helping me out with the school loan some.

Is it okay to be putting money away in my 401k? I figure my returns on it overtime will significantly outweigh the low interest rates on both of my loans although I haven't done the math.

I don't have any other debt, I use a credit card but pay it off in full each month to help build my credit. Otherwise, that's everything above.",finance,1359742124
finance,February Starts with Market Euphoria - The Fed and the Unemployment Debate Weigh into Equity Performance,,finance,1359740296
personalfinance,I have a huge amount of student loan debt.  I'm trying to lower my interest rates (not my monthly payments),"Hey Reddit,

I have a serious amount of student loan debt, and the interest rates are killer.  I'm trying to figure out if there are ways for me to lower my interest rates so that I can save myself some money in the long run. I'm currently trying to pay these all off in under 8 years.  Hopefully less.

I still plan on making the same - if not larger - loan payments every month, I'm just looking for a way to lower these awefully high interest rates  --- dumb mistakes at 18 where I just went with the flow if the student loan system without doing proper research.


I plan on going into my credit union later today to see if they will be willing to give me a line of credit to use to pay off my other debts.  I would assume my interest would be lower this way, but I'm a complete newbie when it comes to understanding personalfinance.

Here are my loans roughly itemized:

- Loan 1 = $6,722.29 @ 9%   -- paying $173/mo

- Loan 2 = $4,139.87 @ 6.8% -- paying $51.86/mo


- Loan 3 = $25,942.72 @ 5ish%  -- paying $230.42/mo

- Loan 4 = $14,108 @ 8.25%  -- paying $194.57/mo

- Loan 5 = $7,220.58 @ 7.65% -- paying $99.44/mo

- Loan 6 = $22,746.35 @ ~6%  -- paying $192/mo

Total payments each month = ~ $941
Total to pay back is $80,579.37

- Loan 1 and 2 were taken out by my parents in their name.  They are parent plus, and a private loan from Sallie Mae.

- Loan 3 is a loan my parents gave to me that they got from a line of credit on their house.

- Loan 5 and 6 are in my name and from the government


I'm paying my parents each month, and they are simply using that money and putting it directly into the loans.


My main questions are - 

- will consolidating to a private loan help me?  

- Will it give me lower interest rates?

- Can I consolidate my parent's loans with the other loans I have?

Any advice, help, or pure information would be extremely helpful.

Thanks you very much!


Edit: if it helps, I make about $60k/yr currently, and am expecting a raise in a few months",finance,1359740080
economy,"In new, final regulations issued Wednesday, the Internal Revenue Service (IRS) said that parents must pay a federal fine under Obamacare if their children or dependent spouses are uninsured for any part of the year.",,finance,1359739764
Economics,"More than 90% of interest rate hedging products sold to non-sophisticated investors did not comply with regulatory requirements, according to a pilot study by the FSA",,finance,1359739456
Economics,"Federal authorities are scrutinizing private consultants hired to clean up financial misdeeds like money laundering and foreclosure abuses, taking aim at an industry that is paid billions of dollars by the same banks it is expected to police.",,finance,1359738495
personalfinance,Car Calculator .xls (Incomplete),"Hey everybody. Subscribed to /personalfinance recently and have found this information to be quite helpful. I am currently looking in to purchasing a vehicle. I created this excel sheet to compare some autos information. I've found it useful, so thought I would share...and can be improved by the wonderful people of /personalfinance.

*MAY HAVE ERRORS! IS NOT COMPLETE :)!

Includes lots of variables that can be changed to your specifics (price of car, average miles / year, price of gas/gallon, projected change in gas $ / year, number of payments, financing interest rate, etc.

Will tell you the estimated cost of car/financing/gas over 10 year period, if car passed ""child car seat check"", estimated cost of monthly payment based on monthly car payment, insurance, gas.

DOES NOT INCLUDE:
- Cost of repairs on the vehicle
- Cost of maintenance like oil changes / tires for the cars

Sorry it is not optimally organized. I have kept adding additional things. Please let me know if you find any errors or glaring omissions I have not considered but could include somewhat easily!

Link: https://docs.google.com/file/d/0B6YDi5H062EsUWtYZ0NrMnNvYUk/edit",finance,1359738492
personalfinance,"Should I use most of my savings to buy out my lease? Or should I just finance it? (US, FL)","I'm going to be keeping my 2010 Honda Civic at the end of its lease(I know leasing wasn't a good idea in the first place, my mom talked me into it). The payoff amount is about $12k. I make $45k/year, I'm recently married and my husband makes ~$25k(not sure the exact amount, his hours vary). We would like to buy a house in the next couple of years, and have talked about only keeping one car(his is a lease right now as well, we'd only keep mine).

I have around $15k as my savings/emergency fund in case I lose my job, plus a cushion of about $2k for ""emergencies"" that aren't real emergencies that would justify touching the $15k. I also have &lt;$3k combined in my 401k and other investment accounts, and something like $5k in stock units that will vest this year(if that even matters). Neither my husband nor I have any credit card debt or student loans, I believe he's got around the same amount in his accounts as I do. Our finances aren't combined, but I just want emphasize that if I do use my savings and an emergency happened we wouldn't be completely screwed. Currently, I'm able to put aside about $1k/month between my savings and various ""pots"" I use for things like gift funds, vacation funds, shopping funds, etc. My car payment is $250. I think that's all the relevant info.

My question is, would it make sense to wipe out $12k of the $15k in my savings account to avoid a car payment? I would immediately(and aggressively) start rebuilding my savings in that case. Or would it make more sense to finance it, putting a couple thousand down and being left with a relatively small payment? It looks like the interest rate would be somewhere around 3%. I haven't applied for financing or anything, I'm kind of lost on how to go about that as well... and I just made my last payment, so I have less than a month to figure out what I'm doing.

Edit: Just want to add since I've seen this suggested before -- turning the car in and buying a cheaper used car is not an option for me. I work from home and the main thing I use my car for is to travel long distances(usually by myself). My car is reliable/safe and gets decent gas mileage, so I would rather not downgrade.",finance,1359738093
Economics,"""..if you bought a gold bar today, it is possible that it is a bar that was shipped from the Bundesbank to the Federal Reserve decades ago and is presently listed by the Fed on its balance sheet as “gold and gold receivables."" /r/Economics, how true is this article?",,finance,1359720633
personalfinance,"Where should I put my money? 24 years old 60k+ saving, 6 figure salary.","I've already done a bit of reading on this subreddit about people in similuar situations. I think I have a decent grasp on what to do, but just wanted to get some feedback on if my plan is sound and there's a few questions I'd like advice on.


Background - I am 24 years old. I was lucky enough to graduate college with zero debt a little less than 2 years ago thanks to both my parents and some summer internships that paid extremely well. And again I was lucky enough to immediate get a full time job that pays 6 figures after bonuses. (I'm a software engineer at a top tier company.) 


In the last year and half I've saved about $60K, that is currently split in checking and savings accounts with Bank of America. My checking's account is a some ""advanced tiered account"" so it basically pays same amount of interest as my savings account anyway. Not that it matters as the interest rate is so low I don't even get a full dollar each month. I have another $10K in a 401k with Vanguard set up with my job. I've so far been only contributing up to what my company matches, which is 4% of my salary. I have another few thousand in stock on an account with Charles Shwab. This amount is expected to go up significantly as more stock vest and our annual bonuses are usually paid in stock as well. So far I have not sold any of the stock yet. 

I buy everything with a credit card (yay cash back!) and pay the full amount every month. 


I'm single, no car (live + work downtown), rent an apartment by myself. no loans no debt.


future plans (next 3-5 years): no idea. I might buy a house/condo in a couple years if I decide that I won't be moving to a different city for a long time. I'd like to take 6-12 months off for a ""sabbatical"" in 2-3 years. Probably travel the world or some shit like that. I'm confident I can get a new job any time I want. I currently have no plans to purchase a car but that could change if I end up moving where I can't walk/bus to work.


So here is my plan


Max out my 401K, I've been only putting in up to whatever work will match. I have more than enough savings so there's no downside not to max it out from what I read here. That right?


Keep $15k in checking/saving. My monthly expense is currently ~$3k. But that's cuz I've been lazy and don't cook and rent is pretty expensive as I live in a downtown area. If a emergency really comes up I can bring that cost down a lot so $15k is more than enough. Might even consider lowering this to $10k.


I read on here that it's not too late to get a 2012 IRA to save some taxes. Can someone give me a little more detail on this? Limit is $5k? Does it matter where I open this IRA account? Is there a recommendation? What is my deadline for getting this set up. I'm assuming I should get this done before I file my taxes. 


What about 2013 IRA? I read some recommendations for Roth IRA. It's $5500 limit starting this year right? Same questions as above, does it matter who/where I get this with. Pro and Con for regular vs Roth IRA for this?

My stock from work. I'm going to start selling them as soon as they vest. The idea is that I'm already heavily invested in the company by working there, I should diversify rather than keep more investments there. I personally think the stock for where I work is growing strong but it's still better to diversify instead of putting all my eggs in one basket. Do people agree with that?


Ok, everything else, so basically $35k + any money I save from now on. Oh and + the stock money if I sell them. I should be investing them. This is where I'm not entirely sure what's the best way to diversify. I'm fairly young so I probably want to lean on the riskier side. Should I just pick a comprehensive mutual fund and put it all there?


Something like [SWEGX](http://www.schwab.com/public/schwab/investing/investment_help/investment_research/mutual_fund_research/mutual_funds.html?path=/Prospect/Research/MutualFunds/Summary.asp?symbol=SWEGX)
 or [SWHGX](http://www.schwab.com/public/schwab/investing/investment_help/investment_research/mutual_fund_research/mutual_funds.html?path=/Prospect/Research/MutualFunds/Summary.asp?symbol=SWHGX)

or should I just pick a bunch of index funds myself? like
SWPPX, SWTSX which follow S&amp;P 500 and Dow Jones? 


Also where should I get my mutual funds from? I already have a investment account with Charles Shwab due to my company stock set up with them. But people seem to recommend vanguard a lot more on here. 

Oh, and should I switch to a credit union? I hear interest I get with a credit union is much better than with a bank.

Are there anything major that I missed? Any other tips or suggestions for how to manage my money? 


Thanks for all the help guys.",finance,1359702682
personalfinance,Coming from r/frugal for some advice,"I'm not sure if I'm on the right board, but this seemed like the best match for related boards to r/frugal.

I decided that I want to get out of credit card debt.  I have 5 cards, each w/ various limits.  I crunched numbers today and found out that I'm almost 4k in credit card debt!  I have some friends who've gone through their bank/credit union to get a bank loan in the amount that they need to pay off all CCs and then they pay back the bank at a much lower interest rate (25% for CC and 10% for bank loan for example).  

Has anyone ever done this? Will it hurt my credit to close all of my accounts and then take out this loan?  

I have decent credit, have only made a late payment maybe 5 times in the 9 years I've had credit cards.  I don't really need them anymore and I'd prefer to pay them off ASAP and this seems to be the quickest most cost-effective way b/c it seems like I'm barely making a dent even though I make more than my minimum payment each month.  My most ideal goal would be to also have the bank loan paid off by the end of this year.

A little bit of personal information if it helps: I'm 26, female, college grad, no student loans, working about 20 hours a week at $8 p/hr.

Thank you in advance and I apologize if this is the wrong board for such threads.",finance,1359699577
gaming,Prt1 of a 3prt story on my DayZ experiences of two particular full days of playing. Anyone out there excited for the standalone?,"I just love this game. I don't know if it's the adrenaline I get from the unknown, or the idea of survival, using your wits to stay alive, fed, hydrated, and not a zombie.

--------------------------------

My story starts in a city....

It is the middle of the night. The moon is shining through the windows of the hospital that I had just gotten to a few hours before. This place was still new to me. It was an eerie feeling seeing the empty streets outside in the town with the occasional brain eating citizen ever few yards. The swing set in the local play yard could be heard screeching in the wind now and again. I truly felt alone.

I walked outside of the single patient room that I had hid myself in, and headed down the dark hallway of the first floor. Loot! Finally canned beans! ""Who would leave this here?"" I asked myself in a whisper at my monitor as I scoffed it down like the hungry alone animal I was. I considered the possibility that there were more things for me to find in this place and continued searching in the hallways and rooms.

I had a decent collection of materials now. Blood-packs, bandages, painkillers, soda; enough to keep me alive. There was still one need that I had to fulfill. Human contact. It was time to try. I headed to the second floor. I could swear it was darker here than the last floor. I stumble away from the staircase only to fall off the balcony, breaking at least one of my legs. I spend zero time hesitating to check my gear for morphine to resolve the new situation; none. I look up out of my bag to see a zombie limp past me as I lay exposed in front of the opened main doors. My own adrenaline fuels the speed of my reactions now. I react quickly again, pulling myself to and up the staircase once again, making sure to avoid the same mistakes. I make my way into a room on the north facing side of the building and pull out my flashlight.

I suppose I do realize now the danger of revealing a position when you are alone. There are people out there looking for that same thing you want, survival, but some people do it at your expense. I lit my flashlight up and sent a pattern of flashing beams to the other buildings across the courtyard our front. No response... I flash them again, this time higher up. No response.... In one more attempt I shine at a large building to my right, shortly followed with the sound of pellets breaking through my window and hitting me in my arm. I fall to the floor bleeding and without usable legs. One step at a time.

I patch up my wound and stay laying down under the windowsill for 10 more minutes. Occasionally bullets whiz through the window a few more times, confirming to me that he cannot see any better then I can. I crawl out of the room and make my way up to the third floor where I find roof access. I can wait in here with nothing but my pistol or see what lies on the roof for weapons. I try my luck with the roof. I crawl out to the roof, and the moonlight shines on my back. ""This place is beautiful,"" I realize, in an apocalyptic, dark, kind of way.

Oh but whats this?! A double barrel shotgun. A defensive weapon for a broken legged man? I do think so. I slowly inch my way to it, knowing that at any second, the man who shot at me could see me, and my trip would be over....I got it! Excited, I back myself away, behind the roof access walls, making me exposed only to the south, east, and west, enough food to last me the standoff.

My adrenaline rushes at every sound and creak that I hear. My hand trembles on my still mouse, and I bite the skin off my lip in anxiety of the situation. Then I hear it. Footsteps. Getting quieter though...wait no. They are getting louder. He is on the steps. He must be on the steps. Louder...closer....THERE, in the window of the roof access room, I can see him passing down the hallway to the roof. I pull up my shotgun. This is it.... He comes around the corner... Off goes my gun. Once, BAM. Missed just to the right of the shoulder. Agitated he fires back with his pistol. Strange. That is not the weapon I was being fired upon with earlier. BAM, second shot, missed again! I am regretting the choice of the shotgun from hell, and quickly fumble my way though my gear to try to get out my pistol as well while he is reloading. He heads back through the hallway and gets out through the other end, onto the roof. I wasn't quick enough, and he arose as victor. My enemy had won.

A new day dawned and I felt like I did not just respawn .... but instead was sent back for a purpose. That purpose was clear, and I set off, with my marker on the hospital set for my GPS.

--------------------------------

There is another days worth of activities that I think gets even more exciting, but this is what I felt like typing up today. I really hope you all enjoy it :)",technology,1359697687
personalfinance,"Tax Payment Plans: Do they exist, are they helpful?","So, in what is obviously a huge, burdensome problem, my wife and I are unfortunate enough to have doubled our income in the last year. As such, we're facing a much larger federal tax burden than ever before which has caught us by surprise. Pretty sure we were too busy rolling around in piles and piles of disposable income to notice.

By the time 18Apr rolls around I'm sure we can put together the owed amount. However, for cash flow purposes, it sure would be nice if we didn't  **have** to. This got us thinking and talking about the possibility of a payment plan. We figure if the IRS would let us pay the bill over, say, six months for free or at some laughably low interest rate then perhaps we could take them up on it. Maybe.

I've done a bit of research and see that payment plans do exist and appear easy enough to apply for. However, I can't seem to find solid information on exactly what doing this would cost. There is a flat application fee with the IRS but I'm getting conflicting information on what, if anything, is charged on the actual balance. 3% has been floated around but I'm not sure.

So! Any experience with this? Any knowledge? As I said, I don't know that we particularly want to take advantage (or be taken advantage) of such a program but for the sake of knowing what's out their I'm curious. What do you know?",finance,1359696360
