subreddit,title,selftext,sector,created_utc
economy,Why are wages as a percentage of GDP at an all-time low? Shares of gross domestic income at their lowest levels since the Fed started keeping track in the 1940s.,,finance,1372721442
Economics,Why are wages as a percentage of GDP at an all-time low? Shares of gross domestic income at their lowest levels since the Fed started keeping track in the 1940s.,,finance,1372721398
business,Why are wages as a percentage of GDP at an all-time low? Shares of gross domestic income at their lowest levels since the Fed started keeping track in the 1940s.,,finance,1372721375
news,Catch-22 Taper? The Market Has Never Been More Reliant on the Fed as it is now responsible for monetizing a record 70% of all net supply measured in 10 year equivalents.,,finance,1372719935
politics,Catch-22 Taper? The Market Has Never Been More Reliant on the Fed as it is now responsible for monetizing a record 70% of all net supply measured in 10 year equivalents.,,finance,1372719911
economy,Catch-22 Taper? The Market Has Never Been More Reliant on the Fed as it is now responsible for monetizing a record 70% of all net supply measured in 10 year equivalents.,,finance,1372719846
Economics,Catch-22 Taper? The Market Has Never Been More Reliant on the Fed as it is now responsible for monetizing a record 70% of all net supply measured in 10 year equivalents.,,finance,1372719824
Bitcoin,Amazing,"It's amazing that the same people that vilify the government think the government has no hand in dropping the price of bitcoin repeatedly to discredit it and create panic.

If I'm a government slave to the Fed, I'm going to take a few million buy a lot of bitcoins and then sell them all at once at market price.  Wash, rinse, repeat.  It is so easy to discredit this tiny, tiny market.",cryptocurrency,1372719149
personalfinance,I could use some advice on places I could trim my budget.,"I could use some advice on places I could trim my budget.  

I make 120k per year and I feel I should be able to have more buffer between my income and my expenses or more specifically, I feel that my ""needs"" category should be a lot lower than it is (it is currently 56%).
Notes:
I  live in southern California  and I have 3 girls in diapers so my household/groceries is high.
Mortgage: I have a 15 year fixed mortgage
Federal/state taxes are not shown below (but I obviously do have to pay them) 
I have $30k in my emergency fund and am trying to get that up to $50k

My monthly budget:
Salary					$10,000.00
Mortgage				$1,685.00
property Taxes			$350.00
401k (not including matching)	$564.00
ROTH					$350.00
Household/groceries/diapers	$1,100.00
clothing				$100
Car maintenance			$200.00
giving					$940.00
gas					$150.00
Health Insurance			$440.00
Dental				$44.00
Entertainment			$75.00
Food dining out			$160.00
Savings				$1,200.00
Vacation				$100.00
cash					$75.00
auto insurance			$100.00
homowners ins			$50.00
internet				$60.00
electric				$160.00
water					$80.00
pool services			$95.00
cell phone				$100.00
Edits:	
Take home pay is 7,228 per month net after health insurance, dental, 401k (not roth), federal and state taxes.
I am married, my wife does not work.
Household includes groceries, baby stuff (diapers/wipes etc), other misc (paper towels, TP, cleaning supplies)
Giving is for local church. I could probably scale that back.
Cell phone is for my wife. It is our only phone and she has a data plan. Yeah that could also be reduced.
Pool services includes all chemicals and cleaning the filter. Yes this is probably an area that we could target.",finance,1372717779
personalfinance,Ideal way to finance this?,"I'm currently on a 75k Salary, only debt is 10k on my car, single no kids.    

Found a ""investment"" property for 75k on lakefront property. Has a septic pump issue, door issue, carpet and appliances issue. Will need to replace all of those. One of the foundation walls is also ""moving"" which is negating many loan qualifications.     

My step-father does construction and contracting and is willing to do the repairs needed. Says about 25k should be more than enough to cover all the repairs. So 100k + closing costs or what not. Houses in the area currently valued around 200k+     

So the real question is, what's the best way to approach financing this endeavor if I want to go in on it. It was suggested I get a short term construction loan, make the repairs, then re-fiance. However, the higher interest rate scares me a bit. Is there a better way to go about this?    

Sorry if the formatting stinks, I mostly just lurk, rarely post.",finance,1372717260
technology,Feds demand child pornography suspect decrypt hard drive before his memory fails him.,,technology,1372712006
news,It happened. Student Loan Interest Rates Doubled today. :(,,finance,1372711968
personalfinance,"120k Student Loan Debt, living in Boston, making about 24k a year. Need advice.","Hi all! Here are the basics:

* 90k in debt between 3 private lenders ($700/month min)
* 30k in debt in direct federal loans ($300/month min)
* Rent and utilities every month runs me ~$860
* I make about 24k a year waiting tables, but will likely in the next 6 months be able to find a job making in the neighborhood of 40-50k.

Anyway, I had been squeaking by, making minimum payments on my private loans ($700/mo) with the intention of aggressively paying off my loans as soon as I came into a better employment situation. Then, I got a call from Federal Loan Servicing telling me my payments are 3 months behind ($1,200) on the four federal loans that up until that time I was unaware I had. Eek.

Obviously, since I was barely making it when I was unaware of my Federal loans ($300/mo), there is no way I can make it with them. So I ask you folks, what are my options?

What is the likelihood of being able to receive some sort of forgiveness/forbearance/deferment on some of my loans? And should I seek that forgiveness/forbearance/deferment from my private lenders or from my Federal lender?

There are also other repayment options (Graduated/Extended/Income-Contingent). Would any of these be a good idea?

What about loan consolidation?

Many questions, I know. There is just a lot going on with many lenders and I'm not even sure where to begin. Thanks in advance.

PS- I'm heading into work soon, but will be checking Reddit from my phone.",finance,1372709160
personalfinance,Is there anything that can be done about my student loans from 2003-2007?,"I was in college from 2003-2007. I have several outstanding loans totaling about $33,000. I make payments to four separate companies: Sallie Mae, Mohela, American Education Services, and My Campus Loan. Some are private, some are not.

Is there any sort of low interest rate consolidation program that I can take advantage of to lower the rates I'm paying, as well as reduce the amount of companies I'm paying down to one?

I'm currently paying rates between 4.5-5.75%, depending on the particular loan dispersal.",finance,1372705739
personalfinance,"[Student loan] I have some student, should I take on more and invest my savings?","I'm going to be a sophomore at a college whose diploma is ranked as having the 22nd highest average starting salary in the nation by Forbes; my own major has a median starting salary of $62,485.

This year I have to pay my tuition myself, however, after scholarships, I only need to cover $6,500.

Luckily, I qualify for exactly $6,500 in unsubsidized federal loans, but I have already taken out $5,500 for my freshman year. Additionally, I have been doing nothing but working this summer (two minimum wage jobs, roughly 50 hours a week) and will have saved $4,500 to pay for school.

So, my question is this: should I spend all of my savings on school and cover the rest with $2,000 of fed loans, or take a higher amount of loans and try to invest my savings to try and get a return?

It is worth mentioning that my parents are covering my interest payments until I graduate, and I will most likely get an internship next summer in which I can expect to make enough to cover tuition the following year. 

Edit: I also work 20 hours a week during the school year, which allows me to make roughly $2,200 a semester, but I typically spend the majority of that money on food/trips/fun things.",finance,1372705393
Bitcoin,U.S. feds make their first-ever Bitcoin seizure,,cryptocurrency,1372698589
politics,Time's Up: Student Loan Interest Rates Set to Double,,finance,1372698400
Bitcoin,Litecoin will go up until a new Bitcoin rally.,"A theory for your consideration:

When the Bitcoin price is going down after an influx of newbies, mass hype, bubble and crash most traders hold usd while waiting for a buying opportunity at the bottom of the crash. But dollars are a pain in the ass to move around, especially if you've become accustomed to the speed and ease of Bitcoin. Seasoned traders and principled individuals who don't want to touch Federal Reserve Notes at all will increasingly choose to buy litecoins during a bitcoin downtrend, instead of the trusty ol' dollar.

**TL;DR** Litecoins are easier to transfer than usd, therefore the demand for litecoins will increase due to traders choosing to hold them instead of dollars when the usd/btc rate is going down.",cryptocurrency,1372698262
politics,"Interest rates on new college student loans double, but Congress could restore low rates later",,finance,1372696889
news,"Interest rates on new college student loans double, but Congress could restore low rates later",,finance,1372696856
politics,Student loan interest rates double without Congress action: How it impacts the economy,,finance,1372693206
news,Congress Allows Student Loan Interest Rates To Increase!!!!!!!!!!! CRUSHING OUR DREAMS AND LEADING TODAY'S YOUTH TO POVERTY!!! WTH???!!!,,finance,1372692345
Economics,The all-powerful Fed,,finance,1372686000
politics,Competing Congressional plans to fix student loan interest rates miss July 1 deadline as millions of students grapple with over a trillion dollars in debt.,,finance,1372680640
gaming,How to kill fed Jayce,,technology,1372676256
Bitcoin,"Bitcoin compliant: Mt. Gox registers as money service, seeks federal blessing to continue operations",,cryptocurrency,1372671734
gaming,"I'm sorry, but ""Ryse: Son of Rome"" looks like utter shit. I'm really sick of the quick time event fad and hope it'll die soon.","If you're ordering ""Ryse"" for a preorder when AC4 is also launching then you're crazy.

I just watched the demo videos of that turd and i can see myself getting pretty fed up with all the quick timing button mash-ups in literally less then 5 minutes.

Why are games still bastardizing this play concept?! C'mon people, you're supposed to be creatively better then this!",technology,1372666202
personalfinance,Strange letter from my bank.,"I am currently buying my house from my bank on land contract. this came about due to the home being owned directly by the bank at the time i bought it.  I am fine with the terms and plan to set up a traditional mortgage on the balance in a couple of years when the principal is paid down a bit.  Recently i received the following letter:

Dear Mr. Groundscore,

Derp Bank is please to advise you that we will be renewing your current land contract purchase agreement and converting your account to a regular mortgage loan for the remainder of the current term.  This will involve the bank giving you a deed to your home, and cancelling the land contract to replace it with a promissory note and mortgage in the amount of the remaining land contract balance.  You are pre-approved; there will be no cost to you for this conversion of your land contract to a deed and mortgage.  The interest rate, and amortization term will remain exactly the same as your current land contract and your monthly payment will remain as close as possible to the current amount.

We will, however, need to ask yyou to come in at a convienent time for a closing on the new documentation.

Please contact Derp Derpington at a phone number or email address, Our department manager at your earliest convience to complete the process and set up a closing appointment.

Sincerely, 
Some Guy


So now the obvious questions, can they do this without my permission? Is it in any way to my advantage to do this? (i know rates are going to go up) should I shop around for a better deal? Basically what the hell should i do?


tl;dr

Got a letter from my bank informing me they are changing the terms on my house, what to do?",finance,1372656718
gaming,Live Soccer &amp; Cricket News Update: Brazil beats Spain 3-0 to win Confederations Cup,,technology,1372652089
personalfinance,"Got notice from collection agency due to parking ticket, is it better to fight it or pay it to protect my credit","I think the debt is probably bogus. It's from a school that I went to more than 5 years a go. But I have good credit and I very much want to protect that.

This is the first time I have heard of the (very small) debt and I am worried it has been damaging my credit for the past 5 years.

I know that under federal law I can force them to show me evidence of the debt. And that will probably make them drop this issue completely. But I am worried that doing this will do nothing for the credit bureaus. And that's the only thing I care about.",finance,1372650921
personalfinance,Age 29 with 300k annual income. Running out of investing ideas.,"I'm 29 with approx. 300k in annual income from self-employment. I have been contributing quite a bit to SEP-IRA for a few years. I have $166,000 in SEP-IRA. Last year, I contributed the maximum $50k, and this year, I am considering to contribute another 50k. The retirement money is invested in Lifecycle 2050 funds.

The problem is that I feel like I'm locking away a very large portion of my income into a retirement account where I wont see the money for 30+ years. If I want to go invest into a new business or something else -- that money is locked up and practically untouchable without significant penalties.

On the flip side, I feel like I'm wasting a HUGE amount on taxes by not maxing out the SEP-IRA. With my fairly high income, and high tax bracket, if I don't put 50K into the IRA I pay probably close to $20k in additional taxes (huge waste).

I own a home with a $500k mortgage on it. (put 20% down) and 3.8% interest mortgage rate.

Other than my home and SEP-IRA, I'm not really investing into anything else. I was considering to start buying up some gold with the value near $1,200 now.

Any ideas from the experienced investors here? Should I continue to max my IRA and lock my money away, or are there better investment techniques I should consider that won't keep my money locked up for 30 years but still minimize my tax burden?

I currently pay about $100k per year in federal and state (combined) taxes.",finance,1372648344
politics,Debt Crisis could worsen on increase in student loan rates and rise in interest rates,,finance,1372645507
investing,This is how well people predict interest rate directions [graph],http://oi42.tinypic.com/350a4d5.jpg,finance,1372640314
personalfinance,Mistakenly thought my student loan was in deferment - now credit score is a wreck,"Let me begin by saying I'm an idiot. 

I thought my student loan was in deferment (I'm unemployed and looking for work). I called up a nice loan officer and I filled out the stuff online that he recommended stating that yes, I'm broke. (Apparently, I did screw up here and state that I was making $200 a month teaching private music lessons - just trying to be honest.)

So I thought I had taken care of things, but after checking my credit report today, I have 5 months of 30 day late payments for my FedLoans. I plan on calling a loan officer tomorrow to see what I can do (I'm still unemployed). Is there anything I can do to get these late payments removed from my score? (They've lowered my score by about 100 pts.) Can I beg for a Goodwill Adjustment? Am I just screwed?",finance,1372638147
personalfinance,I need $5k before August 1st or else I can't go to college. How do I get it?,"I don't have any savings or skills or valuables I could sell.  I could set up a payment plan of 10 annual payments, but that might have me paying anywhere between $500 and $800/mo, neither of which I'd have any way of affording.  

I have no idea what to do and I'm panicking a lot.  I don't know if I'd be eligible for a loan that size (I'm 20 and have no credit), and if I was the interest rates would be through the roof.  The school has already paid so much of my way (total tuition is among the highest in the country) and I've already invested so much time and money into it that I can't just go to a different school.  I have $240 to my name and I expect to have to spend that on food and rent before I even get to the school.",finance,1372806438
investing,Should I dump my current bond funds?,"With the impending rise in interest rates looming on the horizon, should I get out now, minimizing losses, and reinvest in shorter term bonds that aren't so exposed to increases in interest rates?

Right now I'm down a little under $200 on a $3k investment (yes, I accounted for ""dividend"" reinvestment). I anticipate going forward the bond market is going to crash since a lot of bonds have been overvalued with the Fed's QE and near zero interest rates.",finance,1372805617
investing,"Canadian Programming Student with $10,500 to invest. Help?","My goal is to buy a small house (Bungalow hopefully) for my girlfriend and I. I live in Ottawa, Ontario. My neighbourhood is Orleans. By the end of the summer I should have $15,000 saved. I've thought of putting it in a High Interest Tax Free Savings account with TD with a interest rate of 1.05%. I've also heard People's Trust has a 3% interest rate(I find it sketchy though). I've been told Mutual Funds are good too. What would people who actually know what they're doing would do?",finance,1372804932
gaming,Fedex finally dropped off my repaired PS3,,technology,1372804069
Economics,The Fed Is Paying Banks Not To Lend,,finance,1372803738
personalfinance,22m recent college graduate with $60k debt and a medical issue. Annual income $31k/year. No matter how I do the math I'll be losing money when I start having to make student loan payments.,"Currently working three minimum wage jobs in the Boston, MA area. I average about 75 hours a week. 

Average monthly income: $2600

CURRENT EXPENSES: 

Withholdings: $728

Rent (includes all utilities and internet): $900

Health insurance and co-pays: $625

Cell phone: $10 (pre-paid)

Transportation: $70

Food: $100

That leaves $267 left for savings and other expenses.  

Next month student loan payments start and I am losing sleep over it. $30k of my debt is federal and eligible for IBR and $30k is private. This results in a $160/month payment on the federal loans and a $345/month payment on the private loans. I'll need to make another $238/month just to break even. I'm honestly at a loss of what to do. 

In hindsight I know it was foolish to get into so much debt but I thought getting a chemical engineering degree would pay off. Sadly I haven't gotten anywhere near an offer for a real engineering job and I'm stuck making minimum wage. I honestly don't think I'm physically capable of working more hours. Monday-Friday I work about 14 hours a day plus spend 3 hours commuting to and between jobs. I come home and collapse on my bed and sleep until it's time to go to work again. I'm trying to find another job for weekends but it's tough because I'm competing against high school and college students for those jobs plus I need time for doctors appointments (I was very fortunate to find a place that's open Saturday mornings). I feel I've cut my costs as much as humanly possible. I never eat out, I buy day-old food that's on sale at the grocery store, I have a pre-paid cell phone and I never text anyone, I never do anything that requires spending money that's not necessary to live or work. I could probably cut internet and get a small discount on my rent, but then it would be harder to apply for jobs. 

I have $2000 in savings, and some people have suggested I use that money to pick up my things and move to an area with better employment opportunities and lower living expenses like Houston. My fear with that is that if I don't find a job soon after moving I'll end up literally homeless and possibly dead from not being able to afford medical care.

Any advice?",finance,1372801731
personalfinance,"My student loan servicer sent statements to the wrong address, now I'm in default.","This is kind of a long story so hear me out.  I took out a number of student loans to finance my college, and attended 3 different schools by the time I graduated.  One of the loans I took out was a Federal Stafford Loan.  I graduated, got a job, and started receiving information on paying back my loans.  I started making payments to 3 different loan processors (Sallie Mae, Nelnet, and ECSI).  Never missed a payment, no problems.

I got a letter in the mail (to my parent's address) saying I was late on paying a student loan, and gave me a person to call at one of the schools I attended.  I called the number, and it was disconnected.  I called the school directory and asked for the name listed on the letter, and the school said they didn't have anyone there by that name.  I started thinking the letter was a scam, and disregarded it.

Several months later I get a call from Williams &amp; Fudge (Debt Collectors) saying I have a student loan in default that has been turned over to them.  I told them I'd look into it and call them back.  I called the school, and they said they don't service their loans but to check NSLDS to check the validity of the debt.  I looked the loan up on NSLDS and confirmed it was valid.  ECSI is the school's loan servicer, so I called ECSI to ask them about the loan.  They were sending the statements to my former address, which explains why i never received them.  They never attempted to find my current address, phone number, or anything (saying it was not their responsibility), even though I have been making payments to them for almost a year on a loan from a different school.

I talked with ECSI and the school, explained the situation, and offered to pay the past due amount if I could repay without getting collections involved.  They refused, saying their policy is that once they have turned an account over to collections, they don't deal with it anymore.

So I called back the collections agency.  The original loan was $2000, but they added about $100 in interest and $700 in collections fees making the total balance about $2800.  They said I have 3 options, pay the full balance now, pay the full balance in 9 months, or consolidate this loan with my other federal loans under the Direct Loans program.  I didn't have $3k to cough up, and don't have the budget for an extra $300/mo student loan payment, so I told them I would opt for the consolidation.

Williams &amp; Fudge sent me the loan application.  I completed it and mailed it to them.  A month later, I received another application from Direct Loans, asking for my tax return and paystub.  Apparently, if you are consolidating a defaulted student loan you must apply for Income Contingent Repayment.

So this is where I'm at, and I really feel like I'm being taken advantage of.  First, ECSI sends statements to an old address.  Through 6 months of not receiving payments, they never made an attempt to find a current address, or call me.  I know they had my current information on file, because I was making payments to them on a loan from a different school.  6 months later, they turn my loan over to a collections agency, who charges me a $700 collections fee.  My student loan payments are already $450/mo and I don't have the resources to fork out another $350/mo to pay the defaulted loan back in 9 months, so I'm forced to consolidate.  Now I have to consolidate all my federal loans under an Income Contingent Repayment.

I have several questions, and am looking for advice from anyone who might know more then me about the student loan process.

Do I have any legal ground to dispute the $700 collection fee?
Will my loans now have a higher interest rate since I'll be consolidating after the new doubling of student loan interest rates?
How does the Income Contingent Repayment work?  I saw that the Dept of Ed. can request my tax information every year to adjust my payment.
What would you do if you were in my situation?

If I were a conspiracy theorist, I would say the Dept of Education could be directing loan servicers not to contact borrowers who have missed payments, in hope of the loan defaulting so they can use collections agencies to pressure borrowers into consolidating.  But that would be scandalous, and our government would never do anything like that?",finance,1372796093
personalfinance,Need advice on my financial situation,"I'm trying to get my finances organized and wanted to know your comments/opinions on improving my financial situation. Here's the picture:

29yr old male living in NYC
Salary: $32K
Savings: $500
CC debt: $1200 at 18%
Sallie Mae Student Loan: $34K at ~6%  ($223/mth)
Fed Loan: $22K at ~5.5 -6%  ($213/mth)
Rent: $900/mth
Food: $200/mth
Utilities: $50/mth
Phone: $78/mth
Subway: $112/mth
Car Insurance: $54/mth
Gas: $40/mth

My goal is to get out of debt. Will changing jobs help? I'm trying to get into IT but I think my Bachelors in Economics is holding me back from getting a computer job(I have an associate's in Computer Info Sys). Thank you for your time and help.",finance,1372795063
finance,What do you recommend for someone who wants to become self-educated in finance but has no prior background?,,finance,1372794782
